headline,link,date_str,parsed_date_iso,sentiment_score
Milestone Partnership: L&T and Navantia unite to propel India’s P75 Submarine Program to unprecedented heights,https://www.financialexpress.com/business/defence-milestone-partnership-lt-and-navantia-unite-to-propel-indias-p75-india-submarine-program-to-unprecedented-heights-3163800/,2023-07-10T19:14:12+05:30,2023-07-10T13:44:12,0.0
L&T Finance Holdings profit increases 81%,https://www.financialexpress.com/business/industry-lt-finance-holdings-profit-increases-81-2723003/,2022-10-21T07:45:11+05:30,2022-10-21T02:15:11,0.4404
"LTTS, BITS Pilani, CRENS partner for national security R&D",https://www.financialexpress.com/life/technology-ltts-bits-pilani-crens-partner-for-national-security-rd-3852978/,2025-05-21T23:08:55+05:30,2025-05-21T17:38:55,0.34
"Mid-tier IT firms reap gains from smaller deals; Coforge, LTTS, & Mphasis major gainers",https://www.financialexpress.com/business/start-ups-mid-tier-it-firms-reap-gains-from-smaller-deals-coforge-ltts-amp-mphasis-major-gainers-3793754/,2025-03-31T05:29:24+05:30,2025-03-30T23:59:24,0.34
2 AI stocks down over 40% from their peak – add to watchlist?,https://www.financialexpress.com/market/stock-insights/2-ai-stocks-down-over-40-from-their-peak-add-to-watchlist/3788625/,2025-03-26T06:00:00+05:30,2025-03-26T00:30:00,0.0
IQOO NEO 10R: A gaming phone that is good for everyday use,https://www.financialexpress.com/life/technology/iqoo-neo-10r-a-gaming-phone-that-is-good-for-everyday-use/3786068/,2025-03-23T22:23:08+05:30,2025-03-23T16:53:08,0.4404
Tech majors forge AI tie-ups with Nvidia,https://www.financialexpress.com/life/technology-tech-majors-forge-ai-tie-ups-with-nvidia-3782255/,2025-03-19T22:28:29+05:30,2025-03-19T16:58:29,0.0
