headline,link,date_str,parsed_date_iso,sentiment_score
HUL looks to revamp foods biz after ice-cream split,https://www.financialexpress.com/business/industry-hul-looks-to-revamp-foods-biz-after-ice-cream-split-3824314/,2025-04-27T20:13:39+05:30,2025-04-27T14:43:39,0.0
Who is Peter Brabeck-Letmathe? Successor of Klaus Schwab to lead the World Economic Forum,https://www.financialexpress.com/world-news/who-is-peter-brabeck-letmathe-successor-of-klaus-schwab-to-lead-the-world-economic-forum/3823396/,2025-04-26T15:56:51+05:30,2025-04-26T10:26:51,0.2263
Nestle profit down 7% to Rs 873 crore,https://www.financialexpress.com/business/industry-nestle-profit-down-7-to-rs-873-crore-3821255/,2025-04-24T22:08:57+05:30,2025-04-24T16:38:57,0.4404
"HUL, Nestle Q4 earnings today: 4 key factors to watch ahead of Q4 results",https://www.financialexpress.com/market/hul-nestle-q4-earnings-today-4-key-factors-to-watch-ahead-of-q4-results-3820086/,2025-04-24T09:44:15+05:30,2025-04-24T04:14:15,0.0
SEBI flags insider trading violation at Nestlé India,https://www.financialexpress.com/market/sebi-flags-insider-trading-violation-at-nestl-india-3770807/,2025-03-07T18:37:18+05:30,2025-03-07T13:07:18,-0.4939
Nestle launches first Nespresso boutique in Delhi,https://www.financialexpress.com/business/industry-nestle-launches-first-nespresso-boutique-in-delhi-3769941/,2025-03-06T23:00:22+05:30,2025-03-06T17:30:22,0.0
Maggi Noodles Safety Case: Bombay High Court quashes criminal charges against Nestle,https://www.financialexpress.com/india-news/maggi-noodles-safety-case-bombay-high-court-quashes-criminal-charges-against-nestle/3746414/,2025-02-11T21:52:57+05:30,2025-02-11T16:22:57,-0.4019
"Which stocks to invest in? CLSA bets on Tata Motors, NTPC, Nestle and Britannia",https://www.financialexpress.com/market/which-stocks-to-invest-in-clsa-bets-on-tata-motors-ntpc-nestle-and-britannia-3710217/,2025-01-08T15:52:53+05:30,2025-01-08T10:22:53,0.0
Shrinking middle class hitting FMCG firms: Nestle India,https://www.financialexpress.com/business/industry-shrinking-middle-class-hitting-fmcg-firms-nestle-india-3646982/,2024-10-23T03:30:00+05:30,2024-10-22T22:00:00,0.0
Higher raw material prices may keep Nestle’s growth under pressure,https://www.financialexpress.com/business/industry-higher-raw-material-prices-may-keep-nestles-growth-under-pressure-3643973/,2024-10-19T04:00:00+05:30,2024-10-18T22:30:00,0.1027
"Nestlé CEO Mark Schneider steps down after 8 years, Latin America chief Laurent Freixe named successor",https://www.financialexpress.com/business/industry/nestl-ceo-mark-schneider-steps-down-after-8-years-latin-america-chief-laurent-freixe-named-successor/3590294/,2024-08-23T10:43:30+05:30,2024-08-23T05:13:30,0.2263
Amul named the world’s strongest food brand,https://www.financialexpress.com/business/industry-amul-named-the-worlds-strongest-food-brand-3587967/,2024-08-21T01:15:00+05:30,2024-08-20T19:45:00,0.4404
"Maggi sells 6 billion servings, KitKat 4.2 billion fingers in FY24: Nestle",https://www.financialexpress.com/business/industry-maggi-sells-6-billion-servings-kitkat-4-2-bn-fingers-in-fy24-nestle-3528446/,2024-06-19T01:35:00+05:30,2024-06-18T20:05:00,0.0
"Nestlé, Dr. Reddy’s form joint venture to expand nutraceutical portfolio",https://www.financialexpress.com/business/healthcare-nestl-dr-reddys-form-joint-venture-to-expand-nutraceutical-portfolio-3468138/,2024-04-25T13:53:07+05:30,2024-04-25T08:23:07,0.3182
Children of a lesser God,https://www.financialexpress.com/opinion/children-of-a-lesser-god/3464042/,2024-04-22T05:00:00+05:30,2024-04-21T23:30:00,0.2732
Centre asks FSSAI to initiate action against Nestle after sugar content in Cerelac report,https://www.financialexpress.com/india-news/centre-asks-fssai-to-initiate-action-against-nestle-following-high-sugar-content-in-baby-products-report/3462076/,2024-04-19T13:30:22+05:30,2024-04-19T08:00:22,0.0
Sugar in Cerelac? New report reveals shocking details of how Nestlé is selling baby food in India,https://www.financialexpress.com/business/healthcare-sugar-in-cerelac-new-report-reveals-shocking-details-of-how-nestl-is-selling-baby-formula-in-india-3460224/,2024-04-17T21:07:22+05:30,2024-04-17T15:37:22,-0.4019
"Nestle India expects demand pick up this year, says stress points in FMCG sector still there",https://www.financialexpress.com/business/industry-nestle-india-expects-demand-pick-up-this-year-says-stress-points-in-fmcg-sector-still-there-3388629/,2024-02-09T05:30:00+05:30,2024-02-09T00:00:00,-0.5106
"Nestle India profit up 4% to Rs 656 crore, misses estimates",https://www.financialexpress.com/business/industry-nestle-india-december-quarter-profit-rises-over-4-per-cent-to-rs-655-6-crore-3386870/,2024-02-07T20:17:49+05:30,2024-02-07T14:47:49,0.25
"ITC emerges as frontrunner among FMCG companies in Wizikey Newsmakers Report 2023, HUL, Nestle follows",https://www.financialexpress.com/business/industry-itc-emerges-as-frontrunner-among-fmcg-companies-in-wizikey-newsmakers-report-2023-hul-nestle-follows-3344038/,2023-12-21T11:13:19+05:30,2023-12-21T05:43:19,0.0
"Nestle Q3 Results: Profit zooms 37.3% to Rs 908.08 crore, Rs 140 dividend declared",https://www.financialexpress.com/business/industry-nestle-q3-results-profit-zooms-37-3-to-rs-90808-crore-rs-140-dividend-declared-3277308/,2023-10-19T11:06:37+05:30,2023-10-19T05:36:37,0.4404
Nestle divests peanut-allergy drug on disappointing uptake,https://www.financialexpress.com/business/healthcare-nestle-divests-peanut-allergy-drug-on-disappointing-uptake-3232855/,2023-09-05T07:00:00+05:30,2023-09-05T01:30:00,-0.4939
Nestle aims at expansion of out-of-home consumption,https://www.financialexpress.com/market/nestle-aims-at-expansion-of-out-of-home-consumption-3192790/,2023-07-31T01:40:00+05:30,2023-07-30T20:10:00,0.0
Danone-backed Indian yoghurt maker Epigamia shelves plan to sell inflation-hit business￼￼￼,https://www.financialexpress.com/business/industry-danone-backed-indian-yoghurt-maker-epigamia-shelves-plan-to-sell-inflation-hit-business-3091434/,2023-05-17T16:40:05+05:30,2023-05-17T11:10:05,0.0
Nestlé Health Science launches ‘Resource Fiber Choice’ to improve gut health,https://www.financialexpress.com/life/nestl-health-science-launches-resource-fiber-choice-for-improved-gut-health-3088212/,2023-05-15T13:13:01+05:30,2023-05-15T07:43:01,0.4404
Nestle eyes $1 billion deal to acquire ‘Ching’s Secret’ owner Capital Foods in India,https://www.financialexpress.com/business/industry-nestle-eyes-1-billion-deal-to-acquire-chings-secret-owner-capital-foods-in-india-3027842/,2023-03-31T08:07:45+05:30,2023-03-31T02:37:45,0.0
How many KitKat chocolates did Nestle sell in 2022? Here’s what it did to drive India business growth,https://www.financialexpress.com/business/industry-nestle-cracked-two-things-grow-india-business-got-chocolate-pricing-right-reached-small-shops-3020878/,2023-03-24T12:53:05+05:30,2023-03-24T07:23:05,0.3818
Rajesh Gopinathan of TCS to Suresh Narayanan of Nestle: A look at the educational qualifications of the highest-paid Indian executives,https://www.financialexpress.com/life/lifestyle-rajesh-gopinathan-of-tcs-to-suresh-narayanan-of-nestle-a-look-at-the-educational-qualifications-of-the-highest-paid-indian-executives-3003013/,2023-03-11T13:25:00+05:30,2023-03-11T07:55:00,0.0
Nestle India to continue focus on growth in rural areas amid concerns on rising commodity prices: CMD,https://www.financialexpress.com/business/industry-nestle-india-to-continue-focus-on-growth-in-rural-areas-amid-concerns-on-rising-commodity-prices-cmd-2984543/,2023-02-17T14:22:45+05:30,2023-02-17T08:52:45,0.3818
Nestle India profit rises 66% in December quarter,https://www.financialexpress.com/business/industry-nestle-india-profit-rises-66-in-december-quarter-2983973/,2023-02-17T04:10:00+05:30,2023-02-16T22:40:00,0.4404
Nestle India Q4 results: Dividend bonanza for investors as net profit jumps over 65% on-year to Rs 628 crore,https://www.financialexpress.com/business/industry-nestle-india-q4-results-net-profit-jumps-over-60-on-year-to-rs-628-crore-revenue-climbs-13-2983144/,2023-02-16T12:59:08+05:30,2023-02-16T07:29:08,0.4404
"Nestle to hike food prices further in 2023, CEO says",https://www.financialexpress.com/business/industry-nestle-to-hike-food-prices-further-in-2023-ceo-says-2972401/,2023-02-06T11:19:02+05:30,2023-02-06T05:49:02,0.0
"Unilever’s dominance in India helps it raise prices, pinching rural poor",https://www.financialexpress.com/business/industry-unilevers-dominance-in-india-helps-it-raise-prices-pinching-rural-poor-2958976/,2023-01-24T18:34:13+05:30,2023-01-24T13:04:13,0.0772
"The Bharat Playbook: Britannia, Nestle improve their rural game, more focus on direct reach",https://www.financialexpress.com/business/industry-britannia-nestle-improve-their-rural-play-2886415/,2022-11-23T05:20:00+05:30,2022-11-22T23:50:00,0.4588
Unilever boosts sales goal as it hikes prices more than ever,https://www.financialexpress.com/business/industry-unilever-boosts-sales-goal-as-it-hikes-prices-more-than-ever-2749616/,2022-10-27T14:02:59+05:30,2022-10-27T08:32:59,0.3182
Nestle pledges $1 billion expenditure by 2030 to revamp coffee sustainability amid climate change challenges,https://www.financialexpress.com/business/industry-nestle-pledges-1-billion-expenditure-by-2030-to-revamp-coffee-sustainability-amid-climate-change-challenges-2700332/,2022-10-04T16:39:25+05:30,2022-10-04T11:09:25,0.0772
Nestle India reports 4.3% profit fall as inflation hits bottom line,https://www.financialexpress.com/business/industry-nestle-india-reports-4-3-profit-fall-as-inflation-hits-bottom-line-2610100/,2022-07-29T03:30:00+05:30,2022-07-28T22:00:00,0.4404
Nestle India to acquire pet foods business of Purina PetCare,https://www.financialexpress.com/business/industry-nestle-india-to-acquire-pet-foods-business-of-purina-petcare-2610089/,2022-07-29T03:20:00+05:30,2022-07-28T21:50:00,0.0
"Nestle India seeing ‘early signs of commodity prices softening’, but these items’ costs to remain firm",https://www.financialexpress.com/business/industry-nestle-india-seeing-early-signs-of-commodity-prices-softening-but-these-items-costs-to-remain-firm-2609778/,2022-07-28T18:07:39+05:30,2022-07-28T12:37:39,0.0
Nestle India Q2 net profit falls as higher costs eat away sales growth; here’s how much it earned in Apr-Jun,https://www.financialexpress.com/business/industry-nestle-india-q2-net-profit-falls-as-higher-costs-eat-away-sales-growth-heres-how-much-it-earned-in-apr-jun-2609496/,2022-07-28T15:30:50+05:30,2022-07-28T10:00:50,0.6705
"Amul boss Sodhi hits back at PETA over ‘vegan milk’: It’s NOT milk, it’s lab chemicals",https://www.financialexpress.com/business/industry-amul-boss-sodhi-hits-back-at-peta-over-vegan-milk-its-not-milk-its-lab-chemicals-2262338/,2021-05-31T16:19:22+05:30,2021-05-31T10:49:22,0.0
Maggi-maker Nestle India Q4 Results: Profit down 6.50%; improving volume help domestic sales,https://www.financialexpress.com/business/industry-maggi-maker-nestle-india-q4-results-profit-down-6-50-yoy-co-says-domestic-sales-crossed-rs-5235-cr-mark-on-improving-volume-growth-3820311/,2025-04-24T13:01:34+05:30,2025-04-24T07:31:34,0.8126
"Q4 Results Highlights: Tech Mahindra profit jumps by 76.51%; Axis Bank profit at Rs 7,117.50 crore",https://www.financialexpress.com/business/industry-q4-results-live-updates-hul-nestle-india-tech-mahindra-axis-bank-3820098/,2025-04-25T09:40:11+05:30,2025-04-25T04:10:11,0.7003
Maggi-maker Nestle India to announce Q4 results tomorrow: 4 key factors to watch,https://www.financialexpress.com/business/industry-maggi-maker-nestle-india-to-announce-q4-results-tomorrow-4-key-factors-to-watch-3819280/,2025-04-23T14:09:56+05:30,2025-04-23T08:39:56,0.0
"Q4 results this week: HCLTech, Tech Mahindra, Nestle, HUL, Axis Bank, others to declare earnings; Check list",https://www.financialexpress.com/business/industry-q4-results-this-week-hcltech-tech-mahindra-nestle-hul-axis-bank-others-to-declare-earnings-check-list-3816437/,2025-04-21T11:48:38+05:30,2025-04-21T06:18:38,0.0
"Upcoming Q4 earnings and dividend: From TCS, Infosys to HDFC Bank, UltraTech watch out for these 10 companies",https://www.financialexpress.com/business/industry/upcoming-q4-earnings-and-dividend-from-tcs-infosys-to-hdfc-bank-ultratech-watch-out-for-these-10-companies/3794357/,2025-04-01T05:45:00+05:30,2025-04-01T00:15:00,0.0
Change of guard: Top CEOs set to retire as India Inc prepares for leadership overhaul,https://www.financialexpress.com/business/industry-retirement-looms-for-top-mds-ceos-3787236/,2025-03-25T10:08:56+05:30,2025-03-25T04:38:56,0.2023
"FMCG turnaround: Rural recovery, M&A to drive sector ahead",https://www.financialexpress.com/business/industry-fmcg-turnaround-rural-recovery-mampa-to-drive-sector-ahead-3773933/,2025-03-11T09:27:42+05:30,2025-03-11T03:57:42,0.0
A contrarian investment opportunity in two FMCG stocks?,https://www.financialexpress.com/market/stock-insights/a-contrarian-investment-opportunity-in-two-fmcg-stocks/3759456/,2025-02-26T06:00:00+05:30,2025-02-26T00:30:00,0.4215
Nestle India misses estimates on weak urban demand,https://www.financialexpress.com/business/industry/nestle-india-misses-estimates-on-weak-urban-demand/3733003/,2025-02-01T05:45:00+05:30,2025-02-01T00:15:00,-0.6486
"Maggi-maker Nestlé India’s Q3 profit up 4.94% at Rs 688.01 cr, revenue rises marginally on moderate consumption; dividend declared",https://www.financialexpress.com/business/industry-maggi-maker-nestl-indias-q3-profit-up-4-94-at-rs-68801-cr-revenue-rises-marginally-on-moderate-consumption-dividend-declared-3732058/,2025-01-31T12:30:54+05:30,2025-01-31T07:00:54,0.4404
No impact of Swiss withdrawal MFN status: Nestle India,https://www.financialexpress.com/business/industry-no-impact-of-swiss-withdrawal-mfn-status-nestle-india-3695694/,2024-12-20T02:30:00+05:30,2024-12-19T21:00:00,-0.2732
"Nestle Q2 Results: Maggi-maker posts marginal decline in profit at Rs 899.49 crore but beats estimates, revenue up 1.3% YoY",https://www.financialexpress.com/business/industry-nestle-q2-results-maggi-maker-posts-marginal-decline-in-profit-at-rs-899-49-crore-but-beats-estimates-revenue-up-13-yoy-3642477/,2024-10-17T13:42:48+05:30,2024-10-17T08:12:48,0.2382
"Nestlé India’s CMD Suresh Narayanan to retire in 2025, Amazon’s Manish Tiwary to take charge as new MD",https://www.financialexpress.com/business/industry-nestl-indias-cmd-suresh-narayanan-to-retire-in-2025-amazons-manish-tiwary-to-take-charge-as-new-md-3632835/,2024-10-07T15:11:50+05:30,2024-10-07T09:41:50,0.0
"Maggi maker Nestle India posts Q1 profit growth of 6.9% YoY at Rs 746.60 crore despite external challenges, misses estimates",https://www.financialexpress.com/business/industry-nestle-india-q1-results-profit-rises-by-6-9-yoy-at-rs-74660-crore-despite-external-challenges-misses-estimates-3564569/,2024-07-25T11:55:03+05:30,2024-07-25T06:25:03,0.7135
"Nestle India Q1 Results: Date, Time, Where to Watch?",https://www.financialexpress.com/business/industry/nestle-india-q1-results-2024-date-time-where-to-watch/3564059/,2024-07-25T11:24:48+05:30,2024-07-25T05:54:48,0.0
Nestle India zooms 3% as it continues to pay royalty to parent firm at current rate. Here’s all you need to know,https://www.financialexpress.com/market/nestle-india-zooms-3-as-it-continues-to-pay-royalty-to-parent-firm-atnbspcurrentnbsprate-heres-all-you-need-to-knownbsp-3523813/,2024-06-13T13:11:32+05:30,2024-06-13T07:41:32,-0.1027
Nestle India shareholders reject proposal to hike royalty payment to parent firm,https://www.financialexpress.com/business/industry/nestle-india-shareholders-reject-proposal-to-hike-royalty-payment-to-parent-firm/3493184/,2024-05-19T09:19:43+05:30,2024-05-19T03:49:43,-0.4019
"The story behind our favourite Maggi noodles: How Julius Maggi created this iconic brand; know about its origin, history & more",https://www.financialexpress.com/life/lifestyle-the-story-behind-our-favourite-maggi-noodles-how-julius-maggi-created-this-iconic-brand-know-about-its-origin-history-more-3173654/,2024-04-29T12:09:11+05:30,2024-04-29T06:39:11,0.25
Nestle India March quarter results: Net profit up nearly 27% at Rs 934.17 crore; Read to know other details,https://www.financialexpress.com/business/industry/nestle-india-q4-results-net-profit-up-nearly-27-at-rs-934-17-crore-read-to-know-other-details/3468030/,2024-04-25T12:49:16+05:30,2024-04-25T07:19:16,0.4404
Nestle India: Motilal Oswal sees no impact of recent reports about ‘sugar in baby food’; maintains Neutral rating and target price of Rs 2400,https://www.financialexpress.com/market/nestle-india-motilal-oswal-sees-no-impact-of-recent-reports-about-sugar-in-baby-food-maintains-neutral-rating-and-target-price-of-rs-2400-3462064/,2024-04-19T13:21:00+05:30,2024-04-19T07:51:00,-0.296
"Nestle row: Infant foods have misleading claims, say health experts as report reveals presence of sugar in Cerelac",https://www.financialexpress.com/business/healthcare-nestle-row-infant-foods-have-misleading-claims-say-health-experts-as-report-reveals-presence-of-sugar-in-cerelac-3461292/,2024-04-18T18:30:37+05:30,2024-04-18T13:00:37,-0.4019
Nestle India shares fall over 5% on reports of company adding sugar in infant products; Read to know more,https://www.financialexpress.com/market/nestle-india-shares-fall-over-5-on-reports-of-company-adding-sugar-in-infant-products-read-to-know-more-3460873/,2024-04-18T13:57:56+05:30,2024-04-18T08:27:56,0.296
Nestle India board approves hike in royalty payment to parent firm,https://www.financialexpress.com/business/industry-nestle-india-board-approves-hike-in-royalty-payment-to-parent-firm-3448151/,2024-04-06T03:15:00+05:30,2024-04-05T21:45:00,0.4019
Govt plea against Maggi rejected in win for Nestle,https://www.financialexpress.com/business/industry-govt-plea-against-maggi-rejected-in-win-for-nestle-3446860/,2024-04-05T03:00:00+05:30,2024-04-04T21:30:00,0.128
Nestle says RURBAN strategy and new product innovation to fuel growth,https://www.financialexpress.com/business/industry-nestle-says-rurban-strategy-and-new-product-innovation-to-fuel-growth-3286585/,2023-10-26T04:00:00+05:30,2023-10-25T22:30:00,0.6369
SC’s Nestle ruling may lead to flurry of tax notices to MNCs,https://www.financialexpress.com/business/industry-scs-nestle-ruling-may-lead-to-flurry-of-tax-notices-to-mncs-3282678/,2023-10-21T01:30:00+05:30,2023-10-20T20:00:00,0.0
Premiumisation and rural play both are important for us: Nestle India,https://www.financialexpress.com/business/industry-premiumisation-and-rural-play-both-are-important-for-us-nestle-india-3229058/,2023-09-01T00:15:00+05:30,2023-08-31T18:45:00,0.4939
"Rural, semi-urban markets growth areas, says Nestle India CMD Suresh Narayanan",https://www.financialexpress.com/business/industry-rural-semi-urban-markets-growth-areas-says-nestle-india-cmd-suresh-narayanan-3191636/,2023-07-29T04:30:00+05:30,2023-07-28T23:00:00,0.3818
"Nestle India Q2 profit up 36.9% at Rs 698.34 crore; KitKat, Nescafé, Maggi lead growth",https://www.financialexpress.com/business/industry-nestle-india-q2-profit-up-36-9-at-rs-69834-crore-kitkat-nescaf-maggi-lead-growth-3189102/,2023-07-27T11:37:25+05:30,2023-07-27T06:07:25,0.6705
"Rural India a tale of contrasts for FMCG majors HUL, Nestle",https://www.financialexpress.com/business/industry-rural-india-a-tale-of-contrasts-for-fmcg-majors-hul-nestle-3077818/,2023-05-08T02:00:00+05:30,2023-05-07T20:30:00,0.0
Nestle plans 10th factory in India; investing to augment capacity of existing units,https://www.financialexpress.com/business/industry-nestle-plans-10th-factory-in-india-investing-to-augment-capacity-of-existing-units-3069715/,2023-05-01T09:44:54+05:30,2023-05-01T04:14:54,0.0
Nestle India posts 25% jump in Q1 profit,https://www.financialexpress.com/business/industry-nestle-india-posts-25-jump-in-q1-profit-3062722/,2023-04-26T05:15:00+05:30,2023-04-25T23:45:00,0.4404
"Nestle India Jan-Mar net profit jumps 24% to Rs 736.6 cr, beats estimates; revenue up at Rs 4830 cr",https://www.financialexpress.com/market/nestle-india-q4fy23-net-profit-jumps-24-to-rs-736-6-crore-beats-estimates-revenue-up-at-rs-4830-crore-3061368/,2023-04-25T10:57:03+05:30,2023-04-25T05:27:03,0.4404
"Nestle India Q4FY23 results preview: Net profit to jump 20%, sales growth continues on volume, pricing",https://www.financialexpress.com/market/nestle-india-q4fy23-results-preview-net-profit-to-jump-20-sales-growth-continues-on-volume-pricing-3060389/,2023-04-24T16:03:28+05:30,2023-04-24T10:33:28,0.6705
The Bournvita mess,https://www.financialexpress.com/opinion/the-bournvita-mess/3054570/,2023-04-20T04:15:00+05:30,2023-04-19T22:45:00,-0.3612
Nestle announces dividend: Rs 27 per share interim bonanza to begin the year; check record date,https://www.financialexpress.com/market/nestle-announces-dividend-rs-27-per-share-interim-bonanza-to-begin-the-year-check-record-date-3043331/,2023-04-12T10:11:06+05:30,2023-04-12T04:41:06,0.296
Rating: neutral; Nestlé India: High capex to boost growth,https://www.financialexpress.com/market/rating-neutral-nestl-india-high-capex-to-boost-growth-2986156/,2023-02-20T03:10:00+05:30,2023-02-19T21:40:00,0.6486
"HUL, Britannia, Nestle, Marico, others bet on rural recovery to lift profits",https://www.financialexpress.com/business/industry-hul-britannia-nestle-marico-others-bet-on-rural-recovery-to-lift-profits-2984608/,2023-02-17T15:10:29+05:30,2023-02-17T09:40:29,0.4404
Nestle India hopes for a better 2023,https://www.financialexpress.com/business/industry-nestle-india-hopes-for-a-better-2023-2921099/,2022-12-21T02:40:00+05:30,2022-12-20T21:10:00,0.6908
Nifty resistance at 18750; buy these two stocks to pocket short-term gains,https://www.financialexpress.com/market/cafeinvest-nifty-resistance-at-18750-buy-these-two-stocks-to-pocket-short-term-gains-2908848/,2022-12-11T11:55:16+05:30,2022-12-11T06:25:16,0.6249
"Nestle Q3 net profit up 8.25 pc at Rs 668.34 cr; net sales rise 18.24 pc to Rs 4,591 cr",https://www.financialexpress.com/business/industry-nestle-q3-net-profit-up-8-25-pc-at-rs-66834-cr-net-sales-rise-1824-pc-to-rs-4591-cr-2721028/,2022-10-19T14:05:31+05:30,2022-10-19T08:35:31,0.4404
Hindustan Unilever vs Nestle India; Nestle to outperform HUL in long term,https://www.financialexpress.com/market/hindustan-unilever-vs-nestle-india-nestle-to-outperform-hul-in-long-term-2691900/,2022-09-27T02:45:00+05:30,2022-09-26T21:15:00,0.0
"Nestle, Wipro, Paytm, PNB among 270 BSE stocks to hit fresh 52-week lows; 40 scrips at new 52-week highs",https://www.financialexpress.com/market/nestle-wipro-paytm-pnb-among-270-bse-stocks-to-hit-fresh-52-week-lows-40-scrips-at-new-52-week-highs-2521791/,2022-05-12T12:53:21+05:30,2022-05-12T07:23:21,0.128
Consumer firms turn to ‘bridge packs’ to sustain margins,https://www.financialexpress.com/business/industry-consumer-firms-turn-to-bridge-packs-to-sustain-margins-2517986/,2022-05-10T01:15:00+05:30,2022-05-09T19:45:00,0.0
"Nestle, Zomato among 121 stocks to hit 52-week low on BSE, 88 scrips at fresh highs",https://www.financialexpress.com/market/nestle-zomato-among-121-stocks-to-hit-52-week-low-on-bse-88-scrips-at-fresh-highs-2517436/,2022-05-09T13:41:54+05:30,2022-05-09T08:11:54,0.0516
Nestlé India Rating ‘Buy’; Decent results in face of challenges,https://www.financialexpress.com/market/nestle-india-rating-buy-decent-results-in-face-of-challenges-2501800/,2022-04-25T00:15:00+05:30,2022-04-24T18:45:00,0.0772
"High raw material, packaging costs hit Nestle India, profit slips 1.2% to Rs 595 crore",https://www.financialexpress.com/business/industry-high-raw-material-packaging-costs-hit-nestle-india-profit-slips-1-2-to-rs-595-crore-2499530/,2022-04-22T00:30:00+05:30,2022-04-21T19:00:00,0.4404
Nestle India profit falls to Rs 595 cr in Jan-Mar amid high inflation; raw materials costs at 10-yr high,https://www.financialexpress.com/business/industry-nestle-india-profit-falls-to-rs-595-cr-in-jan-mar-amid-high-inflation-raw-materials-costs-at-10-yr-high-2498989/,2022-04-21T13:27:02+05:30,2022-04-21T07:57:02,0.4404
Consumer staples lose steam on rising inflation,https://www.financialexpress.com/market/consumer-staples-lose-steam-on-rising-inflation-2483974/,2022-04-07T03:30:00+05:30,2022-04-06T22:00:00,-0.4019
"Hindustan Unilever, Nestlé hike prices of coffee, tea and noodles",https://www.financialexpress.com/business/industry-hindustan-unilever-nestle-hike-prices-of-coffee-tea-and-noodles-2460878/,2022-03-15T02:00:00+05:30,2022-03-14T20:30:00,0.0
"Analyst Corner: Maintain ‘buy’ on Nestlé with TP of Rs 20,300",https://www.financialexpress.com/market/analyst-corner-maintain-buy-on-nestle-with-tp-of-rs-20300-2453737/,2022-03-08T08:44:38+05:30,2022-03-08T03:14:38,0.0
Rising raw material prices could dent Nestle India’s stock performance as storm clouds of inflation appear,https://www.financialexpress.com/market/rising-raw-material-prices-could-dent-nestle-india-stock-performance-as-storm-clouds-of-inflation-appear-2437741/,2022-02-18T14:35:40+05:30,2022-02-18T09:05:40,0.0
"Nestlé India Q4 profit dips 20% to Rs 386.66 crore, revenue up 8.9%",https://www.financialexpress.com/business/industry-nestle-india-q4-profit-dips-20-pc-to-rs-386-66-cr-net-sales-up-8-9-pc-to-rs-3739-32-cr-2436699/,2022-02-17T21:10:06+05:30,2022-02-17T15:40:06,0.4404
"HUL, Nestle India, Reliance Industries, HCL Tech, Nestle, PSBs, Adani group stocks in focus",https://www.financialexpress.com/market/hul-nestle-india-reliance-industries-hcl-tech-nestle-psbs-adani-group-stocks-in-focus-2352827/,2021-10-20T08:34:39+05:30,2021-10-20T03:04:39,0.0
