headline,link,date_str,parsed_date_iso,sentiment_score
"Maruti Suzuki, Nestle India, IndiGo, Rolex Rings IPO, Glenmark Life IPO, Happiest Minds stocks in focus",https://www.financialexpress.com/market/maruti-suzuki-nestle-india-indigo-rolex-rings-ipo-glenmark-life-ipo-happiest-minds-stocks-in-focus-2299075/,2021-07-28T08:34:02+05:30,2021-07-28T03:04:02,0.6369
"Technical stocks to buy: Nifty faces resistance at 15,680-15,750; TCS, Nestle, Bajaj Auto show rally on charts",https://www.financialexpress.com/market/cafeinvest-technical-stocks-to-buy-nifty-faces-resistance-at-15680-15750-tcs-nestle-bajaj-auto-show-rally-on-charts-2294621/,2021-07-21T10:47:09+05:30,2021-07-21T05:17:09,0.4019
"FMCG sector to drive growth as India revives post lockdown 2.0; HUL, Nestle, others look fundamentally strong",https://www.financialexpress.com/market/fmcg-sector-to-drive-growth-as-india-revives-post-lockdown-2-0-hul-nestle-others-look-fundamentally-strong-2273949/,2021-06-19T12:07:45+05:30,2021-06-19T06:37:45,0.8176
"ONGC, Nestle among top stocks to buy, charts show strength; check Nifty’s support, resistance levels",https://www.financialexpress.com/market/cafeinvest-ongc-nestle-among-top-stocks-to-buy-charts-show-strength-check-niftys-support-resistance-levels-2246004/,2021-05-05T08:53:11+05:30,2021-05-05T03:23:11,0.7717
"HDFC, Indiabulls Housing, ICICI Bank, Nestle India, ONGC, Tata Steel among stocks in focus",https://www.financialexpress.com/market/hdfc-indiabulls-housing-icici-bank-nestle-india-ongc-tata-steel-among-stocks-in-focus-2237840/,2021-04-22T08:09:10+05:30,2021-04-22T02:39:10,0.0
"Dodla Dairy files IPO papers with SEBI, public issue largely an offer-for-sale",https://www.financialexpress.com/market/ipo-news-dodla-dairy-ipo-papers-sebi-public-issue-offer-for-sale-ofs-drhp-inital-public-offering-milk-industry-hatsun-agro-products-heritage-foods-parag-milk-foods-2197118/,2021-02-18T13:38:28+05:30,2021-02-18T08:08:28,0.0
"Stocks in focus: Adani Ports, Future Retail, Nestle India, Tech Mahindra, Nureca, Railtel",https://www.financialexpress.com/market/adani-ports-and-sez-future-retail-nestle-india-tech-mahindra-nureca-railtel-ipos-ibm-sanghvi-forging-stocks-in-focus-2196191/,2021-02-17T08:42:11+05:30,2021-02-17T03:12:11,0.0
Diwali Value Stock Picks: Bharti Airtel among 5 stocks that may rally up to 41% in Samvat 2077,https://www.financialexpress.com/market/diwali-value-stock-picks-bharti-airtel-among-5-stocks-that-may-rally-up-to-41-in-samvat-2077-2116401/,2020-10-29T13:44:09+05:30,2020-10-29T08:14:09,0.34
Share market volatility an opportunity to buy great stocks at cheap price; time to up SIP allocation,https://www.financialexpress.com/market/cafeinvest-share-market-volatility-an-opportunity-to-buy-great-stocks-at-cheap-price-time-to-up-sip-allocation-2100791/,2020-10-08T13:38:33+05:30,2020-10-08T08:08:33,0.8442
Nestle India share price falls 3% on weak Apr-Jun quarter results; should you buy the stock?,https://www.financialexpress.com/market/nestle-india-share-price-falls-3-on-weak-apr-jun-quarter-results-should-you-buy-the-stock/2038525/,2020-07-29T12:23:48+05:30,2020-07-29T06:53:48,-0.1779
"Top consumer sector shares that may beat coronavirus woes, even as pandemic hits consumption",https://www.financialexpress.com/market/top-consumer-sector-shares-that-may-beat-coronavirus-woes-even-as-pandemic-hits-consumption-britannia-industries-dabur-india-nestle-itc/2017397/,2020-07-08T15:47:49+05:30,2020-07-08T10:17:49,0.0258
FMCG in search of right price-value equation: Buyers look for cheaper options as prices rise,https://www.financialexpress.com/business/industry-fmcg-in-search-of-right-price-value-equation-buyers-look-for-cheaper-options-as-prices-rise-2468608/,2022-03-23T04:10:00+05:30,2022-03-22T22:40:00,0.0
