headline,link,date_str,parsed_date_iso,sentiment_score
Bharat Forge surges 5% on rising India-Pakistan tension: Can defence orderbook fuel FY26 growth?,https://www.financialexpress.com/market/bharat-forge-surges-5-on-rising-india-pakistan-tension-can-defence-orderbook-fuel-fy26-growth-3838507/,2025-05-09T13:20:57+05:30,2025-05-09T07:50:57,0.1779
Bharat Forge logs 24% rise in Q4 profit,https://www.financialexpress.com/business/industry-bharat-forge-logs-24rise-in-q4-profit-3837680/,2025-05-08T22:13:15+05:30,2025-05-08T16:43:15,0.4404
Defence stocks yielding high dividend? 3 stocks that stand out amidst growing India-Pak tension,https://www.financialexpress.com/market/defence-stocks-yielding-high-dividend-3-stocks-that-stand-out-amidst-growing-india-pak-tension-3830124/,2025-05-02T12:47:40+05:30,2025-05-02T07:17:40,-0.0516
Auto parts maker to face Trump’s 25% tariff heat,https://www.financialexpress.com/auto/news/auto-parts-maker-to-face-trumps-25-tariff-heat/3793044/,2025-03-30T06:02:15+05:30,2025-03-30T00:32:15,0.0
"Trump Tariff impact: Nomura lists 3 key concerns for Tata Motors, Bharat Forge",https://www.financialexpress.com/market/trump-tariff-impact-nomura-lists-3-key-concerns-for-tata-motors-bharat-forge-3791355/,2025-03-28T14:37:53+05:30,2025-03-28T09:07:53,0.0
Bharat Forge signs ATAG deal with MoD,https://www.financialexpress.com/business/industry-bharat-forge-sings-atag-deal-with-mod-3790899/,2025-03-28T06:56:39+05:30,2025-03-28T01:26:39,0.0
"Trump tariff: CLSA lists impact on Tata Motors, Bharat Forge and 2 more",https://www.financialexpress.com/market/trump-tariff-clsa-lists-impact-on-tata-motors-bharat-forge-and-2-more-3790369/,2025-03-27T14:13:40+05:30,2025-03-27T08:43:40,0.0
Why is Bharat Forge falling today? 4 things that investors need to know now,https://www.financialexpress.com/market/why-is-bharat-forge-falling-today-4-things-that-investors-need-to-know-now-3789995/,2025-03-27T11:00:05+05:30,2025-03-27T05:30:05,-0.1531
From Adani Group to Piramal Enterprises – Here are 8 stocks to watch,https://www.financialexpress.com/market/stocks-to-watch-adani-group-wipro-hul-bharti-airtel-jb-pharma-bharat-forge-nbcc-piramal-enterprises-3789838/,2025-03-27T06:44:35+05:30,2025-03-27T01:14:35,0.0
Stocks To Watch: From Bharat Forge to Waaree Energies- Here’s a list of 10 stocks in news today,https://www.financialexpress.com/market/stocks-to-watch-from-bharat-forge-to-waaree-energies-heres-a-list-of-10-stocks-in-news-today-3754774/,2025-02-20T06:39:56+05:30,2025-02-20T01:09:56,0.2263
This BSE 100 company declared 125% dividend; record date set on February 18,https://www.financialexpress.com/market/this-bse-100-company-declared-125-dividend-record-date-set-on-feb-18-3751635/,2025-02-17T12:00:55+05:30,2025-02-17T06:30:55,0.0
Bharat Forge’s net profit declines 16.38%; setting up aerospace facility with Liebherr,https://www.financialexpress.com/business/express-mobility-bharat-forges-net-profit-declines-16-38-setting-up-aerospace-facility-with-liebherr-3747728/,2025-02-13T02:15:00+05:30,2025-02-12T20:45:00,0.4404
Bharat Forge net profit up 13.22 per cent to Rs 361.12 crore,https://www.financialexpress.com/business/express-mobility-bharat-forge-net-profit-up-13-22-per-cent-to-rs-36112-crore-3665651/,2024-11-15T01:45:00+05:30,2024-11-14T20:15:00,0.4404
Bharat Forge denies claims in suit against Baba Kalyani,https://www.financialexpress.com/business/industry-bharat-forge-denies-claims-in-suit-against-baba-kalyani-3438688/,2024-03-28T06:00:00+05:30,2024-03-28T00:30:00,-0.4215
Kalyani family dispute escalates: Baba Kalyani’s niece and nephew file petition for family assets partition,https://www.financialexpress.com/business/industry-kalyani-family-dispute-escalates-baba-kalyanis-niece-and-nephew-file-petition-for-family-assets-partition-3437444/,2024-03-27T06:00:00+05:30,2024-03-27T00:30:00,-0.25
"Bharat Forge Q3 profit jumps 223.2% to Rs 254.45 crore, revenue up 15.3% on-year",https://www.financialexpress.com/business/industry-bharat-forge-q3-profit-jumps-223-2-to-rs-25445-crore-revenue-up-153-on-year-3391679/,2024-02-12T13:58:24+05:30,2024-02-12T08:28:24,0.4404
Bharat Forge gets nod for defence participation,https://www.financialexpress.com/business/defence-bharat-forge-gets-nod-for-defence-participation-3190187/,2023-07-28T07:41:19+05:30,2023-07-28T02:11:19,0.1027
"Bharat Forge stock rating ‘Buy’: New defence orders, aerospace backlog, other factors to help co beat slowdown",https://www.financialexpress.com/market/bharat-forge-stock-rating-buy-new-defence-orders-aerospace-backlog-other-factors-to-help-co-beat-slowdown-3146237/,2023-06-28T16:44:01+05:30,2023-06-28T11:14:01,0.4767
Bharat Forge targets defence as govt pushes for Make in India,https://www.financialexpress.com/business/defence-bharat-forge-targets-defence-as-govt-pushes-for-make-in-india-3105114/,2023-05-29T03:00:00+05:30,2023-05-28T21:30:00,0.1027
Higher finance cost and lower other income drag Bharat Forge profits by 3%,https://www.financialexpress.com/business/express-mobility-higher-finance-cost-and-lower-other-income-among-others-pull-bharat-forge-profits-by-3-3075744/,2023-05-05T17:38:13+05:30,2023-05-05T12:08:13,-0.0516
Rating: SELL – Bharat Forge expects moderate revenue growth,https://www.financialexpress.com/market/rating-sell-bharat-forge-expects-moderate-revenue-growth-3041599/,2023-04-11T05:45:00+05:30,2023-04-11T00:15:00,0.3818
"Amid legal dispute, Hikal chief assures management of family’s commitment￼",https://www.financialexpress.com/business/industry-amid-legal-dispute-hikal-chief-assures-management-of-familys-commitment-3032491/,2023-04-04T07:41:30+05:30,2023-04-04T02:11:30,0.0258
"Bharat Forge, Sundaram Fasteners among top suppliers recognised by General Motors",https://www.financialexpress.com/business/express-mobility-bharat-forge-sundaram-fasteners-among-top-suppliers-recognised-by-general-motors-3031245/,2023-04-07T14:27:37+05:30,2023-04-07T08:57:37,0.2023
Small arms for the Indian armed forces: Can the private industry deliver?,https://www.financialexpress.com/business/defence-small-arms-for-the-indian-armed-forces-can-the-private-industry-deliver-nbsp-3023849/,2023-03-27T20:57:56+05:30,2023-03-27T15:27:56,0.0
Indian Army proposes a major acquisition plan for 307 Advanced Towed Artillery Gun Systems to boost firepower at LAC,https://www.financialexpress.com/business/defence-indian-army-proposes-a-major-acquisition-plan-for-307-advanced-towed-artillery-gun-systems-to-boost-firepower-at-lac-2997400/,2023-03-02T13:38:32+05:30,2023-03-02T08:08:32,0.3182
Rating: neutral; Bharat Forge: Artillery guns orders to add to the revenue,https://www.financialexpress.com/market/rating-neutral-bharat-forge-artillery-guns-orders-to-add-to-the-revenue-2986160/,2023-02-20T05:15:00+05:30,2023-02-19T23:45:00,0.0
Bharat Forge to build Composites Rotor Blades and Mission Systems for Medium Lift Helicopters,https://www.financialexpress.com/business/defence-bharat-forge-to-build-composites-rotor-blades-and-mission-systems-for-medium-lift-helicopters-2983160/,2023-02-16T12:18:25+05:30,2023-02-16T06:48:25,0.0
"Bharat Forge Q3 profit dips 14 percent, exports drive revenue growth",https://www.financialexpress.com/business/express-mobility-bharat-forge-q3-profit-dips-14-percent-exports-drive-revenue-growth-2981901/,2023-02-15T10:05:13+05:30,2023-02-15T04:35:13,0.6705
"Rising finance costs, overseas biz losses drag Bharat Forge profit down",https://www.financialexpress.com/business/industry-rising-finance-costs-overseas-biz-losses-drag-bharat-forge-profit-down-2981682/,2023-02-15T03:20:00+05:30,2023-02-14T21:50:00,-0.1779
"Union Budget 2023 may focus on Capex, infrastructure; 5 stocks to buy before 1st February",https://www.financialexpress.com/market/union-budget-2023-may-focus-on-capex-infrastructure-5-stocks-to-buy-before-1st-february-2949526/,2023-01-16T13:44:17+05:30,2023-01-16T08:14:17,0.0
Bharat Forge: Banking on exports,https://www.financialexpress.com/market/bharat-forge-banking-on-exports-2910653/,2022-12-13T02:00:00+05:30,2022-12-12T20:30:00,0.0
Bharat Forge backed Tork Motors to scale up production of EV bikes,https://www.financialexpress.com/business/express-mobility-bharat-forge-backed-tork-motors-to-scale-up-production-of-ev-bikes-2810900/,2022-11-14T03:15:00+05:30,2022-11-13T21:45:00,0.0258
"Bharat Forge, General Atomics to collaborate for li-ion battery systems",https://www.financialexpress.com/business/defence-bharat-forge-general-atomics-to-collaborate-for-li-ion-battery-systems-2721452/,2022-10-19T19:05:58+05:30,2022-10-19T13:35:58,0.0
Bharat Forge delivers made-in-India Kalyani M4 for Indian Army’s UN peacekeeping ops,https://www.financialexpress.com/business/defence-bharat-forge-delivers-made-in-india-kalyani-m4-for-indian-armys-un-peacekeeping-ops-2706924/,2022-10-11T13:57:47+05:30,2022-10-11T08:27:47,0.4588
"Kalyani Powertrain, Harbinger’s new JV ElectroForge to develop electrified drivetrains for trucking industry",https://www.financialexpress.com/business/express-mobility-kalyani-powertrain-harbingers-new-jv-electroforge-to-develop-electrified-drivetrains-for-trucking-industry-2666907/,2022-09-14T16:58:21+05:30,2022-09-14T11:28:21,0.0
"Bharat Forge arm, Kalyani Powertrain unveils three-pronged e-mobility strategy",https://www.financialexpress.com/business/express-mobility-bharat-forge-arm-kalyani-powertrain-unveils-three-pronged-e-mobility-strategy-2659671/,2022-09-08T14:45:19+05:30,2022-09-08T09:15:19,0.0
"Bharat Forge profit rises 5%, revenues up 35% in Q1",https://www.financialexpress.com/auto/industry/bharat-forge-profit-rises-5-revenues-up-35-in-q1/2627057/,2022-08-12T12:41:53+05:30,2022-08-12T07:11:53,0.4404
Bharat Forge posts Rs 243 crore profit for Q1 FY23,https://www.financialexpress.com/business/express-mobility-bharat-forge-posts-rs-243-crore-profit-for-q1-fy23-2626385/,2022-08-11T18:06:50+05:30,2022-08-11T12:36:50,0.4404
50 yrs at helm of Bharat Forge: MD Baba Kalyani says company to grow multifold,https://www.financialexpress.com/business/industry-50-yrs-at-helm-of-bharat-forge-md-baba-kalyani-says-company-to-grow-multifold-2548844/,2022-06-05T04:45:00+05:30,2022-06-04T23:15:00,0.0
Bharat Forge rating – Reduce: Numbers were below expectations,https://www.financialexpress.com/market/bharat-forge-rating-reduce-numbers-were-below-expectations-2533875/,2022-05-23T03:00:00+05:30,2022-05-22T21:30:00,0.0
Bharat Forge rating – Buy: Sharp recovery expected over next 2-3 years,https://www.financialexpress.com/market/bharat-forge-rating-buy-sharp-recovery-expected-over-next-2-3-years-2465981/,2022-03-21T02:15:00+05:30,2022-03-20T20:45:00,0.0
Bharat Forge Q3 net at Rs 421 crore,https://www.financialexpress.com/business/industry-bharat-forge-q3-net-at-rs-421-crore-2430643/,2022-02-11T02:15:00+05:30,2022-02-10T20:45:00,0.0
"Diwali 2021 technical stock picks: Buy Infosys, Sun Pharma, others in Samvat 2078; charts show up to 35% rally",https://www.financialexpress.com/market/diwali-2021-technical-stock-picks-buy-infosys-sun-pharma-others-in-samvat-2078-charts-show-up-to-35-rally-2357847/,2021-10-27T15:15:08+05:30,2021-10-27T09:45:08,0.0
Sansera Engineering files IPO-papers with SEBI; issue entirely an offer-for-sale,https://www.financialexpress.com/market/ipo-news-sansera-engineering-files-ipo-papers-with-sebi-issue-entirely-an-offer-for-sale-2268977/,2021-06-10T16:32:14+05:30,2021-06-10T11:02:14,0.0
Craftsman Automation IPO listing day strategy: Vehicle scrappage policy may benefit; book profit or hold?,https://www.financialexpress.com/market/ipo-news-craftsman-automation-ipo-listing-day-strategy-vehicle-scrappage-policy-may-benefit-book-profit-or-hold-2219297/,2021-03-24T15:35:45+05:30,2021-03-24T10:05:45,0.7096
Bharat Forge share price jumps nearly 4% on receiving Rs 178 crore order from Defence Ministry,https://www.financialexpress.com/market/bharat-forge-share-price-jumps-on-receiving-rs-178-crore-order-from-defence-ministry-2200176/,2021-02-23T12:33:28+05:30,2021-02-23T07:03:28,0.3818
Charts signal strong support for these two stocks; recent market correction may have bottomed out,https://www.financialexpress.com/market/cafeinvest-charts-signal-strong-support-for-these-two-stocks-niftys-recent-correction-may-have-bottomed-out-2156497/,2020-12-24T08:14:47+05:30,2020-12-24T02:44:47,0.7184
Bharat Forge shares surge 13% today; should you buy or sell as stock rallies 140% from April lows?,https://www.financialexpress.com/market/bharat-forge-shares-surge-13-today-should-you-buy-or-sell-as-stock-rallies-140-from-april-lows-2053927/,2020-08-13T14:13:23+05:30,2020-08-13T08:43:23,0.1027
