headline,link,date_str,parsed_date_iso,sentiment_score
"Adani group in talks to acquire Jaiprakash Associates’ cement unit for Rs 5,000 crore",https://www.financialexpress.com/business/industry-adani-group-in-talks-to-acquire-jaiprakash-associates-cement-unit-for-rs-5000-crore-2705598/,2022-10-10T11:53:20+05:30,2022-10-10T06:23:20,0.0
Ambuja Cements gets shareholders’ nod to raise Rs 20k cr,https://www.financialexpress.com/market/ambuja-cements-gets-shareholders-nod-to-raise-rs-20k-cr-2704492/,2022-10-09T04:45:00+05:30,2022-10-08T23:15:00,0.0
"Adani Group to invest additional Rs 65,000 cr in Rajasthan",https://www.financialexpress.com/business/industry-adani-group-to-invest-additional-rs-65000-cr-in-rajasthan-2703727/,2022-10-08T00:30:00+05:30,2022-10-07T19:00:00,0.0
"Gautam Adani promises Rs 65,000 cr investment, 40,000 jobs creation in Rajasthan; here’s how it will be spent",https://www.financialexpress.com/business/industry-gautam-adani-promises-rs-65000-cr-investment-40000-jobs-creation-in-rajasthan-heres-how-it-will-be-spent-2703297/,2022-10-07T14:41:08+05:30,2022-10-07T09:11:08,0.5719
Adani Group to commission six more MMLPs in next two years,https://www.financialexpress.com/business/industry-adani-group-to-commission-six-more-mmlps-in-next-two-years-2702632/,2022-10-07T03:00:00+05:30,2022-10-06T21:30:00,0.0
Adani Group creates two new subsidiaries,https://www.financialexpress.com/business/industry-adani-group-creates-two-new-subsidiaries-2700805/,2022-10-05T07:23:13+05:30,2022-10-05T01:53:13,0.2732
Kerala High Court directs police to remove obstructions in front of Adani’s port project,https://www.financialexpress.com/india-news/kerala-high-court-directs-police-to-remove-obstructions-in-front-of-adanis-port-project/2696909/,2022-09-30T17:39:01+05:30,2022-09-30T12:09:01,0.0
"Rs 10,238 cr from lenders: Adani gets funding for Ganga E-way",https://www.financialexpress.com/business/roadways-rs-10238-cr-from-lenders-adani-gets-funding-for-ganga-e-way-2695879/,2022-09-30T06:15:00+05:30,2022-09-30T00:45:00,0.0
Adani unveils $100-bn green energy plan,https://www.financialexpress.com/business/industry-adani-unveils-100-bn-green-energy-plan-2693234/,2022-09-28T05:30:00+05:30,2022-09-28T00:00:00,0.2732
Adani Group to invest $100 billion in next 10 years in new energy; here’s what the money will be used to build,https://www.financialexpress.com/business/industry-adani-group-to-invest-100-billion-in-next-10-years-in-new-energy-heres-what-the-money-will-be-used-to-build-2692274/,2022-09-27T13:36:30+05:30,2022-09-27T08:06:30,0.2732
"Gautam Adani slips to third place in world’s rich list, Mukesh Ambani out of top-10 after Monday’s D-St rout",https://www.financialexpress.com/business/industry-gautam-adani-slips-to-third-place-in-worlds-rich-list-mukesh-ambani-out-of-top-10-after-mondays-d-st-rout-2692247/,2022-09-27T14:33:41+05:30,2022-09-27T09:03:41,0.5574
"Adani earned Rs 1,612 crore per day in 2021: Hurun India",https://www.financialexpress.com/business/industry-adani-earned-rs-1612-crore-per-day-in-2021-hurun-india-2683543/,2022-09-22T06:00:00+05:30,2022-09-22T00:30:00,0.0
"Gautam Adani beats Mukesh Ambani to become India’s richest, adds Rs 1600 crore to fortune every day in 1 year",https://www.financialexpress.com/business/industry-gautam-adani-beats-mukesh-ambani-to-become-indias-richest-adds-rs-1600-crore-to-fortune-every-day-in-1-year-2681537/,2022-09-21T15:02:27+05:30,2022-09-21T09:32:27,0.5267
"ACC, Ambuja Cements, Adani Group, Wipro, Hero MotoCorp, Tata Steel, Central Bank of India stocks in focus",https://www.financialexpress.com/market/stocks-to-watch-acc-ambuja-cements-adani-group-wipro-hero-motocorp-tata-steel-central-bank-of-india-stocks-in-focus-today-2680777/,2022-09-21T07:18:27+05:30,2022-09-21T01:48:27,0.5574
Adani buy of Holcim’s assets triggers next wave of consolidation,https://www.financialexpress.com/business/industry-adani-buy-of-holcims-assets-triggers-next-wave-of-consolidation-2680737/,2022-09-21T06:00:00+05:30,2022-09-21T00:30:00,0.1779
"Adani Group pledges $13-billion Ambuja, ACC shares",https://www.financialexpress.com/business/industry-adani-group-pledges-13-billion-ambuja-acc-shares-2680697/,2022-09-21T03:50:00+05:30,2022-09-20T22:20:00,0.296
Bengal cabinet nod for issuing LoI to Adani group for deep sea port,https://www.financialexpress.com/business/industry-bengal-cabinet-nod-for-issuing-loi-to-adani-group-for-deep-sea-port-2676943/,2022-09-20T07:25:07+05:30,2022-09-20T01:55:07,0.0
Bengal cabinet nod for issuing LoI to Adani group for Tajpur deep sea port,https://www.financialexpress.com/business/industry-bengal-cabinet-nod-for-issuing-loi-to-adani-group-for-tajpur-deep-sea-port-2676822/,2022-09-19T22:12:57+05:30,2022-09-19T16:42:57,0.0
Adani Group to become most profitable cement manufacturer,https://www.financialexpress.com/business/industry-adani-group-to-become-most-profitable-cement-manufacturer-2673015/,2022-09-19T11:25:01+05:30,2022-09-19T05:55:01,0.4927
"ACC, Adani Power, Ambuja Cements, Tata Steel, Paytm, Tata Power, HDFC Life, Indus Towers stocks in focus",https://www.financialexpress.com/market/stocks-to-watch-acc-adani-power-ambuja-cements-tata-steel-paytm-tata-power-hdfc-life-indus-towers-stocks-in-focus-today-2672838/,2022-09-19T07:12:22+05:30,2022-09-19T01:42:22,0.0
Adani names son Karan to helm cement business,https://www.financialexpress.com/business/industry-adani-names-son-karan-to-helm-cement-business-2671425/,2022-09-18T17:07:02+05:30,2022-09-18T11:37:02,0.0
Gautam Adani elevates son to chairman of cement maker ACC,https://www.financialexpress.com/business/industry-gautam-adani-elevates-son-to-chairman-of-cement-maker-acc-2670705/,2022-09-16T18:52:35+05:30,2022-09-16T13:22:35,0.0
"Adani Group completes acquisition of Holcim stakes in Ambuja Cement, ACC for $6.4 bln",https://www.financialexpress.com/business/industry-adani-group-completes-acquisition-of-holcim-stakes-in-ambuja-cement-acc-for-6-4-bln-2669901/,2022-09-16T16:31:56+05:30,2022-09-16T11:01:56,0.0
"Adani Wilmar scouting for acquisitions in domestic, overseas markets to push food business",https://www.financialexpress.com/business/industry-adani-wilmar-scouting-for-acquisitions-in-domestic-overseas-markets-to-push-food-business-2667543/,2022-09-15T09:50:05+05:30,2022-09-15T04:20:05,0.0
Income Tax Dept approval not required for warrant conversion by RRPR Holding,https://www.financialexpress.com/business/industry-income-tax-dept-approval-not-required-for-warrant-conversion-by-rrpr-holding-2662338/,2022-09-10T18:37:33+05:30,2022-09-10T13:07:33,0.4767
"Adani Group’s open offers for ACC, Ambuja Cement get tepid response",https://www.financialexpress.com/market/adani-groups-open-offers-for-acc-ambuja-cement-get-tepid-response-2661734/,2022-09-10T04:30:00+05:30,2022-09-09T23:00:00,0.0
"ICICI Bank, Adani Enterprises, SBI among 191 stocks to hit 52-week high on BSE, 11 scrips touch fresh lows",https://www.financialexpress.com/market/icici-bank-adani-enterprises-sbi-among-191-stocks-to-hit-52-week-high-on-bse-11-scrips-touch-fresh-lows-2660895/,2022-09-09T13:21:40+05:30,2022-09-09T07:51:40,0.128
"IndiGo, Vodafone Idea, Jet Airways, Future Lifestyle, Adani Group stocks in focus on September 9, 2022",https://www.financialexpress.com/market/stocks-to-watch-indigo-vodafone-idea-jet-airways-future-lifestyle-adani-group-stocks-in-focus-on-september-9-2022-friday-2660428/,2022-09-09T07:12:00+05:30,2022-09-09T01:42:00,0.0
CreditSights corrects debt numbers of Adani firms,https://www.financialexpress.com/business/industry-creditsights-corrects-debt-and-profit-estimates-for-adani-group-firms-2660167/,2022-09-09T01:30:00+05:30,2022-09-08T20:00:00,-0.3612
"Adani group leverage elevated: Fitch unit corrects Adani Transmission, Power’s EBITDA, debt estimates",https://www.financialexpress.com/business/industry-adani-group-not-overleveraged-fitch-unit-erred-in-calculating-debt-says-leverage-ratios-seem-healthy-2659899/,2022-09-09T14:59:29+05:30,2022-09-09T09:29:29,-0.3612
"IndiGo, Bharti Airtel, HDFC Bank, Concor, Axis Bank, Zee, Adani group stocks in focus on weekly F&O expiry",https://www.financialexpress.com/market/stocks-to-watch-indigo-bharti-airtel-hdfc-bank-concor-axis-bank-adani-group-stocks-in-focus-on-weekly-fo-expiry-september-8-thursday-2659109/,2022-09-08T09:17:02+05:30,2022-09-08T03:47:02,0.0
Adani Group to build three giga factories in green energy push,https://www.financialexpress.com/business/industry-adani-group-to-build-three-giga-factories-in-green-energy-push-2658959/,2022-09-08T03:00:00+05:30,2022-09-07T21:30:00,0.2732
"Adani group says not overleaveraged, loans from public sector banks halved",https://www.financialexpress.com/business/industry-adani-group-says-not-overleaveraged-loans-from-public-sector-banks-halved-2657830/,2022-09-07T09:35:35+05:30,2022-09-07T04:05:35,0.0
"Gautam Adani to export power to Bangladesh, Adani Power will commission 1600 MW facility in Jharkhand",https://www.financialexpress.com/business/industry-gautam-adani-to-export-power-to-bangladesh-adani-power-will-commission-1600-mw-facility-in-jharkhand-2657046/,2022-09-06T15:00:30+05:30,2022-09-06T09:30:30,0.0
Gautam Adani scouting for new Group M&A chief,https://www.financialexpress.com/business/industry-gautam-adani-scouting-for-new-group-ma-chief-2656754/,2022-09-06T11:38:48+05:30,2022-09-06T06:08:48,0.0
"NDTV says share transfer needs I-T dept nod, Adani rejects claim",https://www.financialexpress.com/market/ndtv-says-share-transfer-needs-i-t-dept-nod-adani-rejects-claim-2652491/,2022-09-02T01:05:00+05:30,2022-09-01T19:35:00,-0.25
"Need IT department nod for transfer of shares, says NDTV, Adani group terms it as misconceived",https://www.financialexpress.com/market/need-it-department-nod-for-transfer-of-shares-says-ndtv-adani-group-terms-it-as-misconceived-2652349/,2022-09-01T19:54:57+05:30,2022-09-01T14:24:57,0.296
Adani Group fixes Oct 17 as tentative date for NDTV’s open offer,https://www.financialexpress.com/business/industry-adani-group-fixes-oct-17-as-tentative-date-for-ndtvs-open-offer-2649820/,2022-08-31T00:04:00+05:30,2022-08-30T18:34:00,0.0
Adani to launch open offer for NDTV on Oct 17,https://www.financialexpress.com/market/adani-to-launch-open-offer-for-ndtv-on-oct-17-2649969/,2022-08-30T22:14:39+05:30,2022-08-30T16:44:39,0.0
"Adani Transmission beats LIC, HDFC in m-cap to enter top 10 stocks; shares rally this much YTD",https://www.financialexpress.com/market/adani-transmission-beats-lic-hdfc-in-m-cap-to-enter-top-10-stocks-shares-rally-this-much-ytd-2649060/,2022-08-30T11:44:36+05:30,2022-08-30T06:14:36,0.4588
NDTV seeks Sebi clarity on warrant conversion to VCPL,https://www.financialexpress.com/market/ndtv-seeks-sebi-clarity-on-warrant-conversion-to-vcpl-2648787/,2022-08-30T03:11:00+05:30,2022-08-29T21:41:00,0.4019
"Takeover battle: NDTV promoter entity, Adani group approach Sebi on warrants conversion",https://www.financialexpress.com/business/industry-takeover-battle-ndtv-promoter-entity-adani-group-approach-sebi-on-warrants-conversion-2648721/,2022-08-29T20:44:24+05:30,2022-08-29T15:14:24,-0.3818
NDTV defers AGM by week,https://www.financialexpress.com/business/industry-ndtv-defers-agm-by-week-2647557/,2022-08-29T02:05:00+05:30,2022-08-28T20:35:00,0.0
"Adani sets up 2 new subsidiaries, Adani TotalEnergies Biomass and Adani TotalEnergies E-Mobility",https://www.financialexpress.com/business/express-mobility-adani-sets-up-2-new-subsidiaries-adani-totalenergies-biomass-and-adani-totalenergies-e-mobility-2647010/,2022-08-28T12:27:52+05:30,2022-08-28T06:57:52,0.0
Curbs don’t apply to NDTV bid: Adani,https://www.financialexpress.com/business/industry-curbs-dont-apply-to-ndtv-bid-adani-2645879/,2022-08-27T05:30:00+05:30,2022-08-27T00:00:00,0.0
"Banks, global investors may cap exposure to Adani firms: S&P",https://www.financialexpress.com/business/banking-finance-banks-global-investors-may-cap-exposure-to-adani-firms-sp-2644513/,2022-08-26T06:30:00+05:30,2022-08-26T01:00:00,0.0
NDTV cites regulatory hurdles in transferring stake to Adani,https://www.financialexpress.com/business/industry-ndtv-cites-regulatory-hurdles-in-transferring-stake-to-adani-2644540/,2022-08-26T05:35:00+05:30,2022-08-26T00:05:00,0.0
Takeover of NDTV by India’s richest man worries journalists,https://www.financialexpress.com/business/industry-takeover-of-ndtv-by-indias-richest-man-worries-journalists-2644479/,2022-08-25T22:24:59+05:30,2022-08-25T16:54:59,0.1531
Debt-funded acquisitions can put pressure on Adani group ratings: S&P,https://www.financialexpress.com/business/industry-debt-funded-acquisitions-can-put-pressure-on-adani-group-ratings-sp-2643910/,2022-08-25T15:53:47+05:30,2022-08-25T10:23:47,-0.296
From RIL to Adani: VCPL has an interesting ownership history,https://www.financialexpress.com/business/industry-from-ril-to-adani-vcpl-has-an-interesting-ownership-history-2643145/,2022-08-25T06:10:00+05:30,2022-08-25T00:40:00,0.4019
"NDTV’s loan agreement 2009: Lender, borrower to scout for ‘stable-reliable’ buyer for holding firm",https://www.financialexpress.com/business/industry-ndtvs-loan-agreement-2009-lender-borrower-to-scout-for-stable-reliable-buyer-for-holding-firm-2642860/,2022-08-24T18:28:52+05:30,2022-08-24T12:58:52,0.4939
Move to stifle any semblance of independent media: Congress on Adani’s NDTV takeover bid,https://www.financialexpress.com/india-news/move-to-stifle-any-semblance-of-independent-media-congress-on-adanis-ndtv-takeover-bid/2642004/,2022-08-24T11:24:49+05:30,2022-08-24T05:54:49,0.0
"NDTV share price jumps 3% after Adani acquires 29% stake, moves to buy more; should you buy, sell, hold?",https://www.financialexpress.com/market/ndtv-share-price-jumps-3-after-adani-acquires-29-stake-moves-to-buy-more-should-you-buy-sell-hold-2641885/,2022-08-24T09:25:52+05:30,2022-08-24T03:55:52,0.296
Adani Group makes hostile bid for NDTV,https://www.financialexpress.com/business/brandwagon-adani-group-makes-hostile-bid-for-ndtv-2641743/,2022-08-24T07:08:23+05:30,2022-08-24T01:38:23,-0.3818
"Adani Group is ‘deeply overleveraged’, says Fitch group firm report",https://www.financialexpress.com/business/industry-adani-group-is-deeply-overleveraged-says-fitch-group-firm-report-2641671/,2022-08-24T01:30:00+05:30,2022-08-23T20:00:00,0.0
Gautam Adani’s empire ‘deeply overleveraged’; aggressive expansion plans may spiral into a debt trap,https://www.financialexpress.com/business/industry-gautam-adanis-empire-deeply-overleveraged-aggressive-expansion-plans-may-spiral-into-a-debt-trap-2640895/,2022-08-23T13:05:29+05:30,2022-08-23T07:35:29,-0.6597
"Electric vehicle push reshaping energy, auto sectors on D-Street, led by Reliance Industries and Adani Group",https://www.financialexpress.com/market/cafeinvest-electric-vehicle-push-reshaping-energy-auto-sectors-on-d-street-led-by-reliance-industries-and-adani-group-2640713/,2022-08-23T11:33:46+05:30,2022-08-23T06:03:46,0.2732
Adani to launch open offer for ACC and Ambuja Cements on August 26,https://www.financialexpress.com/market/adani-to-launch-open-offer-for-acc-and-ambuja-cements-on-august-26-2637793/,2022-08-20T17:59:44+05:30,2022-08-20T12:29:44,0.0
"Adani to buy DB Power for over Rs 7,000 crore",https://www.financialexpress.com/business/industry-adani-to-buy-db-power-for-over-rs-7000-crore-2637047/,2022-08-20T06:30:00+05:30,2022-08-20T01:00:00,0.0
"Adani Group readies Ambuja, ACC open offers after SEBI nod",https://www.financialexpress.com/market/adani-group-readies-ambuja-acc-open-offers-after-sebi-nod-2636913/,2022-08-20T01:30:00+05:30,2022-08-19T20:00:00,0.0
"Adani Group to invest Rs 57,575 crore in alumina mill in Odisha",https://www.financialexpress.com/business/industry-adani-group-to-invest-rs-57575-crore-in-alumina-mill-in-odisha-2626656/,2022-08-11T21:58:04+05:30,2022-08-11T16:28:04,0.0
"Adani Ports PAT falls 17% to Rs 1,092 crore",https://www.financialexpress.com/business/industry-adani-ports-pat-falls-17-to-rs-1092-crore-2622556/,2022-08-09T04:30:00+05:30,2022-08-08T23:00:00,0.0
"Adani to buy Macquarie’s toll roads for Rs 3,110 crore",https://www.financialexpress.com/business/industry-adani-to-buy-macquaries-toll-roads-for-rs-3110-crore-2618080/,2022-08-05T02:00:00+05:30,2022-08-04T20:30:00,0.0
"Invest Rajasthan Summit 2022: Investment proposals worth Rs 10 Lakh crore lined up, claims Ashok Gehlot govt",https://www.financialexpress.com/india-news/invest-rajasthan-summit-2022-investment-proposals-worth-rs-10-lakh-crore-lined-up-claims-ashok-gehlot-govt/2617552/,2022-08-04T15:42:27+05:30,2022-08-04T10:12:27,0.2263
Adani Wilmar consolidated net profit rises 10% in Q1,https://www.financialexpress.com/business/industry-adani-wilmar-consolidated-net-profit-rises-10-in-q1-2616915/,2022-08-04T07:55:19+05:30,2022-08-04T02:25:19,0.4404
SC refuses to stay Adani’s disqualification from JNPA bid,https://www.financialexpress.com/business/industry-sc-refuses-to-stay-adanis-disqualification-from-jnpa-bid-2616622/,2022-08-04T03:10:00+05:30,2022-08-03T21:40:00,0.0
"Adani Power Q1 profit rises to Rs 4,780 crore",https://www.financialexpress.com/business/industry-adani-power-q1-profit-rises-to-rs-4780-crore-2616285/,2022-08-03T17:02:01+05:30,2022-08-03T11:32:01,0.4404
"Adani firms, Tata Power spar in SC over Rs 7,000-crore Mumbai contract",https://www.financialexpress.com/business/industry-adani-firms-tata-power-spar-in-sc-over-rs-7000-crore-mumbai-contract-2615284/,2022-08-03T02:50:00+05:30,2022-08-02T21:20:00,0.0
"Reliance Jio likely bid highest for 5G spectrum at Rs 80,100 cr; total bid amount tops Rs 1.45 lakh cr",https://www.financialexpress.com/business/industry-reliance-jio-likely-bid-highest-for-5g-spectrum-at-rs-80100-cr-total-bid-amount-tops-rs-1-45-lakh-cr-2607738/,2022-07-27T11:32:46+05:30,2022-07-27T06:02:46,0.5106
Adani says never slowed investments; USD 70 billion to turn India to clean energy exporter,https://www.financialexpress.com/business/industry-adani-says-never-slowed-investments-usd-70-bn-to-turn-india-to-clean-energy-exporter-2606562/,2022-07-26T14:07:29+05:30,2022-07-26T08:37:29,0.5859
RAISE A FLAG: Two proxy advisory firms advise against voting for Adani’s resolutions,https://www.financialexpress.com/business/industry-raise-a-flag-two-proxy-advisory-firms-advise-against-voting-for-adanis-resolutions-2603940/,2022-07-24T05:00:00+05:30,2022-07-23T23:30:00,0.0
"Buy NTPC, Adani Transmission, others, Jefferies says power sector set to witness decade of growth",https://www.financialexpress.com/market/buy-ntpc-adani-transmission-others-jefferies-says-power-sector-set-to-witness-decade-of-growth-2602366/,2022-07-22T10:56:18+05:30,2022-07-22T05:26:18,0.3818
COAI welcomes Adani Group’s foray into telecom,https://www.financialexpress.com/business/industry-coai-welcomes-adani-groups-foray-into-telecom-2594487/,2022-07-15T01:15:00+05:30,2022-07-14T19:45:00,0.4019
"HCL Technologies, Mindtree, Axis Bank, SpiceJet, Delta Corp, Adani Group stocks in focus on 13 July",https://www.financialexpress.com/market/stocks-to-watch-hcl-technologies-mindtree-axis-bank-spicejet-delta-corp-adani-group-stocks-in-focus-today-13-july-2592115/,2022-07-13T08:26:45+05:30,2022-07-13T02:56:45,0.0
Adani group to begin telecom journey with Gujarat circle,https://www.financialexpress.com/business/industry-adani-group-to-begin-telecom-journey-with-gujarat-circle-2592067/,2022-07-13T05:45:00+05:30,2022-07-13T00:15:00,0.0
Telecom: Adani’s push has similarities to Jio foray,https://www.financialexpress.com/business/industry-telecom-adanis-push-has-similarities-to-jio-foray-2590871/,2022-07-12T08:19:55+05:30,2022-07-12T02:49:55,0.0
Bharti shares slump as Adani enters 5G race,https://www.financialexpress.com/business/industry-bharti-shares-slump-as-adani-enters-5g-race-2590671/,2022-07-12T05:25:00+05:30,2022-07-11T23:55:00,0.296
"Adani Group may spend Rs 2,800 crore on purchase of 5G spectrum",https://www.financialexpress.com/business/industry-adani-group-may-spend-rs-2800-crore-on-purchase-of-5g-spectrum-2589347/,2022-07-11T06:00:00+05:30,2022-07-11T00:30:00,0.0
Adanis to buy spectrum for private network use; Group confirms auction participation,https://www.financialexpress.com/business/industry-adanis-to-buy-spectrum-for-private-network-use-group-confirms-auction-participation-2588794/,2022-07-10T05:00:00+05:30,2022-07-09T23:30:00,0.0
Adani Group to bid for 5G spectrum; may be the first step towards private captive network,https://www.financialexpress.com/business/industry-adani-group-to-bid-for-5g-spectrum-may-be-the-first-step-towards-private-captive-network-2588146/,2022-07-09T03:45:00+05:30,2022-07-08T22:15:00,0.0
Supreme Court to hear Adani Ports appeal in July,https://www.financialexpress.com/business/industry-supreme-court-to-hear-adani-ports-appeal-in-july-2577534/,2022-06-30T08:31:40+05:30,2022-06-30T03:01:40,0.5574
"Adani arm, LG among 15 more to get white goods PLI benefits",https://www.financialexpress.com/business/industry-adani-arm-lg-among-15-more-to-get-white-goods-pli-benefits-2575892/,2022-06-29T00:20:00+05:30,2022-06-28T18:50:00,0.3818
"Registry not listing matters despite orders, says Supreme Court, asks Adani port to approach registrar",https://www.financialexpress.com/business/industry-registry-not-listing-matters-despite-orders-says-supreme-court-asks-adani-port-to-approach-registrar-2575662/,2022-06-28T17:49:53+05:30,2022-06-28T12:19:53,-0.4585
"Tata, Adani among 5 to exit Reliance Capital’s resolution; Piramal Enterprises among bidders left in race",https://www.financialexpress.com/business/industry-tata-adani-among-5-to-exit-reliance-capitals-resolution-piramal-enterprises-among-bidders-left-in-race-2573458/,2022-06-27T04:30:00+05:30,2022-06-26T23:00:00,0.0
"SBI, other PSU banks commit Rs 6,071 crore to Adani Group for copper business",https://www.financialexpress.com/business/industry-sbi-other-psu-banks-commit-rs-6071-crore-to-adani-group-for-copper-business-2573292/,2022-06-26T18:18:17+05:30,2022-06-26T12:48:17,0.296
Total to acquire 25% in Adani arm,https://www.financialexpress.com/business/industry-total-to-acquire-25-in-adani-arm-2560714/,2022-06-15T06:15:00+05:30,2022-06-15T00:45:00,0.0
"Adani Transmission, Vedanta, Tata Motors, V-Guard Industries, Poonawalla Finance stocks in focus on 6 June",https://www.financialexpress.com/market/stocks-to-watch-adani-transmission-vedanta-tata-motors-v-guard-poonawalla-finance-stocks-in-focus-on-6-june-2022-2549518/,2022-06-06T08:10:19+05:30,2022-06-06T02:40:19,0.0
"Investors Summit: Adani to invest Rs 70,000 crore in UP, create 30k jobs",https://www.financialexpress.com/business/industry-investors-summit-adani-to-invest-rs-70000-crore-in-up-create-30k-jobs-2548219/,2022-06-04T06:30:00+05:30,2022-06-04T01:00:00,0.2732
Essar Power to sell transmission line to Adani for Rs 1913 crore,https://www.financialexpress.com/business/industry-essar-power-to-sell-transmission-line-to-adani-for-rs-1913-crore-2548169/,2022-06-04T02:45:00+05:30,2022-06-03T21:15:00,0.0
"Essar Power sells transmission line to Adani Transmission for Rs 1,913 cr",https://www.financialexpress.com/business/industry-essar-power-sells-transmission-line-to-adani-transmission-for-rs-1913-cr-2547943/,2022-06-03T18:33:03+05:30,2022-06-03T13:03:03,0.0
Adani Ports and SEZ Rating: reduce; Weak performance was along expected lines,https://www.financialexpress.com/market/adani-ports-and-sez-rating-reduce-weak-performance-was-along-expected-lines-2542904/,2022-05-31T02:30:00+05:30,2022-05-30T21:00:00,-0.4404
Adani Defence to acquire 50% stake in Bengaluru-based General Aeronautics,https://www.financialexpress.com/business/defence-adani-defence-to-acquire-50-stake-in-bengaluru-based-general-aeronautics-2540552/,2022-05-28T05:00:00+05:30,2022-05-27T23:30:00,0.1027
"APSEZ quarterly profit falls 22 per cent to Rs 1,033 crore",https://www.financialexpress.com/business/industry-apsez-quarterly-profit-falls-22-per-cent-to-rs-1033-crore-2537061/,2022-05-25T11:33:19+05:30,2022-05-25T06:03:19,0.4404
Cement sector set to see new wave of consolidation,https://www.financialexpress.com/business/industry-cement-sector-set-to-see-new-wave-of-consolidation-2530284/,2022-05-19T08:06:17+05:30,2022-05-19T02:36:17,0.0
Adani Enterprises to foray into healthcare business,https://www.financialexpress.com/business/industry-adani-enterprises-to-foray-into-healthcare-business-2530107/,2022-05-19T11:20:30+05:30,2022-05-19T05:50:30,0.0
"Abu Dhabi’s IHC completes investment of Rs 15,400 crore in three Adani companies",https://www.financialexpress.com/business/industry-abu-dhabis-ihc-completes-investment-of-rs-15400-crore-in-three-adani-companies-2528615/,2022-05-18T01:45:00+05:30,2022-05-17T20:15:00,0.0
Gautam Shantilaladani: Audacity is the name of the game for him,https://www.financialexpress.com/business/industry-gautam-shantilaladani-audacity-is-the-name-of-the-game-for-him-2527259/,2022-05-17T09:18:36+05:30,2022-05-17T03:48:36,0.0
"Adani family makes open offer for Ambuja Cements, ACC stakes",https://www.financialexpress.com/business/industry-adani-family-makes-open-offer-for-ambuja-cements-acc-stakes-2526937/,2022-05-17T02:30:00+05:30,2022-05-16T21:00:00,0.0
No capital gains or any other tax for Adani deal: Holcim CEO Jan Jenisch,https://www.financialexpress.com/business/industry-no-capital-gains-or-any-other-tax-for-adani-deal-holcim-ceo-jan-jenisch-2526902/,2022-05-17T00:30:00+05:30,2022-05-16T19:00:00,0.0516
"Tech Mahindra, Ambuja Cements, Maruti Suzuki, Eicher Motors, DMart, Nazara Technologies stocks in focus",https://www.financialexpress.com/india-news/stocks-to-watch-tech-mahindra-ambuja-cements-maruti-suzuki-eicher-motors-dmart-nazara-tech-adani-stocks-in-focus/2525888/,2022-05-16T08:08:48+05:30,2022-05-16T02:38:48,0.0
