headline,link,date_str,parsed_date_iso,sentiment_score
Good News! Retail inflation eases to 5.48% in November from 6.2% in October,https://www.financialexpress.com/policy/economy-good-news-retail-inflation-eases-to-5-48-in-november-from-62-in-october-3690272/,2024-12-12T18:33:13+05:30,2024-12-12T13:03:13,0.6696
Explained: How is Cash Reserve Ratio related to inflation,https://www.financialexpress.com/policy/economy-explained-how-is-cash-reserve-ratio-related-to-inflation-3684894/,2024-12-05T14:02:33+05:30,2024-12-05T08:32:33,0.0
UK-India Free Trade Agreement to relaunch in early 2025: What’s at stake?,https://www.financialexpress.com/business/industry-uk-india-free-trade-agreement-to-relaunch-in-early-2025-whats-at-stake-3669070/,2024-11-19T15:00:43+05:30,2024-11-19T09:30:43,0.7579
Urban slowdown more than cyclical,https://www.financialexpress.com/policy/economy-urban-slowdown-more-than-cyclical-2-3655525/,2024-11-04T05:30:00+05:30,2024-11-04T00:00:00,0.0
Urban slowdown more than cyclical,https://www.financialexpress.com/policy/economy-urban-slowdown-more-than-cyclical-3655497/,2024-11-04T00:30:00+05:30,2024-11-03T19:00:00,0.0
"Eminent economist Bibek Debroy passes away, PM Modi mourns loss",https://www.financialexpress.com/india-news/economist-bibek-debroy-passes-away-pm-modi-mourns-loss/3654079/,2024-11-01T17:11:35+05:30,2024-11-01T11:41:35,-0.6908
"Growth, jobs and manufacturing",https://www.financialexpress.com/opinion/growth-jobs-and-manufacturing/3648840/,2024-10-25T04:00:00+05:30,2024-10-24T22:30:00,0.3818
Fall in states’ spend compounds worries over public capex,https://www.financialexpress.com/policy/economy-fall-in-states-spend-compounds-worries-over-public-capex-3638429/,2024-10-14T00:15:00+05:30,2024-10-13T18:45:00,-0.4215
Probes into pre-GST tax evasion complete,https://www.financialexpress.com/policy/economy-probes-into-pre-gst-tax-evasion-complete-3638421/,2024-10-14T00:10:00+05:30,2024-10-13T18:40:00,0.0
CareEdge move stirs debate on rating criteria of Big 3,https://www.financialexpress.com/policy/economy-careedge-move-stirs-debate-on-rating-criteria-of-big-3-3632120/,2024-10-07T12:30:00+05:30,2024-10-07T07:00:00,0.0
China stimulus raise hopes of lower dumping into India,https://www.financialexpress.com/business/industry-china-stimulus-raise-hopes-of-lower-dumping-into-india-3632225/,2024-10-07T02:30:00+05:30,2024-10-06T21:00:00,-0.1779
GIPE appoints Sanjeev Sanyal as chairman,https://www.financialexpress.com/policy/economy-gipe-appoints-sanjeev-sanyal-as-chairman-3632196/,2024-10-07T01:45:00+05:30,2024-10-06T20:15:00,0.0
"Financial savings by households take a backseat, focus shifts to wealth creation",https://www.financialexpress.com/policy/economy-financial-savings-by-households-take-a-backseat-focus-shifts-to-wealth-creation-3632187/,2024-10-07T01:30:00+05:30,2024-10-06T20:00:00,0.6486
Moderate hike in wheat MSP likely,https://www.financialexpress.com/policy/economy-moderate-hike-in-wheat-msp-likelynbsp-3632172/,2024-10-07T01:15:00+05:30,2024-10-06T19:45:00,0.0
"60,000 acres of salt land now available for industrial use, housing",https://www.financialexpress.com/business/industry-60000-acres-of-salt-land-now-available-for-industrial-use-housing-3632162/,2024-10-07T01:00:00+05:30,2024-10-06T19:30:00,0.0
"India’s manufacturing sector growth of 7% in Q1, highlights further potential",https://www.financialexpress.com/policy/economy-indias-manufacturing-sector-growth-of-7-in-q1-highlights-further-potential-3628710/,2024-10-02T16:50:17+05:30,2024-10-02T11:20:17,0.3818
Centre appoints 3 new external MPC members,https://www.financialexpress.com/policy/economy-centre-appoints-3-new-external-mpc-members-3628299/,2024-10-02T06:00:00+05:30,2024-10-02T00:30:00,0.0
IBC must evolve to achieve 7-8% GDP growth: CEA,https://www.financialexpress.com/policy/economy-ibc-must-evolve-to-achieve-7-8-gdp-growth-cea-3628258/,2024-10-02T03:15:00+05:30,2024-10-01T21:45:00,0.3818
"Tax board weighs GST slabs rejig, revenue impact",https://www.financialexpress.com/policy/economy-tax-board-weighs-gst-slabs-rejig-revenue-impact-3628238/,2024-10-02T03:00:00+05:30,2024-10-01T21:30:00,0.0
MSP operations for paddy commences,https://www.financialexpress.com/policy/economy-msp-operations-for-paddynbspcommences-3628145/,2024-10-02T02:00:00+05:30,2024-10-01T20:30:00,0.0
"Capex pace regained after elections led by manufacturing sector, new investment projects surge 43% in Q2FY25",https://www.financialexpress.com/policy/economy-capex-pace-regained-after-elections-3628135/,2024-10-02T01:45:00+05:30,2024-10-01T20:15:00,0.0
Why our experts can’t agree on joblessness,https://www.financialexpress.com/policy/economy-why-our-experts-cant-agree-on-joblessness-3628102/,2024-10-02T00:45:00+05:30,2024-10-01T19:15:00,0.3612
"Curtains down for GST anti-profiteering law, no fresh cases after this fiscal",https://www.financialexpress.com/policy/economy-curtains-down-for-gst-anti-profiteering-law-no-fresh-cases-after-this-fiscal-3628108/,2024-10-01T22:02:21+05:30,2024-10-01T16:32:21,0.0258
What’s the big worry for India now? UBS poses 5 key questions for economy,https://www.financialexpress.com/policy/economy-whats-the-big-worry-for-india-now-ubs-poses-5-key-questions-for-economy-3624080/,2024-09-27T17:54:51+05:30,2024-09-27T12:24:51,-0.4404
Price support to farm produce buttressed; no “legal MSP” yet,https://www.financialexpress.com/policy/economy-price-support-to-farm-produce-buttressed-no-legal-msp-yet-3616184/,2024-09-20T02:15:00+05:30,2024-09-19T20:45:00,0.128
Wealth tech firm Centricity targets Rs 120-cr top line in FY25,https://www.financialexpress.com/business/industry-wealth-tech-firm-centricity-targets-rs-120-cr-top-line-in-fy25-3615000/,2024-09-19T05:00:00+05:30,2024-09-18T23:30:00,0.6124
Arcelor India JV rolls out new brand,https://www.financialexpress.com/business/industry-arcelor-india-jv-rolls-out-new-brand-3615017/,2024-09-19T04:45:00+05:30,2024-09-18T23:15:00,0.0
Direct tax receipts up 16% on year till Sept 15,https://www.financialexpress.com/policy/economy-direct-tax-receipts-up-16-on-year-till-sept-15-3613902/,2024-09-18T05:00:00+05:30,2024-09-17T23:30:00,0.0
India: A Strategic and reliable partner for mediterranean economies,https://www.financialexpress.com/policy/economy-india-a-strategic-and-reliable-partner-for-mediterranean-economies-3604064/,2024-09-07T11:20:18+05:30,2024-09-07T05:50:18,0.0
Govt mulls easing rice export curbs,https://www.financialexpress.com/policy/economy-govt-mulls-easing-rice-export-curbs-3598363/,2024-09-02T01:15:00+05:30,2024-09-01T19:45:00,0.25
Centre seeks larger role for states in FDI drive,https://www.financialexpress.com/policy/economy-centre-seeks-larger-role-for-states-in-fdi-drive-3598354/,2024-09-02T00:45:00+05:30,2024-09-01T19:15:00,0.0
Economists keep FY25 growth projections unchanged around 7%,https://www.financialexpress.com/policy/economy-economists-keep-fy25-growth-projections-unchanged-around-7-3598339/,2024-09-02T00:30:00+05:30,2024-09-01T19:00:00,0.3818
Economy on track to achieve 6.5-7% growth in FY25: CEA,https://www.financialexpress.com/policy/economy-economy-on-track-to-achieve-6-5-7-growth-in-fy25-cea-3597398/,2024-08-30T23:58:07+05:30,2024-08-30T18:28:07,0.3818
Centre sets milestones for states on urban land reforms,https://www.financialexpress.com/policy/economy-centre-sets-milestones-for-states-on-urban-land-reformsnbsp-3596309/,2024-08-29T21:39:09+05:30,2024-08-29T16:09:09,0.0
"Fitch affirms India sovereign rating, outlook",https://www.financialexpress.com/policy/economy-fitch-affirms-india-sovereign-rating-outlook-3596277/,2024-08-29T20:49:13+05:30,2024-08-29T15:19:13,0.0
Import duties on edible oils may be raised soon,https://www.financialexpress.com/policy/economy-import-duties-on-edible-oils-may-be-raised-soon-3595332/,2024-08-29T02:30:00+05:30,2024-08-28T21:00:00,0.0
Cabinet approves aid to 15 GW northeast hydro projects,https://www.financialexpress.com/business/industry-cabinet-approves-aid-to-15-gw-northeast-hydro-projects-3595316/,2024-08-29T01:45:00+05:30,2024-08-28T20:15:00,0.4019
PMJDY to aid Viksit Bharat mission: Modi,https://www.financialexpress.com/policy/economy-pmjdy-to-aid-viksit-bharat-mission-modi-3595301/,2024-08-29T01:15:00+05:30,2024-08-28T19:45:00,0.0
India Inc’s high inventory shows consumption demand weakness,https://www.financialexpress.com/business/industry-india-incs-high-inventory-shows-consumption-demand-weakness-3591091/,2024-08-24T05:30:00+05:30,2024-08-24T00:00:00,-0.5106
"Rs 95,000 crore capex loans to states linked to reforms",https://www.financialexpress.com/policy/economy-rs-95000-crore-capex-loans-to-states-linked-to-reforms-3591003/,2024-08-24T00:30:00+05:30,2024-08-23T19:00:00,0.0
Open market sale of wheat likely to start next month,https://www.financialexpress.com/policy/economy-open-market-sale-of-wheat-likely-to-start-next-month-3590100/,2024-08-23T06:00:00+05:30,2024-08-23T00:30:00,0.0
"Active funds based on narrow themes a concern, says Axis AMC",https://www.financialexpress.com/money/active-funds-based-on-narrow-themes-a-concern-says-axis-amc-3590109/,2024-08-23T03:15:00+05:30,2024-08-22T21:45:00,0.4019
Manufacturing PMI slips slightly in August,https://www.financialexpress.com/policy/economy-manufacturing-pmi-slips-slightly-in-august-3590066/,2024-08-23T02:15:00+05:30,2024-08-22T20:45:00,0.0
"Infy, some global firms likely to get GST relief",https://www.financialexpress.com/policy/economy-nbspinfy-some-global-firms-likely-to-get-gst-reliefnbsp-3590013/,2024-08-22T21:58:03+05:30,2024-08-22T16:28:03,0.4767
Can India be the next China? UBS jots down India’s to-do list to grab a share of Chinese pie,https://www.financialexpress.com/policy/economy-can-india-be-the-next-china-ubs-jots-down-indias-to-do-list-to-grab-a-share-of-chinese-pie-3589731/,2024-08-22T16:27:23+05:30,2024-08-22T10:57:23,0.296
"Govt plans to boost oilseed output, cut imports",https://www.financialexpress.com/policy/economy-govt-plans-to-boost-oilseed-output-cut-imports-3589097/,2024-08-22T04:30:00+05:30,2024-08-21T23:00:00,0.1531
Govt aiming to fully automate customs processes by April 2026,https://www.financialexpress.com/business/industry-govt-aiming-to-fully-automate-customs-processes-by-april-2026nbsp-3589029/,2024-08-22T04:00:00+05:30,2024-08-21T22:30:00,0.0
E-way bills touch record high of 104.8 mn in July,https://www.financialexpress.com/business/industry-e-way-bills-touch-record-high-of-104-8-mn-in-july-3589000/,2024-08-22T03:10:00+05:30,2024-08-21T21:40:00,0.0
Trent positioning Star Bazaar as its latest growth driver,https://www.financialexpress.com/business/industry-trent-positioning-star-bazaar-as-its-latest-growth-driver-3589089/,2024-08-22T02:06:08+05:30,2024-08-21T20:36:08,0.3818
Tribeca in talks for developing Trump Towers in Indian cities,https://www.financialexpress.com/business/industry-tribeca-in-talks-for-developing-trump-towers-in-indian-cities-3589080/,2024-08-22T01:18:14+05:30,2024-08-21T19:48:14,0.0
"India needs to create 60-148 million more jobs in six years, says IMF’s Gita Gopinath",https://www.financialexpress.com/jobs-career/india-needs-to-create-60-148-million-more-jobs-in-six-years-says-imfs-gita-gopinath-3584814/,2024-08-16T18:10:21+05:30,2024-08-16T12:40:21,0.2732
"Next-Generation Roads & Highways Paving Way for Prosperity, Economic Boom",https://www.financialexpress.com/business/industry-next-generation-roads-amp-highways-paving-way-for-prosperity-economic-boom-3581812/,2024-08-13T16:20:17+05:30,2024-08-13T10:50:17,0.0
"‘Global opportunity lies for MSMEs to revitalize role in innovation ecosystem, counter decline in their relevance’",https://www.financialexpress.com/business/sme/theres-global-opportunity-for-msmes-to-revitalize-their-role-in-innovation-ecosystem-counter-decline-in-their-relevance/3579235/,2024-08-13T09:00:00+05:30,2024-08-13T03:30:00,0.3818
"India will be our top market in 5-10 years, says Glenmorangie CEO MacRae",https://www.financialexpress.com/business/industry-india-will-be-our-top-market-in-5-10-years-says-glenmorangie-ceo-macrae-3573023/,2024-08-04T03:30:00+05:30,2024-08-03T22:00:00,0.2023
PM: Food-surplus India now aiding global food security,https://www.financialexpress.com/policy/economy-pm-food-surplus-india-now-aiding-global-food-security-3573018/,2024-08-04T00:01:11+05:30,2024-08-03T18:31:11,0.34
Q1 growth may take a hit as public capex plunges,https://www.financialexpress.com/policy/economy-q1-growth-may-take-a-hit-as-public-capex-plunges-3570422/,2024-08-01T05:30:00+05:30,2024-08-01T00:00:00,0.3818
EU offer on CBAM no relief: Report,https://www.financialexpress.com/policy/economy-eu-offer-on-cbam-no-relief-report-3570429/,2024-08-01T03:30:00+05:30,2024-07-31T22:00:00,0.2263
Centre announces 12 new industrial parks and mega textile projects to boost economic growth,https://www.financialexpress.com/business/infrastructure-centre-announces-12-new-industrial-parks-and-mega-textile-projects-to-boost-economic-growth-3569754/,2024-07-31T13:24:32+05:30,2024-07-31T07:54:32,0.6486
Global brands to keep date with India as H2 looks better,https://www.financialexpress.com/business/industry-global-brands-to-keep-date-with-india-as-h2-looks-better-3569228/,2024-07-31T12:30:00+05:30,2024-07-31T07:00:00,0.4404
"Allocation to states robust, Opposition misleading: FM",https://www.financialexpress.com/policy/economy-allocation-to-states-robust-opposition-misleading-fm-3569373/,2024-07-31T06:00:00+05:30,2024-07-31T00:30:00,-0.0772
No review of policy on Chinese FDI: Goyal,https://www.financialexpress.com/policy/economy-no-review-of-policy-on-chinese-fdi-goyal-3569297/,2024-07-31T05:30:00+05:30,2024-07-31T00:00:00,-0.296
Hunger in India down to 13.7% in 3 years to 2023,https://www.financialexpress.com/policy/economy-hunger-in-india-down-to-13-7-in-3-years-to-2023-3569389/,2024-07-31T04:45:00+05:30,2024-07-30T23:15:00,-0.25
"Tata Consumer Q1 profit falls 8.3%, misses estimates",https://www.financialexpress.com/business/industry-tata-consumer-q1-profit-falls-8-3-misses-estimates-3569351/,2024-07-31T03:45:00+05:30,2024-07-30T22:15:00,0.25
Critical mineral auctions come a cropper,https://www.financialexpress.com/business/industry-critical-mineral-auctions-come-a-cropper-3569331/,2024-07-31T03:00:00+05:30,2024-07-30T21:30:00,-0.3182
No proposal under consideration for 8th pay panel,https://www.financialexpress.com/policy/economy-no-proposal-under-consideration-for-8th-pay-panel-3569289/,2024-07-31T01:30:00+05:30,2024-07-30T20:00:00,-0.3818
NHAI plans new infrastructure investment trust,https://www.financialexpress.com/market/nhai-plans-new-infrastructure-investment-trust-3569314/,2024-07-30T22:49:09+05:30,2024-07-30T17:19:09,0.5106
EXPLAINER: Shifting focus to debt-to-GDP ratio,https://www.financialexpress.com/policy/economy-explainershifting-focus-to-debt-to-gdp-ratio-3568426/,2024-07-30T04:30:00+05:30,2024-07-29T23:00:00,0.0
8.5 million houses delivered under PMAY-U: Govt,https://www.financialexpress.com/policy/economy-8-5-million-houses-delivered-under-pmay-u-govtnbsp-3568371/,2024-07-30T02:40:00+05:30,2024-07-29T21:10:00,0.0
Serentica Renewables aims to add 2 GW capacity in FY25,https://www.financialexpress.com/business/industry-serentica-renewables-aims-to-add-2-gw-capacity-in-fy25-3568383/,2024-07-30T02:40:00+05:30,2024-07-29T21:10:00,0.0
Companies Act to see slew of changes soon,https://www.financialexpress.com/business/industry-companies-act-to-see-slew-of-changes-soon-3568305/,2024-07-30T01:40:00+05:30,2024-07-29T20:10:00,0.0
Arvind registers 40% decline in net profit and marginal revenue loss in Q1 of FY25,https://www.financialexpress.com/business/industry-arvind-registers-40-decline-in-net-profit-and-marginal-revenue-loss-in-q1-of-fy25-3568250/,2024-07-29T20:13:34+05:30,2024-07-29T14:43:34,0.1531
Cloud over climate finance: The regulatory framework must be reformed to enable public and private climate investments,https://www.financialexpress.com/opinion/cloud-over-climate-finance-the-regulatory-framework-must-be-reformed-to-enable-public-and-private-climate-investments/3567218/,2024-07-29T04:30:00+05:30,2024-07-28T23:00:00,0.0
Customs duty exemption for electricity supply from SEZs extended in Budget,https://www.financialexpress.com/budget/customs-duty-exemption-for-electricity-supply-from-sezs-extended-in-budget-3564263/,2024-07-25T03:30:00+05:30,2024-07-24T22:00:00,0.0
“Three-slab GST very much a possibility”: CBIC Chairman,https://www.financialexpress.com/policy/economy-three-slab-gst-very-much-a-possibility-cbic-chairman-3564243/,2024-07-25T03:00:00+05:30,2024-07-24T21:30:00,0.0
Food subsidy may sharply overshoot BE of Rs 2.05 trillion,https://www.financialexpress.com/policy/economy-food-subsidy-may-sharply-overshoot-be-of-rs-2-05-trillion-3564213/,2024-07-25T02:00:00+05:30,2024-07-24T20:30:00,0.0
The MSME payment puzzle,https://www.financialexpress.com/opinion/the-msme-payment-puzzle/3560121/,2024-07-22T05:30:00+05:30,2024-07-22T00:00:00,0.0
Awfis eyes 30% revenue growth in FY25,https://www.financialexpress.com/business/industry-awfis-eyes-30-revenue-growth-in-fy25-3560126/,2024-07-22T02:05:00+05:30,2024-07-21T20:35:00,0.3818
"‘Viksit Bharat vision hinges on economic growth with inclusive development, digital penetration, social welfare’",https://www.financialexpress.com/business/sme/viksit-bharat-vision-hinges-on-economic-growth-with-inclusive-development-digital-penetration-social-welfare/3559750/,2024-07-21T11:22:12+05:30,2024-07-21T05:52:12,0.5574
E-mobility in the fast lane,https://www.financialexpress.com/opinion/e-mobility-in-the-fast-lane/3553417/,2024-07-15T05:00:00+05:30,2024-07-14T23:30:00,0.0
‘Safe harbour’ clause: Market participants push for reforms,https://www.financialexpress.com/market/safe-harbour-clause-market-participants-push-for-reforms-3553424/,2024-07-14T23:12:37+05:30,2024-07-14T17:42:37,0.0
Fix the supply chain,https://www.financialexpress.com/opinion/fix-the-supply-chain/3550054/,2024-07-11T04:30:00+05:30,2024-07-10T23:00:00,0.0
RBI raises concerns over ‘lakhs’ of accounts used for fraud & evergreening,https://www.financialexpress.com/business/banking-finance-rbi-raises-concerns-over-lakhs-of-accounts-used-for-fraud-amp-evergreening-3548956/,2024-07-09T23:57:08+05:30,2024-07-09T18:27:08,-0.5859
Cognizant settles Dalal lawsuit with Wipro Intro: Pays Rs 4 crore in settlement,https://www.financialexpress.com/business/industry-cognizant-settles-dalal-lawsuit-with-wipro-intro-pays-rs-4-crore-in-settlement-3548936/,2024-07-09T23:29:36+05:30,2024-07-09T17:59:36,-0.2263
Project intent down 92% in June quarter,https://www.financialexpress.com/what-is/economy-what-is/project-intent-down-92-in-june-quarter/3540836/,2024-07-02T03:45:00+05:30,2024-07-01T22:15:00,0.0
"Build data portal for finance commission, says Panagariya",https://www.financialexpress.com/policy/economy-build-data-portal-for-finance-commission-says-panagariya-3539153/,2024-06-30T04:10:00+05:30,2024-06-29T22:40:00,0.0
May core sector growth slows down to 6.3%,https://www.financialexpress.com/what-is/economy-what-is/may-core-sector-growth-slows-down-to-6-3/3538456/,2024-06-29T04:35:00+05:30,2024-06-28T23:05:00,0.3818
Need to revamp growth engines and kick-start new ones makes task more complicated,https://www.financialexpress.com/opinion/need-to-revamp-growth-engines-and-kick-start-new-ones-makes-task-more-complicated/3538420/,2024-06-29T04:00:00+05:30,2024-06-28T22:30:00,0.3818
Mandi prices of mustard rises above MSP after govt purchases,https://www.financialexpress.com/policy/economy-mandi-prices-of-mustard-rises-above-msp-after-govt-purchasesnbsp-3533811/,2024-06-25T04:50:00+05:30,2024-06-24T23:20:00,0.0
Stock holding limit imposed on wheat,https://www.financialexpress.com/policy/economy-stock-holding-limit-imposed-on-wheatnbsp-3533803/,2024-06-25T04:40:00+05:30,2024-06-24T23:10:00,-0.0772
India’s economic growth and threat of inflation,https://www.financialexpress.com/policy/economy-indias-economic-growth-and-threat-of-inflation-3527600/,2024-06-18T09:39:29+05:30,2024-06-18T04:09:29,-0.2023
‘MSME growth through fintech innovations to play major role in $5 trillion economy’,https://www.financialexpress.com/business/sme/msme-growth-through-fintech-innovations-to-play-major-role-in-5-trillion-economy/3525581/,2024-06-15T12:17:28+05:30,2024-06-15T06:47:28,0.6124
"GenAI for growth: Emerging technologies set to propel India’s economic transformation, says EY report",https://www.financialexpress.com/business/industry-genai-for-growth-emerging-technologies-set-to-propel-indias-economic-transformation-says-ey-report-3521191/,2024-06-11T10:10:10+05:30,2024-06-11T04:40:10,0.3818
India’s services PMI softens to 5-month low on May to 60.2 from 60.8 in April,https://www.financialexpress.com/policy/economy-indias-services-pmi-softens-to-5-month-low-on-may-to-60-2-from-608-in-april-3515110/,2024-06-05T12:42:09+05:30,2024-06-05T07:12:09,-0.2732
To take major economic decisions in third term: Modi,https://www.financialexpress.com/policy/economy-to-take-major-economic-decisions-in-third-term-modi-3514589/,2024-06-05T04:40:00+05:30,2024-06-04T23:10:00,0.0
"What Modi 3.0 could mean for Indian economy: Experts bet on policy continuity, all eyes on RBI announcement on June 7",https://www.financialexpress.com/policy/economy-what-modi-3-0-could-mean-for-indian-economy-experts-bet-on-policy-continuity-all-eyes-on-rbi-announcement-on-june-7-3512057/,2024-06-04T07:08:43+05:30,2024-06-04T01:38:43,0.0
BJP’s third consecutive mandate- Hit the ground running,https://www.financialexpress.com/opinion/bjps-third-consecutive-mandate-hit-the-ground-running/3511124/,2024-06-03T15:02:54+05:30,2024-06-03T09:32:54,0.0
Economists give a thumbs up to robust FY24 GDP ahead of poll results on June 4; maintain FY25 estimates at 6.5-7%,https://www.financialexpress.com/policy/economy-economists-give-a-thumbs-up-to-robust-fy24-gdp-ahead-of-poll-results-on-june-4-maintain-fy25-estimates-at-6-5-7-3510085/,2024-06-02T15:21:44+05:30,2024-06-02T09:51:44,0.34
Lok Sabha Elections 2024: Congress’ Nyay vs Modi ki Guarantee: What the poll promises will cost the nation?,https://www.financialexpress.com/policy/economy-lok-sabha-elections-2024-congresss-nyay-patra-vs-modi-ki-guarantee-find-out-what-it-means-for-the-economy-3508243/,2024-05-31T15:07:16+05:30,2024-05-31T09:37:16,0.5574
‘Some optimism’ about sustained rebound in global growth: Chief Economists Outlook survey,https://www.financialexpress.com/policy/economy-some-optimism-about-sustained-rebound-in-global-growth-chief-economists-outlook-survey-3506635/,2024-05-30T07:59:18+05:30,2024-05-30T02:29:18,0.3818
Did you know? Indian MSMEs only 26% as productive as large companies: McKinsey report,https://www.financialexpress.com/business/sme/did-you-know-indian-msmes-only-26-as-productive-as-large-companies-mckinsey-report/3506330/,2024-05-29T18:22:32+05:30,2024-05-29T12:52:32,0.0
"S&P upgrades India’s rating outlook to positive from stable, on robust growth, improved govt spending",https://www.financialexpress.com/policy/economy-sp-upgrades-indias-rating-outlook-to-positive-from-stable-on-robust-growth-improved-govt-spending-3506082/,2024-05-29T15:22:17+05:30,2024-05-29T09:52:17,0.9169
India needs to boost manufacturing growth to absorb more workers and realise the principal intent underlying the ‘Make in India’ initiative,https://www.financialexpress.com/opinion/india-needs-to-boost-manufacturing-growth-to-absorb-more-workers-and-realise-the-principal-intent-underlying-the-make-in-india-initiative/3503641/,2024-05-28T05:00:00+05:30,2024-05-27T23:30:00,0.6486
Ensuring spice purity: Advanced techniques for detection of adulterants,https://www.financialexpress.com/business/industry-ensuring-spice-purity-advanced-techniques-for-detection-of-adulterants-3500556/,2024-05-24T18:05:49+05:30,2024-05-24T12:35:49,0.4767
India logs robust business activity growth in May,https://www.financialexpress.com/policy/economy-india-logs-robust-business-activity-growth-in-maynbsp-3499382/,2024-05-24T01:30:00+05:30,2024-05-23T20:00:00,0.6124
Govt may resume open market sale of wheat next month,https://www.financialexpress.com/policy/economy-govt-may-resume-open-market-sale-of-wheat-next-month-3499377/,2024-05-24T01:15:00+05:30,2024-05-23T19:45:00,0.0
‘Osama Bin Lager’ beer goes viral in UK; brewery shuts down website amid high demand,https://www.financialexpress.com/world-news/osama-bin-lager-beer-goes-viral-in-uk-brewery-shuts-down-website-amid-high-demand/3499454/,2024-05-23T23:43:01+05:30,2024-05-23T18:13:01,-0.128
Beyond the polls: How voters and governments can tackle unemployment,https://www.financialexpress.com/policy/economy-beyond-the-polls-how-voters-and-governments-can-tackle-unemployment-3495011/,2024-05-20T17:48:38+05:30,2024-05-20T12:18:38,-0.4404
The India-Middle East-Europe Corridor will pave the way for a new global economic order,https://www.financialexpress.com/policy/economy-the-india-middle-east-europe-corridor-will-pave-the-way-for-a-new-global-economic-order-3492747/,2024-05-18T18:53:49+05:30,2024-05-18T13:23:49,0.0
"India’s Foreign Exchange Reserves surge to $644.15 billion, marking second consecutive weekly gain",https://www.financialexpress.com/policy/economy-indias-foreign-exchange-reserves-surge-to-644-15-billion-marking-second-consecutive-weekly-gain-3492082/,2024-05-17T19:24:12+05:30,2024-05-17T13:54:12,0.5267
Adverse weather hit potato output in UP and Bengal,https://www.financialexpress.com/policy/economy-adverse-weather-hit-potato-output-in-up-and-bengal-3491122/,2024-05-17T04:15:00+05:30,2024-05-16T22:45:00,-0.3612
Unemployment rate in urban areas declines,https://www.financialexpress.com/policy/economy-unemployment-rate-in-urban-areas-declines-3489854/,2024-05-16T06:30:00+05:30,2024-05-16T01:00:00,-0.4404
