headline,link,date_str,parsed_date_iso,sentiment_score
Nuvama’s top Buy recommendations at this hour,https://www.financialexpress.com/market/nuvamas-top-pick-at-this-hour-3853224/,2025-05-22T10:05:43+05:30,2025-05-22T04:35:43,0.2023
Crompton Greaves shares surge 6%: 3 factors powering the rally,https://www.financialexpress.com/market/crompton-greaves-shares-surge-6-3-factors-powering-the-rally-3846867/,2025-05-16T10:43:04+05:30,2025-05-16T05:13:04,0.296
"Eicher Motors shares in focus; brokerages bet on Royal Enfield’s new launches, electric motorcycles",https://www.financialexpress.com/market/eicher-motors-shares-in-focus-brokerages-bet-on-royal-enfields-new-launches-electric-motorcycles-3845356/,2025-05-15T09:07:23+05:30,2025-05-15T03:37:23,0.296
Bharat Forge surges 5% on rising India-Pakistan tension: Can defence orderbook fuel FY26 growth?,https://www.financialexpress.com/market/bharat-forge-surges-5-on-rising-india-pakistan-tension-can-defence-orderbook-fuel-fy26-growth-3838507/,2025-05-09T13:20:57+05:30,2025-05-09T07:50:57,0.1779
"HPCL: 3 reasons why Nuvama sees 15% downside, recommends Reduce",https://www.financialexpress.com/market/hpcl-3-reasons-why-nuvama-sees-15-downside-recommends-reduce-3836788/,2025-05-08T09:17:47+05:30,2025-05-08T03:47:47,-0.0258
M&M shares in full throttle: Here are 3 reasons powering the surge,https://www.financialexpress.com/market/mampm-shares-in-full-throttle-here-are-3-reasons-powering-the-surge-3834242/,2025-05-06T12:35:04+05:30,2025-05-06T07:05:04,0.296
Kotak Mahindra Bank slides 5%. 3 reasons why brokerages downgrade stock,https://www.financialexpress.com/market/kotak-mahindra-bank-slides-4-3-reasons-why-brokerages-downgrade-stock-3832779/,2025-05-05T09:41:32+05:30,2025-05-05T04:11:32,0.0
Nuvama’s top Buy recommendations at this hour,https://www.financialexpress.com/market/nuvamas-top-buy-recommendations-at-this-hour-3829155/,2025-05-01T17:00:54+05:30,2025-05-01T11:30:54,0.2023
"Don’t Miss the Fizz! 3 reasons why Nuvama has ‘Buy’ on Varun Beverages, Pepsi’s key bottler outside US",https://www.financialexpress.com/market/dont-miss-the-fizz-3-reasons-why-nuvama-has-buy-onnbspvarun-beveragesnbsppepsis-key-bottler-outside-us-3828686/,2025-05-01T11:17:30+05:30,2025-05-01T05:47:30,-0.2244
"ACC down nearly 10% in 5 days: Should you buy, sell or hold?",https://www.financialexpress.com/market/acc-down-nearly-10-in-5-days-should-you-buy-sell-or-hold-3827665/,2025-04-30T13:46:54+05:30,2025-04-30T08:16:54,0.0
Nuvama slashes target price for this City Gas Stock: 3 reasons why,https://www.financialexpress.com/market/nuvama-slashes-target-price-for-this-city-gas-stock-3-reasons-why-3826020/,2025-04-29T09:49:19+05:30,2025-04-29T04:19:19,-0.2023
Ather Energy IPO launching on April 28: Nuvama sees it riding the mega EV trend,https://www.financialexpress.com/market/ather-energy-ipo-launching-on-april-28-nuvama-sees-it-riding-the-mega-ev-trend-3820264/,2025-04-24T12:43:21+05:30,2025-04-24T07:13:21,0.2732
HCL Tech share price soars over 7% but brokerages say tariff concerns continue: 3 reasons why,https://www.financialexpress.com/market/hcl-tech-soars-6-but-brokerages-say-tariff-concerns-continue-3-reasons-why-3818957/,2025-04-23T10:31:14+05:30,2025-04-23T05:01:14,0.1531
Nuvama cuts Oberoi Realty target price by 15%: 3 crucial concerns are…,https://www.financialexpress.com/market/nuvama-cuts-oberoi-realty-target-price-by-15-3-crucial-concerns-are-3817972/,2025-04-22T14:04:02+05:30,2025-04-22T08:34:02,-0.296
"HDFC Bank: 5 reasons why brokerages upgrade rating, raise target as high as Rs 2,660",https://www.financialexpress.com/market/hdfc-bank-5-reasons-why-brokerages-upgrade-rating-raise-target-as-high-as-rs-2340-3816343/,2025-04-21T09:14:35+05:30,2025-04-21T03:44:35,0.0
Nuvama initiates coverage on Ajax Engineering: 3 reasons why,https://www.financialexpress.com/market/nuvama-initiates-coverage-on-ajax-engineering-3-reasons-why-3812725/,2025-04-17T14:43:10+05:30,2025-04-17T09:13:10,0.0
Nuvama upgrades ratings on 2 ICICI Group stocks. 3 reasons why,https://www.financialexpress.com/market/nuvama-upgrades-ratings-on-2-icici-group-stocks-3-reasons-why-3811272/,2025-04-16T14:34:41+05:30,2025-04-16T09:04:41,0.0
Nuvama initiates coverage on this ‘Small Finance Bank’: 3 reasons why the share may surge 43% in 1 year,https://www.financialexpress.com/market/nuvama-initiates-coverage-on-this-small-finance-bank-3-reasons-why-the-share-may-surge-43-in-1-year-3805234/,2025-04-10T13:05:33+05:30,2025-04-10T07:35:33,0.296
Q4 earnings preview: What top brokers expect from banks and financials,https://www.financialexpress.com/business/banking-finance-q4-earnings-preview-what-top-brokers-expect-from-banks-and-financials-3804212/,2025-04-09T17:04:39+05:30,2025-04-09T11:34:39,0.2023
Nuvama’s strong Buy call on Laxmi Dental: 3 reasons why,https://www.financialexpress.com/market/nuvamas-strong-buy-call-on-laxmi-dental-3-reasons-why-3789080/,2025-03-26T13:50:43+05:30,2025-03-26T08:20:43,0.5106
Why Nuvama sees 35% upside in Pidilite? 3 key factors are…,https://www.financialexpress.com/market/why-numama-sees-35-upside-in-pidilite-3-key-factors-are-3781698/,2025-03-19T13:20:16+05:30,2025-03-19T07:50:16,0.0
Nuvama sees 96% upside in PVR Inox,https://www.financialexpress.com/market/nuvama-sees-96-upside-in-pvr-inox-3780288/,2025-03-18T09:37:47+05:30,2025-03-18T04:07:47,0.0
"After Goldman Sachs, Nuvama cuts target price for BSE. 3 big worries are…",https://www.financialexpress.com/market/after-goldman-sachs-nuvama-cuts-target-price-for-bse-3-big-worries-are-3773536/,2025-03-10T19:15:53+05:30,2025-03-10T13:45:53,-0.6124
Nuvama’s hot renewable pick: 4 reasons why ACME Solar Holdings may see 70% upside,https://www.financialexpress.com/market/nuvamas-hot-renewable-pick-4-reasons-why-acme-solar-holdings-may-see-70-upside-3765231/,2025-03-03T09:27:52+05:30,2025-03-03T03:57:52,0.0
Nuvama cuts SpiceJet target price despite Q3 profit- 3 big worries are…,https://www.financialexpress.com/market/nuvama-cuts-spicejet-target-price-despite-q3-profit-3-big-worries-are-3761873/,2025-02-27T11:09:34+05:30,2025-02-27T05:39:34,-0.7511
Nuvama has Buy recommendation on these 3 stocks today,https://www.financialexpress.com/market/nuvama-has-buy-recommendation-on-these-3-stocks-todaynbsp-3751800/,2025-02-17T14:17:09+05:30,2025-02-17T08:47:09,0.0
