headline,link,date_str,parsed_date_iso,sentiment_score
"Discover the private performance fees of Rihanna, Akon, Diljit Dosanjh, Lucky Ali, and other artists at Radhika Merchant and Anant Ambani’s pre-wedding celebration",https://www.financialexpress.com/life/lifestyle-discover-the-private-performance-fees-of-rihanna-akon-diljit-dosanjh-lucky-ali-and-other-artists-at-radhika-merchant-and-anant-ambanis-pre-wedding-celebration-3413550/,2024-03-05T03:23:56+05:30,2024-03-04T21:53:56,0.4215
Radhika Merchant-Anant Ambani Wedding: Salman Khan to Mark Zuckerberg — The total net worth of these billionaires surpasses the yearly GDP of certain nations,https://www.financialexpress.com/life/lifestyle-radhika-merchant-anant-ambani-wedding-salman-khan-to-mark-zuckerberg-the-total-net-worth-of-rs-33-lakh-crore-of-these-billionaires-surpasses-the-yearly-gdp-of-certain-nations-3412244/,2024-03-04T02:00:18+05:30,2024-03-03T20:30:18,0.4588
"Anant Ambani-Radhika Merchant wedding: Here’s all you need to know about the couple, their luxurious lifestyle, philanthropy, net worth, and more",https://www.financialexpress.com/life/lifestyle-anant-ambani-radhika-merchant-wedding-heres-all-you-need-to-know-about-the-couple-their-luxurious-lifestyle-philanthropy-net-worth-and-more-3410595/,2024-03-04T00:33:20+05:30,2024-03-03T19:03:20,0.2263
"Anant Ambani-Radhika Merchant’s pre-wedding celebrations: Shah Rukh Khan in a diamond necklace, Mark Zuckerberg in a firefly blazer – A look at who wore what",https://www.financialexpress.com/life/lifestyle-anant-ambani-radhika-merchants-pre-wedding-celebrations-shah-rukh-khan-in-a-diamond-necklace-mark-zuckerberg-in-firefly-blazer-a-look-at-who-wore-what-3411893/,2024-03-04T00:10:13+05:30,2024-03-03T18:40:13,0.34
"Mukesh Ambani and Nita Ambani’s in-laws and their net worth: Anand Piramal, Shloka Mehta, Radhika Merchant – Whose family is the richest? Here’s the answer",https://www.financialexpress.com/life/lifestyle-mukesh-ambani-and-nita-ambanis-in-laws-and-their-net-worth-anand-piramal-shloka-mehta-radhika-merchant-whose-family-is-the-richest-heres-the-answer-3407269/,2024-03-03T14:54:12+05:30,2024-03-03T09:24:12,0.6486
Anant Ambani-Radhika Merchant Wedding: Star-studded celebrations take internet by storm – Check out glamourous pics,https://www.financialexpress.com/photos/lifestyle-gallery/3411223/anant-ambani-radhika-merchant-wedding-star-studded-celebrations-take-internet-by-storm-see-pics/,2024-03-02T10:04:17+05:30,2024-03-02T04:34:17,0.4588
"Mukesh Ambani-Nita Ambani shower daughter-in-law Radhika Merchant with luxurious gifts – A car worth Rs 4.5 crore, diamond jewellery, and hampers",https://www.financialexpress.com/life/lifestyle-mukesh-ambani-nita-ambani-shower-daughter-in-law-radhika-merchant-with-luxurious-gifts-a-car-worth-rs-4-5-crore-diamond-jewellery-and-hampers-3400994/,2024-03-02T02:45:44+05:30,2024-03-01T21:15:44,0.5106
"Anant Ambani-Radhika Merchant Wedding Highlights: Family releases new pictures with couple, Diljit Dosanjh to perform tonight",https://www.financialexpress.com/life/lifestyle-anant-ambani-radhika-merchant-pre-wedding-celebration-live-updates-wedding-guest-pictures-videos-jamnagar-mukesh-ambani-nita-ambani-gujarat-liveblog-today-bkg-3410931/,2024-03-04T12:37:20+05:30,2024-03-04T07:07:20,0.0
"Anant Ambani-Radhika Merchant wedding: Beyoncé at Rs 33 crores, Maroon 5 at Rs 8-12 crore — here’s how much international artists charged to perform at the wedding",https://www.financialexpress.com/life/lifestyle-anant-ambani-radhika-merchant-wedding-beyonc-at-rs-33-crores-maroon-5-at-rs-8-12-crore-heres-how-much-international-artists-charged-to-perform-at-the-wedding-3410162/,2024-03-01T22:02:36+05:30,2024-03-01T16:32:36,-0.2023
Here’s why Anant Ambani chose Jamnagar in Gujarat for his wedding with Radhika Merchant,https://www.financialexpress.com/life/lifestyle-heres-why-anant-ambani-chose-jamnagar-in-gujarat-for-his-wedding-with-radhika-merchant-3410205/,2024-03-01T22:04:03+05:30,2024-03-01T16:34:03,0.0
"Mukesh Ambani, Anant Ambani, and Radhika Merchant serve meals to 51,000 locals in Jamnagar to commence lavish pre-wedding celebration",https://www.financialexpress.com/life/lifestyle-mukesh-ambani-anant-ambani-and-radhika-merchant-serve-meals-to-51000-locals-in-jamnagar-to-commence-lavish-pre-wedding-celebration-3408563/,2024-03-01T22:03:53+05:30,2024-03-01T16:33:53,0.0
"Inside the Anant Ambani-Radhika Merchant Wedding: Decoding dress codes, exclusive venue, and star-studded guest list",https://www.financialexpress.com/life/lifestyle-inside-the-anant-ambani-radhika-merchant-wedding-decoding-dress-codes-exclusive-venue-and-star-studded-guest-list-3407267/,2024-03-01T12:22:20+05:30,2024-03-01T06:52:20,0.128
"Mukesh Ambani’s Son, Anant Ambani, launches 3,000-acre animal shelter ‘Vantara’ in Gujarat’s Jamnagar: Meet the visionary behind this Reliance initiative",https://www.financialexpress.com/life/lifestyle-mukesh-ambanis-son-anant-ambani-launches-3000-acre-animal-shelter-vantara-in-gujarats-jamnagar-meet-the-visionary-behind-vantara-3407221/,2024-03-01T12:22:02+05:30,2024-03-01T06:52:02,0.5267
Rihanna to headline extravagant pre-wedding bash of Anant Ambani and Radhika Merchant: A look at her net worth and luxurious assets,https://www.financialexpress.com/life/lifestyle-rihanna-to-headline-extravagant-pre-wedding-bash-of-anant-ambani-and-radhika-merchant-a-look-at-her-net-worth-and-luxurious-assets-3404341/,2024-03-01T12:21:05+05:30,2024-03-01T06:51:05,0.3818
Anant Ambani and Radhika Merchant’s pre-wedding celebrations begin in Gujarat: Here’s all you need to know,https://www.financialexpress.com/life/lifestyle-anant-ambani-and-radhika-merchants-pre-wedding-celebrations-begin-in-gujarat-heres-all-you-need-to-know-3397898/,2024-03-01T12:20:34+05:30,2024-03-01T06:50:34,0.0
Anant Badjatya appointed as CEO of Indofast Swap Energy,https://www.financialexpress.com/business/express-mobility-anant-badjatya-appointed-as-ceo-of-indofast-swap-energy-3636532/,2024-10-10T15:58:57+05:30,2024-10-10T10:28:57,0.2732
Motilal Oswal’s top Buy recommendations at this hour,https://www.financialexpress.com/market/motilal-oswals-top-buy-recommendations-at-this-hour-2-3818765/,2025-04-23T08:35:09+05:30,2025-04-23T03:05:09,0.2023
"From Coal India, NTPC, HUL to Mazagon Dock – Here are 8 stocks to watch",https://www.financialexpress.com/market/stocks-to-watch-coal-india-ntpc-hul-tata-investment-prestige-estate-projects-anant-raj-tata-power-mazagon-dock-shipbuilders-3817491/,2025-04-22T06:59:29+05:30,2025-04-22T01:29:29,0.0
2 AI stocks down over 40% from their peak – add to watchlist?,https://www.financialexpress.com/market/stock-insights/2-ai-stocks-down-over-40-from-their-peak-add-to-watchlist/3788625/,2025-03-26T06:00:00+05:30,2025-03-26T00:30:00,0.0
"Porn case: SC grants anticipatory bail to businessman Raj Kundra, actors Poonam Pandey and Sherlyn Chopra",https://www.financialexpress.com/india-news/porn-case-sc-grants-anticipatory-bail-to-businessman-raj-kundra-actors-poonam-pandey-and-sherlyn-chopra/2911273/,2022-12-13T13:19:37+05:30,2022-12-13T07:49:37,0.2263
Supreme Court grants Raj Kundra four weeks’ protection from arrest in porn film racket case,https://www.financialexpress.com/india-news/supreme-court-grants-raj-kundra-four-weeks-protection-from-arrest-in-porn-film-racket-case/2380559/,2021-12-15T15:09:45+05:30,2021-12-15T09:39:45,0.4767
"119 adult videos found in Raj Kundra’s mobile phone and laptop, businessman was about to sell them for Rs 9 crore: Mumbai Police",https://www.financialexpress.com/india-news/119-adult-videos-found-in-raj-kundras-mobile-phone-and-laptop-businessman-was-about-to-sell-them-for-rs-9-crore-mumbai-police/2334359/,2021-09-21T10:59:49+05:30,2021-09-21T05:29:49,0.0
MNS workers assault non-Marathi speaking security guard for disrespecting language; police file FIR against 4,https://www.financialexpress.com/india-news/mns-workers-assault-non-marathi-speaking-security-guard-for-disrespecting-language-police-file-fir-against-4/3796006/,2025-04-02T06:43:17+05:30,2025-04-02T01:13:17,-0.34
"Meet Rashmi Patankar, wife of Uddhav Thackeray – Know about her career, love story with the former Chief Minister of Maharashtra, her sons Aaditya and Tejas, and more",https://www.financialexpress.com/life/lifestyle-meet-rashmi-patankar-wife-of-uddhav-thackeray-know-about-her-career-love-story-with-the-former-chief-minister-of-maharashtra-her-sons-aaditya-and-tejas-and-more-3671242/,2024-11-23T07:44:52+05:30,2024-11-23T02:14:52,0.6369
From Prabodhankar Thackeray and Bal Thackeray to Aaditya and Amit Thackeray: A look at the family tree of Maharashtra’s prominent political clan,https://www.financialexpress.com/india-news/from-prabodhankar-thackeray-and-bal-thackeray-to-aditya-and-amit-thackeray-a-look-at-the-family-tree-of-maharashtras-prominent-political-clan/3670345/,2024-11-23T08:00:25+05:30,2024-11-23T02:30:25,0.3182
Raj Thackeray adds Hindutva mix to ‘Marathi Manoos’ plank: Can he herald an MNS revival?,https://www.financialexpress.com/india-news/raj-thackeray-adds-hindutva-mix-to-marathi-manoos-plank-with-unconditional-support-to-modi-can-he-herald-an-mns-revival/3452089/,2024-04-10T11:42:57+05:30,2024-04-10T06:12:57,0.0
"Lok Sabha Elections 2024: BJP-MNS tie-up on cards, Raj Thackeray meets Amit Shah in Delhi",https://www.financialexpress.com/india-news/raj-thackeray-mns-bjp-tie-up-amit-shah-lok-sabha-election/3429835/,2024-03-19T12:54:20+05:30,2024-03-19T07:24:20,0.0
‘Sharad Pawar’s past has come back to haunt him’: Raj Thackeray on NCP mutiny,https://www.financialexpress.com/india-news/sharad-pawars-past-has-come-back-to-haunt-him-raj-thackeray-on-ncp-mutiny/3157425/,2023-07-05T17:41:34+05:30,2023-07-05T12:11:34,-0.4019
Anti-migrant rhetoric: Raj Thackeray falls back on tried and tested formula ahead of BMC polls,https://www.financialexpress.com/india-news/raj-thackeray-mns-bmc-election-2023-maharashtra/3124686/,2023-06-13T17:52:02+05:30,2023-06-13T12:22:02,0.0
BJP-MNS alliance for BMC polls? Devendra Fadnavis-Raj Thackeray meet revives tie-up buzz,https://www.financialexpress.com/india-news/devendra-fadnavis-raj-thackeray-meeting-mumbai-maharashtra-news/3107599/,2023-05-30T15:08:26+05:30,2023-05-30T09:38:26,0.3818
Andheri assembly bypolls: BJP withdraws candidate a day after Raj Thackeray urges Fadnavis not to field anyone against Uddhav-faction’s Rutuja Latke,https://www.financialexpress.com/india-news/andheri-assembly-bypolls-bjp-withdraws-candidate-a-day-after-raj-thackeray-urges-devendra-fadnavis-not-to-field-anyone-against-uddhav-thackeray-factions-rutuja-latke/2715138/,2022-10-17T13:42:24+05:30,2022-10-17T08:12:24,0.0
"Trouble mounts for Raj Thackeray; two non-bailable warrants issued, petition seeking FIR under sedition filed in HC",https://www.financialexpress.com/india-news/trouble-mounts-for-raj-thackeray-two-non-bailable-warrants-issued-petition-seeking-fir-under-sedition-filed-in-hc/2514958/,2022-05-06T12:07:57+05:30,2022-05-06T06:37:57,-0.6705
"Maharashtra: Amid crackdown against MNS, Raj Thackeray says agitation to continue till all illegal loudspeakers removed",https://www.financialexpress.com/india-news/maharashtra-amid-crackdown-against-mns-raj-thackeray-says-agitation-to-continue-till-all-illegal-loudspeakers-removed/2512576/,2022-05-04T14:17:45+05:30,2022-05-04T08:47:45,-0.6808
‘Won’t be responsible for what happens next’: Raj Thackeray on his deadline to remove loudspeakers from mosques,https://www.financialexpress.com/india-news/wont-be-responsible-for-what-happens-next-raj-thackeray-on-his-deadline-to-remove-loudspeakers-from-mosques/2509854/,2022-05-02T08:49:28+05:30,2022-05-02T03:19:28,0.3182
"Raj Thackeray Aurangabad Rally: MNS chief warns MVA govt over loudspeakers, reiterates May 3 deadline",https://www.financialexpress.com/india-news/raj-thackeray-in-aurangabad-live-mns-chief-to-address-rally-on-loudspeaker-row-buzz-over-alliance-with-bjp-grows/2509245/,2022-05-02T08:32:09+05:30,2022-05-02T03:02:09,-0.1027
Loudspeaker row: Prohibitory orders clamped in Aurangabad ahead of Raj Thackeray’s rally on May 1,https://www.financialexpress.com/india-news/loudspeaker-row-prohibitory-orders-clamped-in-aurangabad-ahead-of-raj-thackerays-rally-on-may-1/2506516/,2022-04-28T14:14:40+05:30,2022-04-28T08:44:40,0.0
