headline,link,date_str,parsed_date_iso,sentiment_score
"Delhi Metro launches state-of-the-art website & app! From Trip Planner to Fare Calculator, see major features",https://www.financialexpress.com/business/infrastructure-delhi-metro-launches-state-of-the-art-website-app-from-trip-planner-to-fare-calculator-see-major-features-2443419/,2022-02-24T12:17:32+05:30,2022-02-24T06:47:32,0.0
Work on dedicated skywalk connecting New Delhi Railway and Metro stations nearing completion; to be opened soon,https://www.financialexpress.com/business/infrastructure-work-on-dedicated-skywalk-connecting-new-delhi-railway-and-metro-stations-nearing-completion-to-be-opened-soon-2431192/,2022-02-11T12:18:15+05:30,2022-02-11T06:48:15,0.4588
Attention Delhi Metro commuters! Trains on Yellow Line to run on modified schedule on Republic Day; See timings,https://www.financialexpress.com/business/infrastructure-attention-delhi-metro-commuters-trains-on-yellow-line-to-run-on-modified-schedule-on-republic-day-see-timings-2414269/,2022-01-24T14:04:53+05:30,2022-01-24T08:34:53,0.0
Delhi Metro achieves major milestone for Phase 4 project; completes first tunneling drive,https://www.financialexpress.com/business/infrastructure/delhi-metro-achieves-major-milestone-for-phase-4-project-completes-first-tunneling-drive/2395249/,2021-12-31T16:21:03+05:30,2021-12-31T10:51:03,0.0
No Delhi Metro service between these stations today; Here’s why,https://www.financialexpress.com/business/infrastructure/no-delhi-metro-service-between-these-stations-today-heres-why/2394050/,2021-12-30T12:44:58+05:30,2021-12-30T07:14:58,-0.296
Long queues of commuters seen outside many stations as Delhi Metro trains run with new Covid-19 guidelines,https://www.financialexpress.com/business/infrastructure/long-queues-of-commuters-seen-outside-many-stations-as-delhi-metro-trains-run-with-new-covid-19-guidelines/2392928/,2021-12-29T15:45:46+05:30,2021-12-29T10:15:46,0.0
Delhi Metro operation completes 20 years! Field trial of first indigenously developed i-ATS tech inaugurated,https://www.financialexpress.com/business/infrastructure/delhi-metro-operation-completes-20-years-field-trial-of-first-indigenously-developed-i-ats-tech-inaugurated/2389110/,2021-12-24T16:54:49+05:30,2021-12-24T11:24:49,0.0
Get all key information at one point! Delhi Metro installs improvised signages at stations for more convenience,https://www.financialexpress.com/business/infrastructure-get-all-key-information-at-one-point-delhi-metro-installs-improvised-signages-at-stations-for-more-convenience-2379529/,2021-12-13T11:46:50+05:30,2021-12-13T06:16:50,0.0
Delhi Metro takes steps to combat pollution; plans to install more anti-smog guns at its sites,https://www.financialexpress.com/business/infrastructure-delhi-metro-takes-steps-to-combat-pollution-plans-to-install-more-anti-smog-guns-at-its-sites-2377074/,2021-12-06T15:39:20+05:30,2021-12-06T10:09:20,-0.34
"Delhi Metro unveils 1st refurbished train procured under Phase-1; From CCTV to LCD route map, see new features",https://www.financialexpress.com/business/infrastructure-delhi-metro-unveils-1st-refurbished-train-procured-under-phase-1-from-cctv-to-lcd-route-map-see-new-features-2374959/,2021-11-30T11:39:35+05:30,2021-11-30T06:09:35,0.0
Driverless Train Operations launched on Pink Line! Delhi Metro is now world’s fourth largest driverless network,https://www.financialexpress.com/business/infrastructure-driverless-train-operations-launched-on-pink-line-delhi-metro-is-now-worlds-fourth-largest-driverless-network-2373328/,2021-11-25T15:15:04+05:30,2021-11-25T09:45:04,0.2003
Delhi Metro launches first prototype of indigenous universal driving simulator; demonstrates super SCADA system,https://www.financialexpress.com/business/infrastructure-delhi-metro-launches-first-prototype-of-indigenous-universal-driving-simulator-demonstrates-super-scada-system-2372075/,2021-11-22T17:23:55+05:30,2021-11-22T11:53:55,0.5994
"Delhi Metro Phase 4 Project: DMRC would have to get forest clearance for cutting of trees, says SC",https://www.financialexpress.com/business/infrastructure-delhi-metro-phase-4-project-dmrc-would-have-to-get-forest-clearance-for-cutting-of-trees-says-sc-2367886/,2021-11-12T16:41:36+05:30,2021-11-12T11:11:36,-0.128
Attention Delhi Metro commuters! Check modified train timings for Diwali day,https://www.financialexpress.com/business/infrastructure-attention-delhi-metro-commuters-check-modified-train-timings-for-diwali-day-2362506/,2021-11-03T16:46:58+05:30,2021-11-03T11:16:58,0.0
Govt awards Delhi Metro for being ‘Metro Rail with the Best Passenger Services and Satisfaction’,https://www.financialexpress.com/business/infrastructure-govt-awards-delhi-metro-for-being-metro-rail-with-the-best-passenger-services-and-satisfaction-2360028/,2021-10-30T12:53:54+05:30,2021-10-30T07:23:54,0.802
Delhi Metro launches e-rickshaw services from Noida Electronic City station to boost last-mile connectivity,https://www.financialexpress.com/business/infrastructure-delhi-metro-launches-e-rickshaw-services-from-noida-electronic-city-station-to-boost-last-mile-connectivity-2359488/,2021-10-29T16:44:02+05:30,2021-10-29T11:14:02,0.4019
Delhi Metro Rail Corporation starts training the first batch of Dhaka Metro’s operation and maintenance staff,https://www.financialexpress.com/business/infrastructure-delhi-metro-rail-corporation-starts-training-the-first-batch-of-dhaka-metros-operation-and-maintenance-staff-2352875/,2021-10-20T09:32:25+05:30,2021-10-20T04:02:25,0.0
Enjoy fast & free Wi-Fi facility on Delhi Metro Yellow Line; Here’s how to access the service,https://www.financialexpress.com/business/infrastructure-enjoy-fast-heres-how-to-access-the-service-2351404/,2021-10-18T10:56:42+05:30,2021-10-18T05:26:42,0.7579
Delhi Metro to build first integrated structure combining flyover & metro viaduct; Check details,https://www.financialexpress.com/business/infrastructure-delhi-metro-to-build-first-integrated-structure-combining-flyover-check-details-2346577/,2021-10-08T17:25:24+05:30,2021-10-08T11:55:24,0.0
Delhi Metro Rail Corporation earns Rs 19.5 crore from sale of 3.55 million carbon credits,https://www.financialexpress.com/business/infrastructure-delhi-metro-rail-corporation-earns-rs-19-5-crore-from-sale-of-3-55-million-carbon-credits-2338655/,2021-09-27T14:54:02+05:30,2021-09-27T09:24:02,0.3612
Experts suggest to open all Delhi Metro station gates to reduce congestion; DDMA yet to decide,https://www.financialexpress.com/business/infrastructure-experts-suggest-to-open-all-delhi-metro-station-gates-to-reduce-congestion-ddma-yet-to-decide-2332312/,2021-09-17T17:11:37+05:30,2021-09-17T11:41:37,0.0
Delhi Metro Grey Line Update: Najafgarh-Dhansa Bus Stand corridor to open on this date,https://www.financialexpress.com/business/infrastructure-delhi-metro-grey-line-update-najafgarh-dhansa-bus-stand-corridor-to-open-on-this-date-2331556/,2021-09-16T16:46:43+05:30,2021-09-16T11:16:43,0.0516
Big initiative! Delhi Metro makes provision of separate toilets for transgenders at stations; details,https://www.financialexpress.com/business/infrastructure-big-initiative-delhi-metro-makes-provision-of-separate-toilets-for-transgenders-at-stations-details-2320334/,2021-08-30T13:29:56+05:30,2021-08-30T07:59:56,0.0
Delhi Metro Pink Line: Services to be curtailed between these stations for over three weeks,https://www.financialexpress.com/business/infrastructure-delhi-metro-pink-line-services-to-be-curtailed-between-these-stations-for-over-three-weeks-2312965/,2021-08-18T13:58:33+05:30,2021-08-18T08:28:33,0.0
"Delhi Metro to start feeder electric buses for the first time; Check fare, routes & features here",https://www.financialexpress.com/business/infrastructure-delhi-metro-to-start-feeder-electric-buses-for-the-first-time-check-fare-routes-features-here-2308509/,2021-08-11T13:59:48+05:30,2021-08-11T08:29:48,0.0
Delhi Metro Pink Line: Mayur Vihar Pocket 1-Trilokpuri section inaugurated; Check train operation plan here,https://www.financialexpress.com/business/infrastructure-delhi-metro-pink-line-mayur-vihar-pocket-1-trilokpuri-section-inaugurated-check-train-operation-plan-here-2305678/,2021-08-06T14:04:09+05:30,2021-08-06T08:34:09,0.0
Save travel time & money! Pink Line to become longest Delhi Metro corridor with opening of Trilokpuri section,https://www.financialexpress.com/business/infrastructure-save-travel-time-money-pink-line-to-become-longest-delhi-metro-corridor-with-opening-of-trilokpuri-section-2304764/,2021-08-05T13:04:59+05:30,2021-08-05T07:34:59,0.5411
"Delhi Metro network to expand! DMRC to open Grey Line extension, Pink Line segment on this date",https://www.financialexpress.com/business/infrastructure-delhi-metro-network-to-expand-dmrc-to-open-grey-line-extension-pink-line-segment-on-this-date-2302423/,2021-08-02T15:14:08+05:30,2021-08-02T09:44:08,0.4199
"Delhi Metro Travel Update: Only 20% seating capacity with no standing allowed inside trains, DMRC clarifies",https://www.financialexpress.com/business/infrastructure-delhi-metro-travel-update-only-20-seating-capacity-with-no-standing-allowed-inside-trains-dmrc-clarifies-2298426/,2021-07-27T11:19:17+05:30,2021-07-27T05:49:17,-0.0772
"Delhi Metro’s Dhansa bus stand station adorned with artworks, photos depicting local heritage, flora & fauna",https://www.financialexpress.com/business/infrastructure-delhi-metros-dhansa-bus-stand-station-adorned-with-artworks-photos-depicting-local-heritage-flora-fauna-2297973/,2021-07-26T16:50:02+05:30,2021-07-26T11:20:02,0.2023
"Attention, Delhi Metro users! From today, 16 additional entry gates to be operational; see station list here",https://www.financialexpress.com/business/infrastructure-attention-delhi-metro-users-from-today-16-additional-entry-gates-to-be-operational-see-station-list-here-2297635/,2021-07-26T10:45:19+05:30,2021-07-26T05:15:19,0.0
Delhi Metro launches India’s 1st FASTag/UPI based cashless parking & MMI facility at Kashmere Gate station,https://www.financialexpress.com/business/infrastructure-delhi-metro-launches-indias-1st-fastag-upi-based-cashless-parking-mmi-facility-at-kashmere-gate-station-2285025/,2021-07-06T17:18:42+05:30,2021-07-06T11:48:42,0.0
Launching work on Delhi Metro’s Janakpuri West-RK Ashram Marg corridor started with state-of-the-art launcher,https://www.financialexpress.com/business/infrastructure-launching-work-on-delhi-metros-janakpuri-west-rk-ashram-marg-corridor-started-with-state-of-the-art-launcher-2285018/,2021-07-06T17:08:07+05:30,2021-07-06T11:38:07,0.0
Delhi Metro builds its first underground integrated parking facility at Grey Line’s Dhansa Bus Stand station,https://www.financialexpress.com/business/infrastructure-delhi-metro-builds-its-first-underground-integrated-parking-facility-at-grey-lines-dhansa-bus-stand-station-2281979/,2021-07-01T14:56:29+05:30,2021-07-01T09:26:29,0.0516
Delhi Metro completes civil work on Pink Line’s Trilokpuri stretch using unique construction method,https://www.financialexpress.com/business/infrastructure-delhi-metro-completes-civil-work-on-pink-lines-trilokpuri-stretch-using-unique-construction-method-2278497/,2021-06-25T16:59:40+05:30,2021-06-25T11:29:40,0.0
"Delhi Metro commuters, check these DMRC guidelines for safe and smooth travel experience",https://www.financialexpress.com/business/infrastructure-delhi-metro-commuters-check-these-dmrc-guidelines-for-safe-and-smooth-travel-experience-2278151/,2021-06-25T11:44:46+05:30,2021-06-25T06:14:46,0.4404
"Monkey in Metro train! After video goes viral, Delhi Metro plans to consult with forest department",https://www.financialexpress.com/business/infrastructure-monkey-in-metro-train-after-video-goes-viral-delhi-metro-plans-to-consult-with-forest-department-2276746/,2021-06-23T14:18:53+05:30,2021-06-23T08:48:53,0.0
Attention Delhi Metro commuters! DMRC resumes services after almost three weeks with 50% capacity,https://www.financialexpress.com/business/infrastructure-attention-delhi-metro-commuters-dmrc-resumes-services-after-almost-three-weeks-with-50-capacity-2266581/,2021-06-07T13:54:01+05:30,2021-06-07T08:24:01,0.0
Coronavirus Highlights: PM Modi announces free vaccine for all above 18 yrs from June 21; Mumbai reports 728 new cases,https://www.financialexpress.com/life/coronavirus-in-india-corona-cases-covid-vaccine-news-june-7-live-updates-unlock-live-blog-delhi-uttar-pradesh-haryana-maharashtra-karnataka-covishield-covaxin-cowin-vaccination-live-2266413/,2021-06-08T00:53:48+05:30,2021-06-07T19:23:48,0.5106
Attention Delhi Metro commuters! Metro train services to remain suspended till this date,https://www.financialexpress.com/business/infrastructure-attention-delhi-metro-commuters-metro-train-services-to-remain-suspended-till-this-date-2249015/,2021-05-10T10:29:59+05:30,2021-05-10T04:59:59,-0.5255
"Coronavirus India Highlights: Odisha govt to float global tender to procure COVID-19 vaccine; Maharashtra reports 37,236 new cases",https://www.financialexpress.com/life/coronavirus-india-lockdown-live-updates-may-10-delhi-up-bihar-rajasthan-karnataka-tamil-nadu-maharashtra-jharkhand-punjab-cowin-corona-vaccine-noida-ghaziabad-mumbai-bengaluru-gujarat-2248933/,2021-05-11T08:25:39+05:30,2021-05-11T02:55:39,0.0
Delhi Metro passengers take note! DMRC revises operational plan for 6-day lockdown; increases train frequency,https://www.financialexpress.com/business/infrastructure-delhi-metro-passengers-take-note-dmrc-revises-operational-plan-for-6-day-lockdown-increases-train-frequency-2236713/,2021-04-20T15:56:31+05:30,2021-04-20T10:26:31,0.0
Attention Delhi Metro commuters! Metro services to be available with a headway of 15 minutes this weekend,https://www.financialexpress.com/business/infrastructure-attention-delhi-metro-commuters-metro-services-to-be-available-with-a-headway-of-15-minutes-this-weekend-2234452/,2021-04-16T16:48:05+05:30,2021-04-16T11:18:05,0.0
Night curfew to prevent COVID-19! DMRC advises Delhi Metro commuters to complete journey by 10 PM,https://www.financialexpress.com/business/infrastructure-night-curfew-to-prevent-covid-19-dmrc-advises-delhi-metro-commuters-to-complete-journey-by-10-pm-2228358/,2021-04-07T10:37:31+05:30,2021-04-07T05:07:31,0.1007
"Delhi Metro trains to get less congested! DMRC adding 120 more coaches on Red, Yellow, Blue Line trains",https://www.financialexpress.com/business/infrastructure-delhi-metro-trains-to-get-less-congested-dmrc-adding-120-more-coaches-on-red-yellow-blue-line-trains-2227011/,2021-04-05T10:48:53+05:30,2021-04-05T05:18:53,0.0
Attention Delhi Metro commuters! Now recharge your smart card with Amazon Pay; here’s how,https://www.financialexpress.com/business/infrastructure-attention-delhi-metro-commuters-now-recharge-your-smart-card-with-amazon-pay-heres-how-2224660/,2021-04-01T12:03:57+05:30,2021-04-01T06:33:57,0.5093
Holi 2021: Delhi Metro to suspend train operations during these hours on Holi — check timings,https://www.financialexpress.com/business/infrastructure-holi-2021-delhi-metro-to-suspend-train-operations-during-these-hours-on-holi-check-timings-2221807/,2021-03-28T10:17:08+05:30,2021-03-28T04:47:08,-0.3182
Penalty for violators! Delhi Metro intensifies drive to ensure COVID-19 norms are followed by commuters,https://www.financialexpress.com/business/infrastructure-penalty-for-violators-delhi-metro-intensifies-drive-to-ensure-covid-19-norms-are-followed-by-commuters-2221179/,2021-03-26T17:27:39+05:30,2021-03-26T11:57:39,-0.5562
Delhi Metro Blue Line: Train services delayed due to track maintenance work between Rajouri Garden-Kirti Nagar,https://www.financialexpress.com/business/infrastructure-delhi-metro-blue-line-train-services-delayed-due-to-track-maintenance-work-between-rajouri-garden-kirti-nagar-2215957/,2021-03-19T14:18:22+05:30,2021-03-19T08:48:22,-0.2263
Delhi Metro to monitor vibration levels caused by movement of trains; floats tender for work,https://www.financialexpress.com/business/infrastructure-delhi-metro-to-monitor-vibration-levels-caused-by-movement-of-trains-floats-tender-for-work-2215228/,2021-03-18T12:59:59+05:30,2021-03-18T07:29:59,0.0
Delhi Metro Red Line: DMRC carries out massive renovation works on these metro stations; See features,https://www.financialexpress.com/business/infrastructure-delhi-metro-red-line-dmrc-carries-out-massive-renovation-works-on-these-metro-stations-see-features-2208280/,2021-03-08T11:26:10+05:30,2021-03-08T05:56:10,0.0
"To boost last-mile connectivity, Delhi Metro introduces e-rickshaw facility from Jamia Millia Islamia station",https://www.financialexpress.com/business/infrastructure-to-boost-last-mile-connectivity-delhi-metro-introduces-e-rickshaw-facility-from-jamia-millia-islamia-station-2204019/,2021-03-01T12:37:15+05:30,2021-03-01T07:07:15,0.4019
"Attention, Delhi Metro commuters! DMRC shuts entry, exit at Tikri Border & three other metro stations; details",https://www.financialexpress.com/business/infrastructure-attention-delhi-metro-commuters-dmrc-shuts-entry-exit-at-tikri-border-details-2197253/,2021-02-18T16:37:49+05:30,2021-02-18T11:07:49,0.0
Passenger movement to get more convenient! Delhi Metro’s Kashmere Gate station gets record-breaking escalators,https://www.financialexpress.com/business/infrastructure-passenger-movement-to-get-more-convenient-delhi-metros-kashmere-gate-station-gets-record-breaking-escalators-2191242/,2021-02-09T17:11:52+05:30,2021-02-09T11:41:52,0.0
"Delhi Metro commuters, take a note! Lal Quila station closed, entry to Jama Masjid station restricted; details",https://www.financialexpress.com/business/infrastructure-delhi-metro-commuters-take-a-note-lal-quila-station-closed-entry-to-jama-masjid-station-restricted-details-2179774/,2021-01-27T15:31:28+05:30,2021-01-27T10:01:28,-0.4389
Delhi Metro: National Common Mobility Card facility introduced on Airport Express Line; see features,https://www.financialexpress.com/business/infrastructure-delhi-metro-national-common-mobility-card-facility-introduced-on-airport-express-line-see-features-2159052/,2020-12-28T16:50:52+05:30,2020-12-28T11:20:52,0.0
Delhi Metro: PM Modi flags off India’s first driverless train on Magenta Line; details here,https://www.financialexpress.com/business/infrastructure-delhi-metro-pm-modi-flags-off-indias-first-driverless-train-on-magenta-line-details-here-2158824/,2020-12-28T12:11:28+05:30,2020-12-28T06:41:28,0.0
"Delhi Metro commuters, take a note! DMRC to regulate services today due to kisan rally; details here",https://www.financialexpress.com/business/infrastructure-delhi-metro-commuters-take-a-note-dmrc-to-regulate-services-today-due-to-kisan-rally-details-here-2137027/,2020-11-26T15:24:31+05:30,2020-11-26T09:54:31,0.0
DMRC starts providing real-time update on waiting time at ten Delhi Metro stations; details,https://www.financialexpress.com/business/infrastructure-dmrc-starts-providing-real-time-update-on-waiting-time-at-ten-delhi-metro-stations-details-2127140/,2020-11-12T16:10:27+05:30,2020-11-12T10:40:27,0.0
Big success! Delhi Metro erects first-ever U-Girder of Phase-4 project; Check details,https://www.financialexpress.com/business/infrastructure-big-success-delhi-metro-erects-first-ever-u-girder-of-phase-4-project-check-details-2120500/,2020-11-04T11:09:05+05:30,2020-11-04T05:39:05,0.6114
Delhi Metro and SBI Card launch multipurpose card with auto-top up facility; see features,https://www.financialexpress.com/business/infrastructure-delhi-metro-and-sbi-card-launch-multipurpose-card-with-auto-top-up-facility-see-features-2112395/,2020-10-23T15:22:45+05:30,2020-10-23T09:52:45,0.0
Delhi Metro starts lowering giant 73-metre long machine in Janakpuri West-RK Ashram Marg corridor; details,https://www.financialexpress.com/business/infrastructure-delhi-metro-starts-lowering-giant-73-metre-long-machine-in-janakpuri-west-rk-ashram-marg-corridor-details-2112255/,2020-10-23T12:33:14+05:30,2020-10-23T07:03:14,-0.25
COVID-19 impact on Delhi Metro: DMRC suffers loss of over Rs 1600 crore due to closure of metro services,https://www.financialexpress.com/business/infrastructure-covid-19-impact-on-delhi-metro-dmrc-suffers-loss-of-over-rs-1600-crore-due-to-closure-of-metro-services-2086389/,2020-09-18T15:44:29+05:30,2020-09-18T10:14:29,-0.6597
Delhi Metro Phase 4 Project: DMRC assigns line number and colour code of three priority corridors; details,https://www.financialexpress.com/business/infrastructure-delhi-metro-phase-4-project-dmrc-assigns-line-number-and-colour-code-of-three-priority-corridors-details-2085688/,2020-09-17T16:08:25+05:30,2020-09-17T10:38:25,0.0772
"Delhi Metro develops ‘Make in India’ signalling technology; to be used for Red Line, Phase IV project",https://www.financialexpress.com/business/infrastructure/delhi-metro-develops-make-in-india-signalling-technology-to-be-used-for-red-line-phase-iv-project/2084458/,2020-09-16T13:46:21+05:30,2020-09-16T08:16:21,0.0
Delhi Metro back on track! Around 2.5 lakh riders use metro service till Monday evening; details,https://www.financialexpress.com/business/infrastructure-delhi-metro-back-on-track-around-2-5-lakh-riders-use-metro-service-till-monday-evening-details-2083852/,2020-09-15T16:50:07+05:30,2020-09-15T11:20:07,0.0
"Delhi Metro Phase 4 project: Metro stations to accept ‘One Nation One Card’, mobile phones for entry",https://www.financialexpress.com/business/infrastructure-delhi-metro-phase-4-project-metro-stations-to-accept-one-nation-one-card-mobile-phones-for-entry-2082571/,2020-09-14T16:47:01+05:30,2020-09-14T11:17:01,0.3818
Delhi Metro Phase-4 project may get delayed by two-three months; not much cost escalation due to COVID-19,https://www.financialexpress.com/business/infrastructure/delhi-metro-phase-4-project-may-get-delayed-by-two-three-months-not-much-cost-escalation-due-to-covid-19/2080835/,2020-09-11T16:09:41+05:30,2020-09-11T10:39:41,-0.2263
"Delhi Metro: Red Line, Violet Line, Green Line resume services after being closed for 172 days due to COVID-19",https://www.financialexpress.com/business/infrastructure-delhi-metro-red-line-violet-line-green-line-resume-services-after-being-closed-for-172-days-due-to-covid-19-2079732/,2020-09-10T16:13:48+05:30,2020-09-10T10:43:48,0.0
"Delhi Metro’s Blue Line, Pink Line resume services after being closed for 171 days due to COVID-19; details",https://www.financialexpress.com/business/infrastructure/delhi-metros-blue-line-pink-line-resume-services-after-being-closed-for-171-days-due-to-covid-19-details/2078817/,2020-09-09T16:20:39+05:30,2020-09-09T10:50:39,0.0
Delhi Metro services resume after 169 days; passenger note these major guidelines for travel,https://www.financialexpress.com/business/infrastructure-delhi-metro-services-resume-after-169-days-passenger-note-these-major-guidelines-for-travel-2077116/,2020-09-07T16:49:30+05:30,2020-09-07T11:19:30,0.0
"Delhi Metro commuters note! No tokens, limited entry-exit, masks & more for travelling – top things to know",https://www.financialexpress.com/business/infrastructure/delhi-metro-commuters-note-no-tokens-limited-entry-exit-masks-more-for-travelling-top-things-to-know/2074963/,2020-09-04T16:19:48+05:30,2020-09-04T10:49:48,-0.3244
Gearing up to travel on Delhi Metro? Here’s what the CISF has planned to prevent COVID-19 from spreading,https://www.financialexpress.com/business/infrastructure-gearing-up-to-travel-on-delhi-metro-heres-what-the-cisf-has-planned-to-prevent-covid-19-from-spreading-2070396/,2020-08-31T16:27:38+05:30,2020-08-31T10:57:38,0.0258
Delhi Metro update: DMRC to curtail number of entry points to Delhi Metro stations whenever services resume,https://www.financialexpress.com/business/infrastructure/delhi-metro-unlock-4-entry-exit-points-news-details-delhi-metro-latest-news/2068198/,2020-08-28T16:15:15+05:30,2020-08-28T10:45:15,0.0772
Delhi Metro: How will travel change due to COVID-19? Here’s what commuters can expect,https://www.financialexpress.com/business/infrastructure-delhi-metro-news-unlock-4-covid-19-what-delhi-metro-commuters-can-expect-2065951/,2020-08-26T15:17:22+05:30,2020-08-26T09:47:22,0.0
"Delhi Metro: Covid has deprived us of Rs 1,500-cr revenue, need recast of JICA loan, says DMRC’s Mangu Singh",https://www.financialexpress.com/business/infrastructure-delhi-metro-covid-has-deprived-us-of-rs-1500-cr-revenue-need-recast-of-jica-loan-says-dmrcs-mangu-singh-2065166/,2020-08-26T12:13:20+05:30,2020-08-26T06:43:20,-0.4767
Delhi Metro introduces new Smart Card with automatic recharge facility! Check features,https://www.financialexpress.com/business/infrastructure-delhi-metro-introduces-new-smart-card-with-automatic-recharge-facility-check-features-2063482/,2020-08-24T12:07:27+05:30,2020-08-24T06:37:27,0.4574
Delhi Metro Phase 4: Work in progress! DMRC starts casting of U-girders for Aerocity-Tughlakabad corridor,https://www.financialexpress.com/business/infrastructure/delhi-metro-phase-4-work-in-progress-dmrc-starts-casting-of-u-girders-for-aerocity-tughlakabad-corridor/2059597/,2020-08-19T13:04:39+05:30,2020-08-19T07:34:39,0.4753
Delhi Metro Phase 4: DMRC begins work on first metro Cantilever bridge over river Yamuna; details here,https://www.financialexpress.com/business/infrastructure-delhi-metro-phase-4-dmrc-begins-work-on-first-metro-cantilever-bridge-over-river-yamuna-details-here-2057650/,2020-08-18T14:21:54+05:30,2020-08-18T08:51:54,0.0
Delhi Metro trains set for big revamp! DMRC to upgrade old trains with new modern features,https://www.financialexpress.com/business/infrastructure/delhi-metro-trains-set-for-big-revamp-dmrc-to-upgrade-old-trains-with-new-modern-features/2051516/,2020-08-11T13:18:00+05:30,2020-08-11T07:48:00,0.0
