headline,link,date_str,parsed_date_iso,sentiment_score
Tata Motors joins UN-backed LeadIT to propel Transition Towards Net-Zero Emissions,https://www.financialexpress.com/business/express-mobility-tata-motors-joins-un-backed-leadit-to-propel-transition-towards-net-zero-emissions-3392905/,2024-03-05T22:08:28+05:30,2024-03-05T16:38:28,0.0
How can the Indian lithium-ion battery recycling sector lead $6 billion global market?,https://www.financialexpress.com/business/express-mobility-how-can-the-indian-lithium-ion-battery-recycling-sector-lead-6-billion-global-market-3391808/,2024-02-12T16:41:27+05:30,2024-02-12T11:11:27,0.0
Apollo Tyres Q3 profit rises 78 per cent to Rs 497 crore,https://www.financialexpress.com/business/industry-apollo-tyres-q3-profit-rises-78-per-cent-to-rs-497-crore-3387337/,2024-02-07T21:27:53+05:30,2024-02-07T15:57:53,0.4404
Vanguard cuts Ola’s valuation to $1.8 billion,https://www.financialexpress.com/business/express-mobility-vanguard-cuts-olas-valuation-to-1-8-billion-3385251/,2024-02-06T05:00:00+05:30,2024-02-05T23:30:00,-0.296
"Car, SUV sales hit new all-time high in January",https://www.financialexpress.com/business/express-mobility/industry-express-mobility/car-suv-sales-hit-new-all-time-high-in-january/3382087/,2024-02-02T00:15:00+05:30,2024-02-01T18:45:00,0.0
"Interview: Mike Nefkens, CEO, HERE Technologies l ‘We’re incrementally helping the world reach net zero’",https://www.financialexpress.com/business/express-mobility-interview-mike-nefkens-ceo-here-technologies-l-were-incrementally-helping-the-world-reach-net-zero-3370654/,2024-01-23T11:00:10+05:30,2024-01-23T05:30:10,0.3182
Tata Motors commences production at Sanand plant it acquired from Ford,https://www.financialexpress.com/business/express-mobility/industry-express-mobility/tata-motors-commences-production-at-sanand-plant-it-acquired-from-ford/3363278/,2024-01-12T18:31:25+05:30,2024-01-12T13:01:25,0.0
"BluSmart shifts gears, introduces surge pricing",https://www.financialexpress.com/business/express-mobility/industry-express-mobility/blusmart-shifts-gears-introduces-surge-pricing/3360242/,2024-01-10T01:50:00+05:30,2024-01-09T20:20:00,0.0
"Tamil Nadu nets around Rupees 58,000 crore in investments; JSW, Tata Electronics & Hyundai in big-ticket list",https://www.financialexpress.com/business/industry-tamil-nadu-nets-around-rupees-58000-crore-in-investments-jsw-tata-electronics-amp-hyundai-in-big-ticket-list-3358017/,2024-01-08T01:30:00+05:30,2024-01-07T20:00:00,0.0
Mapmaking: Providing location data to the entire world,https://www.financialexpress.com/business/express-mobility/industry-express-mobility/mapmaking-providing-location-data-to-the-entire-world/3356924/,2024-01-06T01:15:00+05:30,2024-01-05T19:45:00,0.0
Truckers’ strike: AIMTC says govt assures discussion on new law; urges drivers to end protest,https://www.financialexpress.com/business/express-mobility-truckers-strike-aimtc-says-govt-assures-discussion-on-new-law-urges-drivers-to-end-protest-3353610/,2024-01-03T00:15:00+05:30,2024-01-02T18:45:00,-0.0516
"Ola Electric plans to deploy Rs 1,226.43 crore of IPO proceeds on cell production capacity expansion",https://www.financialexpress.com/market/ipo-news-ola-electric-plans-to-deploy-rs-1226-43-crore-of-ipo-proceeds-on-cell-production-capacity-expansion-3347874/,2023-12-26T17:20:11+05:30,2023-12-26T11:50:11,0.0
End for FAME likely as Centre plans PLI 2.0,https://www.financialexpress.com/business/express-mobility/industry-express-mobility/auto-pli-2-0-may-replace-fame-scheme/3344606/,2023-12-23T05:40:00+05:30,2023-12-23T00:10:00,0.5622
Gogoro goes solo as Indian partner bails out,https://www.financialexpress.com/business/express-mobility/industry-express-mobility/gogoro-goes-solo-as-indian-partner-bails-out/3341901/,2023-12-19T07:14:50+05:30,2023-12-19T01:44:50,0.0
"Fame-III outlay likely to be modest, value-addition riders likely",https://www.financialexpress.com/business/express-mobility-fame-iii-outlay-likely-to-be-modest-value-addition-riders-likely-3334775/,2023-12-11T01:40:00+05:30,2023-12-10T20:10:00,0.0
Sustainable materials: eco-friendly innovations in EV manufacturing,https://www.financialexpress.com/business/express-mobility-sustainable-materials-eco-friendly-innovations-in-ev-manufacturing-3317096/,2023-11-25T10:45:41+05:30,2023-11-25T05:15:41,0.0
"Ola Cabs, ONDC launch logistics services",https://www.financialexpress.com/business/express-mobility/industry-express-mobility/ola-cabs-ondc-launch-logistics-services/3312335/,2023-11-21T01:30:00+05:30,2023-11-20T20:00:00,0.0
"Ten states, UTs to receive 3,600 e-buses under PM-eBus Sewa",https://www.financialexpress.com/business/express-mobility/industry-express-mobility/ten-states-uts-to-receive-3600-e-buses-under-pm-ebus-sewa/3311447/,2023-11-20T09:18:25+05:30,2023-11-20T03:48:25,0.0
"After 15 buyouts in one year, Samvardhana Motherson prepares for more",https://www.financialexpress.com/business/express-mobility/industry-express-mobility/after-15-buyouts-in-one-year-samvardhana-motherson-prepares-for-more/3311319/,2023-11-20T04:10:00+05:30,2023-11-19T22:40:00,0.0
Indian auto market won’t get impacted by the UK trade deal: RC Bhargava,https://www.financialexpress.com/business/express-mobility/industry-express-mobility/indian-auto-market-wont-get-impacted-by-the-uk-trade-deal-rc-bhargava/3303513/,2023-11-10T01:30:00+05:30,2023-11-09T20:00:00,0.0
Honda wants to achieve Shinkansen speeds in India,https://www.financialexpress.com/business/express-mobility/industry-express-mobility/honda-wants-to-achieve-shinkansen-speeds-in-india/3298130/,2023-11-06T11:10:28+05:30,2023-11-06T05:40:28,0.0
"Q&A: Ramesh Iyer, Vice Chairman & MD, M&M Finance",https://www.financialexpress.com/business/express-mobility/industry-express-mobility/qa-ramesh-iyer-vice-chairman-md-mm-finance/3295467/,2023-11-03T03:15:00+05:30,2023-11-02T21:45:00,0.0
Freshbus raises $900k from marquee investors,https://www.financialexpress.com/business/express-mobility/industry-express-mobility/freshbus-raises-900k-from-marquee-investors/3292947/,2023-11-01T02:00:00+05:30,2023-10-31T20:30:00,0.0
New car sales during Navratri remain flat,https://www.financialexpress.com/business/express-mobility/industry-express-mobility/new-car-sales-during-navratri-remain-flat/3285488/,2023-10-25T03:15:00+05:30,2023-10-24T21:45:00,0.0
Bajaj eyes Chetak ramp up amid EV demand depression,https://www.financialexpress.com/business/express-mobility/industry-express-mobility/bajaj-eyes-chetak-ramp-up-amid-ev-demand-depression/3282752/,2023-10-21T03:15:00+05:30,2023-10-20T21:45:00,-0.6369
‘Price hike despite fall in input costs paid off well’,https://www.financialexpress.com/business/express-mobility/industry-express-mobility/price-hike-despite-fall-in-input-costs-paid-off-well/3274704/,2023-10-17T04:45:00+05:30,2023-10-16T23:15:00,0.0
Govt to roll out another PLI scheme for batteries,https://www.financialexpress.com/business/express-mobility/industry-express-mobility/govt-to-roll-out-another-pli-scheme-for-batteries/3274683/,2023-10-17T03:00:00+05:30,2023-10-16T21:30:00,0.0
BMW posts highest car and bike sales,https://www.financialexpress.com/business/express-mobility/industry-express-mobility/bmw-posts-highest-car-and-bike-sales/3272444/,2023-10-14T05:00:00+05:30,2023-10-13T23:30:00,0.0
Pump up the tyres: R&D spend of India tyre industry is forecast to more than double to $151 million from $64 million,https://www.financialexpress.com/business/express-mobility/industry-express-mobility/pump-up-the-tyres-rampd-spend-of-india-tyre-industry-is-forecast-to-more-than-double-to-151-million-from-64-million/3272411/,2023-10-14T03:50:00+05:30,2023-10-13T22:20:00,0.0
"‘Push for connected vehicle tech needed from govt, OEMs’",https://www.financialexpress.com/business/express-mobility/industry-express-mobility/push-for-connected-vehicle-tech-needed-from-govt-oems/3271208/,2023-10-13T04:45:00+05:30,2023-10-12T23:15:00,0.0
Honda Cars daily production up by 22%,https://www.financialexpress.com/business/express-mobility/industry-express-mobility/honda-cars-daily-production-up-by-22/3270074/,2023-10-12T03:15:00+05:30,2023-10-11T21:45:00,0.0
Mercedes-Benz to support EV customers with 50% road tax,https://www.financialexpress.com/business/express-mobility/industry-express-mobility/mercedes-benz-to-support-ev-customers-with-50-road-tax/3270067/,2023-10-12T02:45:00+05:30,2023-10-11T21:15:00,0.4019
ParkMate taps tech for efficient urban parking,https://www.financialexpress.com/business/express-mobility/industry-express-mobility/parkmate-taps-tech-for-efficient-urban-parking/3266548/,2023-10-09T02:15:00+05:30,2023-10-08T20:45:00,0.4215
Supply of over 5 million NavIC chips to auto sector in 3 years: Accord,https://www.financialexpress.com/business/express-mobility-over-5-million-navic-chips-to-auto-sector-in-3-years-accord-3261998/,2023-10-04T05:45:00+05:30,2023-10-04T00:15:00,0.0
Quickride pitches carpooling to combat Bengaluru traffic,https://www.financialexpress.com/business/express-mobility/industry-express-mobility/quickride-pitches-carpooling-to-combat-bengaluru-traffic/3261995/,2023-10-04T05:00:00+05:30,2023-10-03T23:30:00,-0.34
GST Authority slaps show cause notice on Maruti Suzuki,https://www.financialexpress.com/business/express-mobility/industry-express-mobility/gst-authority-slaps-show-cause-notice-on-maruti-suzuki/3258967/,2023-09-30T03:40:00+05:30,2023-09-29T22:10:00,0.0772
Mitsubishi Motors to exit from China production – Report,https://www.financialexpress.com/business/express-mobility-mitsubishi-motors-to-exit-from-china-production-report-3256507/,2023-09-27T16:25:42+05:30,2023-09-27T10:55:42,0.0
How to identify fraud and misselling in motor insurance,https://www.financialexpress.com/business/express-mobility/industry-express-mobility/how-to-identify-fraud-and-misselling-in-motor-insurance/3252272/,2023-09-23T04:00:00+05:30,2023-09-22T22:30:00,-0.5859
Royal Enfield expands its wheels into Central America: Riding the iconic Indian brand wave in Panama,https://www.financialexpress.com/business/express-mobility-royal-enfield-expands-its-wheels-into-central-america-riding-the-iconic-indian-brand-wave-in-panama-3252022/,2023-09-22T18:58:51+05:30,2023-09-22T13:28:51,0.1027
Auto component makers chalk out investment plans to capture EV market,https://www.financialexpress.com/business/express-mobility/industry-express-mobility/auto-component-makers-chalk-out-investment-plans-to-capture-ev-market/3251046/,2023-09-22T05:00:00+05:30,2023-09-21T23:30:00,0.0
Ola EVs replace ICE support at MotoGP Bharat,https://www.financialexpress.com/business/express-mobility/industry-express-mobility/ola-evs-replace-ice-support-at-motogp-bharat/3251039/,2023-09-22T04:45:00+05:30,2023-09-21T23:15:00,0.4019
Bus-tracking start-up Chalo looks to expand international presence,https://www.financialexpress.com/business/express-mobility/industry-express-mobility/bus-tracking-start-up-chalo-looks-to-expand-international-presence/3250051/,2023-09-21T09:58:50+05:30,2023-09-21T04:28:50,0.3182
No need for regulation mandating six airbags in passenger vehicles: Nitin Gadkari,https://www.financialexpress.com/business/express-mobility/industry-express-mobility/no-need-for-regulation-mandating-six-airbags-in-passenger-vehicles-nitin-gadkari/3242892/,2023-09-14T04:42:00+05:30,2023-09-13T23:12:00,-0.296
Goyal talks tough to auto industry on imports,https://www.financialexpress.com/business/express-mobility/industry-express-mobility/goyal-talks-tough-to-auto-industry-on-imports/3242793/,2023-09-14T02:50:00+05:30,2023-09-13T21:20:00,-0.128
E-bus tender bids to get aggressive,https://www.financialexpress.com/business/express-mobility/industry-express-mobility/e-bus-tender-bids-to-get-aggressive/3241560/,2023-09-13T02:40:00+05:30,2023-09-12T21:10:00,-0.1531
Top carmakers stay reluctant despite hybrid demand surge,https://www.financialexpress.com/business/express-mobility-top-carmakers-stay-reluctant-despite-hybrid-demand-surge-3238924/,2023-09-11T03:15:00+05:30,2023-09-10T21:45:00,0.0439
"Ather Energy raises Rs 900 crore from Hero, GIC",https://www.financialexpress.com/business/express-mobility/industry-express-mobility/ather-energy-raises-rs-900-crore-from-hero-gic/3235463/,2023-09-07T05:45:00+05:30,2023-09-07T00:15:00,0.6908
Royal Enfield will continue invest in petrol engines: Siddhartha Lal,https://www.financialexpress.com/business/express-mobility/industry-express-mobility/royal-enfield-will-continue-invest-in-petrol-engines-siddhartha-lal/3229106/,2023-09-01T01:30:00+05:30,2023-08-31T20:00:00,0.0
Auto industry and space: When universe is the limit,https://www.financialexpress.com/business/express-mobility/industry-express-mobility/auto-industry-and-space-when-universe-is-the-limit/3223231/,2023-08-26T05:00:00+05:30,2023-08-25T23:30:00,0.0
Swedish firm to double capacity in India as EV demand grows,https://www.financialexpress.com/business/express-mobility/industry-express-mobility/swedish-firm-to-double-capacity-in-india-as-ev-demand-grows/3223225/,2023-08-26T04:40:00+05:30,2023-08-25T23:10:00,-0.128
Moving into high gear: The gearstick isn’t sticking around,https://www.financialexpress.com/business/express-mobility/industry-express-mobility/moving-into-high-gear-the-gearstick-isnt-sticking-around/3216516/,2023-08-21T06:25:00+05:30,2023-08-21T00:55:00,0.0
Hero MotoCorp limits Harley launch to boost premium tag,https://www.financialexpress.com/business/express-mobility/industry-express-mobility/hero-motocorp-limits-harley-launch-to-boost-premium-tag/3216475/,2023-08-21T03:40:00+05:30,2023-08-20T22:10:00,0.743
"Co-badging by TVS-BMW, Maruti-Toyota a hit; new product attempts a flop",https://www.financialexpress.com/business/express-mobility/industry-express-mobility/co-badging-by-tvs-bmw-maruti-toyota-a-hit-new-product-attempts-a-flop/3215924/,2023-08-20T05:45:00+05:30,2023-08-20T00:15:00,-0.34
"GM India union wants Hyundai Motor to absorb workers, threaten hunger strike",https://www.financialexpress.com/business/express-mobility/gm-india-union-wants-hyundai-motor-to-absorb-workers-threaten-hunger-strike/3215944/,2023-08-20T04:50:00+05:30,2023-08-19T23:20:00,-0.6249
Engineering mechanics: Toyota makes cars; it also makes those who make cars,https://www.financialexpress.com/business/express-mobility/industry-express-mobility/engineering-mechanics-toyota-makes-cars-it-also-makes-those-who-make-cars/3209617/,2023-08-14T06:25:00+05:30,2023-08-14T00:55:00,0.0
Maruti Suzuki Board approves merging SMG plant via share swap for optimising value for shareholders,https://www.financialexpress.com/business/express-mobility-maruti-suzuki-board-approves-merging-smg-plant-via-share-swap-for-optimising-value-for-shareholders-3203552/,2023-08-08T18:10:41+05:30,2023-08-08T12:40:41,0.8402
"Explained: Electric car efficiency – move over km/litre, it’s time to learn km/kWh",https://www.financialexpress.com/business/express-mobility/industry-express-mobility/explained-electric-car-efficiency-move-over-kmlitre-its-time-to-learn-kmkwh/3201760/,2023-08-07T05:00:00+05:30,2023-08-06T23:30:00,0.3612
"Hiving off EV biz not our approach, says Royal Enfield",https://www.financialexpress.com/business/express-mobility/industry-express-mobility/hiving-off-ev-biz-not-our-approach-says-royal-enfield/3200439/,2023-08-05T03:45:00+05:30,2023-08-04T22:15:00,0.0
CG Power plans capex of over Rs 500 cr for capacity expansion in next two years,https://www.financialexpress.com/business/express-mobility/industry-express-mobility/cg-power-plans-capex-of-over-rs-500-cr-for-capacity-expansion-in-next-two-years/3200417/,2023-08-05T01:50:00+05:30,2023-08-04T20:20:00,0.0
Enhancing sustainability in India’s logistics sector: A path to economic growth and environmental responsibility,https://www.financialexpress.com/business/express-mobility-enhancing-sustainability-in-indias-logistics-sector-a-path-to-economic-growth-and-environmental-responsibility-3197402/,2023-08-03T07:00:00+05:30,2023-08-03T01:30:00,0.3818
Quality controls standards and the EV charging ecosystem: All you need to know,https://www.financialexpress.com/business/express-mobility-quality-controls-standards-and-the-ev-charging-ecosystem-all-you-need-to-know-3193133/,2023-07-31T08:10:00+05:30,2023-07-31T02:40:00,0.0
How startups are revolutionising electric charging infrastructure in India,https://www.financialexpress.com/business/express-mobility-how-startups-are-revolutionising-electric-charging-infrastructure-in-india-3183717/,2023-07-24T08:00:00+05:30,2023-07-24T02:30:00,0.0
Hero MotoCorp to launch Zero e-bikes in India,https://www.financialexpress.com/business/express-mobility/industry-express-mobility/hero-motocorp-to-launch-zero-e-bikes-in-india/3183680/,2023-07-24T05:25:00+05:30,2023-07-23T23:55:00,0.5574
Wheels India bets on goods CV and bus segments for demand growth this fiscal,https://www.financialexpress.com/business/express-mobility/industry-express-mobility/wheels-india-bets-on-goods-cv-and-bus-segments-for-demand-growth-this-fiscal/3178575/,2023-07-20T01:30:00+05:30,2023-07-19T20:00:00,0.2732
"After FAME-II violations, auto PLI norms to be strengthened: Heavy industries minister",https://www.financialexpress.com/business/express-mobility/industry-express-mobility/after-fame-ii-violations-auto-pli-norms-to-be-strengthened-heavy-industries-minister/3178515/,2023-07-19T19:47:20+05:30,2023-07-19T14:17:20,-0.1531
"CNG cars haven’t run out of fuel yet even as focus increases on hybrid, EVs",https://www.financialexpress.com/business/express-mobility/industry-express-mobility/cng-cars-havent-run-out-of-fuel-yet-even-as-focus-increases-on-hybrid-evs/3172437/,2023-07-16T06:00:00+05:30,2023-07-16T00:30:00,0.0
Crowded electric 2W space likely to see consolidation,https://www.financialexpress.com/business/express-mobility/vehicles/electric-vehicles/crowded-electric-2w-space-likely-to-see-consolidation/3169559/,2023-07-14T01:00:00+05:30,2023-07-13T19:30:00,0.0
How is LiDAR emerging as the future of Autonomous Vehicles?,https://www.financialexpress.com/business/express-mobility-how-is-lidar-emerging-as-the-future-of-autonomous-vehicles-3167496/,2023-07-12T19:24:04+05:30,2023-07-12T13:54:04,0.0
EV retail is poised for growth but these challenges might be holding it back,https://www.financialexpress.com/business/express-mobility-ev-retail-is-poised-for-growth-but-these-challenges-might-be-holding-it-back-3167402/,2023-07-12T18:34:00+05:30,2023-07-12T13:04:00,0.4118
HeroMoto aims to flood the market with premium bikes,https://www.financialexpress.com/business/express-mobility/industry-express-mobility/heromoto-aims-to-flood-the-market-with-premium-bikes/3160690/,2023-07-08T01:45:00+05:30,2023-07-07T20:15:00,0.0
Understanding the Impact on Customer: Analysing the Subsidy Reduction under FAME-II,https://www.financialexpress.com/business/express-mobility-understanding-the-impact-on-customer-analysing-the-subsidy-reduction-under-fame-ii-3151204/,2023-07-01T18:28:00+05:30,2023-07-01T12:58:00,0.0
User Economics: Why Hasn’t the Entire B2B Industry Shifted to Electric Yet?,https://www.financialexpress.com/business/express-mobility-user-economics-why-hasnt-the-entire-b2b-industry-shifted-to-electric-yet-3140948/,2023-06-24T16:10:00+05:30,2023-06-24T10:40:00,0.0
Top factors to consider before installing an EV charger at home,https://www.financialexpress.com/business/express-mobility-top-factors-to-consider-before-installing-an-ev-charger-at-home-3140950/,2023-06-24T15:58:00+05:30,2023-06-24T10:28:00,0.2023
Taxing EV charging: The GST conundrum on charging infrastructure,https://www.financialexpress.com/business/express-mobility-taxing-ev-charging-the-gst-conundrum-on-charging-infrastructure-3140222/,2023-06-24T00:30:00+05:30,2023-06-23T19:00:00,0.0
Bajaj Chetak shifts gear to bridge gap with competitors,https://www.financialexpress.com/business/express-mobility/industry-express-mobility/bajaj-chetak-shifts-gear-to-bridge-gap-with-competitors/3138506/,2023-06-23T17:54:58+05:30,2023-06-23T12:24:58,0.0
M&M opts out of below Rs 10 lakh electric segment,https://www.financialexpress.com/business/express-mobility/industry-express-mobility/mampm-opts-out-of-below-rs-10-lakh-electric-segment/3131360/,2023-06-19T05:00:00+05:30,2023-06-18T23:30:00,0.0
Why is Aluminium becoming an indisputable choice for the EV sector?,https://www.financialexpress.com/business/express-mobility-why-is-aluminium-becoming-an-indisputable-choice-for-the-ev-sector-3130687/,2023-06-18T10:42:00+05:30,2023-06-18T05:12:00,0.0
ICE midsize SUVs may be having their last hurrah,https://www.financialexpress.com/business/express-mobility/industry-express-mobility/ice-midsize-suvs-may-be-having-their-last-hurrah/3121377/,2023-06-11T05:00:00+05:30,2023-06-10T23:30:00,0.5574
Future of Electric Mobility in India with FAME II,https://www.financialexpress.com/business/express-mobility-future-of-electric-mobility-in-india-with-fame-ii-3114135/,2023-06-05T14:10:00+05:30,2023-06-05T08:40:00,0.5622
World Environment Day: Accelerating India’s Transition to a Greener Future,https://www.financialexpress.com/business/express-mobility-world-environment-day-accelerating-indias-transition-to-a-greener-future-3114134/,2023-06-05T14:04:00+05:30,2023-06-05T08:34:00,0.0
Reduction in FAME II subsidies will benefit the sector,https://www.financialexpress.com/business/express-mobility-reduction-in-fame-ii-subsidies-will-benefit-the-sector-3113234/,2023-06-05T02:15:00+05:30,2023-06-04T20:45:00,0.7672
Why EV startups should consider revenue-based financing?,https://www.financialexpress.com/business/express-mobility-why-ev-startups-should-consider-revenue-based-financing-3112523/,2023-06-03T16:36:00+05:30,2023-06-03T11:06:00,0.0
Tatas plan Rs 13k-cr EV cell plant in Gujarat,https://www.financialexpress.com/business/express-mobility-tatas-plan-rs-13k-cr-ev-cell-plant-in-gujarat-3112145/,2023-06-03T06:00:00+05:30,2023-06-03T00:30:00,0.0
TVS Motor says it’s good to have startup challenge in EV business,https://www.financialexpress.com/business/express-mobility-tvs-motor-says-its-good-to-have-startup-challenge-in-ev-business-3112151/,2023-06-03T03:15:00+05:30,2023-06-02T21:45:00,0.4939
Midsize sedans not racy enough for Tata Motors,https://www.financialexpress.com/business/express-mobility-midsize-sedans-not-racy-enough-for-tata-motors-3104415/,2023-05-28T06:00:00+05:30,2023-05-28T00:30:00,0.0
The Role of private companies and startups in the growth of the EV market in India,https://www.financialexpress.com/business/express-mobility-the-role-of-private-companies-and-startups-in-the-growth-of-the-ev-market-in-india-3098363/,2023-05-23T12:12:00+05:30,2023-05-23T06:42:00,0.3818
Reliance Jio has a welcome offer for Tesla,https://www.financialexpress.com/business/express-mobility-reliance-jio-has-a-welcome-offer-for-tesla-3096486/,2023-05-22T06:25:00+05:30,2023-05-22T00:55:00,0.4588
"Ashok Leyland readying to launch electric LCVs early next year, working on integrating battery swapping says MD and CEO Shenu Agarwal",https://www.financialexpress.com/business/express-mobility-ashok-leyland-readying-to-launch-electric-lcvs-early-next-year-working-on-integrating-battery-swapping-says-md-shenu-agarwal-3094462/,2023-05-19T19:49:45+05:30,2023-05-19T14:19:45,0.0
Ahead of rivals in lithium-ion battery business: Exide MD,https://www.financialexpress.com/business/express-mobility-ahead-of-rivals-in-lithium-ion-battery-business-exide-md-3085399/,2023-05-13T13:34:37+05:30,2023-05-13T08:04:37,0.0
National Technology Day 2023: The Role of Technology in Advancing EV Safety,https://www.financialexpress.com/business/express-mobility-national-technology-day-2023-the-role-of-technology-in-advancing-ev-safety-3083707/,2023-05-11T18:44:04+05:30,2023-05-11T13:14:04,0.4215
"National Technology Day 2023: Changing climate, fueling opportunities",https://www.financialexpress.com/business/express-mobility-national-technology-day-2023-changing-climate-fueling-opportunities-3083072/,2023-05-11T17:51:30+05:30,2023-05-11T12:21:30,0.3818
Vanguard slashes Ola’s valuation by 35% to $4.8 billion,https://www.financialexpress.com/business/express-mobility-vanguard-slashes-olas-valuation-by-35-to-4-8-billion-3082296/,2023-05-11T00:30:00+05:30,2023-05-10T19:00:00,-0.2023
"Bajaj Auto to step on the gas with fresh launches, expansion",https://www.financialexpress.com/business/express-mobility-bajaj-auto-to-step-on-the-gas-with-fresh-launches-expansion-3077830/,2023-05-08T02:15:00+05:30,2023-05-07T20:45:00,0.3182
"Polaris launches RZR Pro R 4 Ultimate, inaugurates new dealership in Chennai",https://www.financialexpress.com/business/express-mobility-polaris-launches-rzr-pro-r-4-ultimate-inaugurates-new-dealership-in-chennai-3076874/,2023-05-06T20:00:00+05:30,2023-05-06T14:30:00,0.0
Vehicle Scrappage: Ring out old vehicles for green road transport,https://www.financialexpress.com/business/express-mobility-vehicle-scrappage-ring-out-old-vehicles-for-green-road-transport-3076347/,2023-05-06T12:00:00+05:30,2023-05-06T06:30:00,0.0
Visteon invests in Display Bonding Center in India,https://www.financialexpress.com/business/express-mobility-visteon-invests-in-display-bonding-center-in-india-3073080/,2023-05-03T17:58:38+05:30,2023-05-03T12:28:38,0.0
Subsidy withdrawal entice EV makers towards imports,https://www.financialexpress.com/business/express-mobility-subsidy-withdrawal-entice-ev-makers-towards-imports-3069500/,2023-05-01T02:30:00+05:30,2023-04-30T21:00:00,0.0258
Electric cars: Making the sparks fly,https://www.financialexpress.com/business/express-mobility-electric-cars-making-the-sparks-fly-3067819/,2023-04-29T00:45:00+05:30,2023-04-28T19:15:00,0.0
