,source,author,title,description,url,urlToImage,publishedAt,content
34,"{'id': None, 'name': 'Android Central'}",Nicholas Sutrich,You don't have to wait til Civ VII VR to play great strategy games on the Meta Quest 3,"Civilization VII VR is coming soon to Meta Quest headsets, but did you know there are already a ton of great strategy games to play in VR?",https://www.androidcentral.com/gaming/virtual-reality/meta-quest-strategy-games-to-play-until-civilization-vii-vr,https://cdn.mos.cms.futurecdn.net/AZzaZMDnEDmTRMXtBbrQRa-1200-80.jpg,2025-03-06T20:08:25Z,"In his weekly column, Android Central Senior Content Producer Nick Sutrich delves into all things VR, from new hardware to new games, upcoming technologies, and so much more.
Civilization VII is on … [+6001 chars]"
35,"{'id': None, 'name': 'Android Central'}",michael.hicks@futurenet.com (Michael L Hicks),Quest developers are joining forces to solve the 'VR visibility crisis',"VR devs are seeing their games buried under Gorilla Tag clones. With Meta and Sony not helping, they're finding new ways to make VR profitable again.",https://www.androidcentral.com/gaming/virtual-reality/quest-developers-are-joining-forces-to-solve-the-vr-visibility-crisis,https://cdn.mos.cms.futurecdn.net/vpkm3VccWyfbVj7pr4J6gR-1200-80.jpg,2025-03-23T08:00:00Z,The GDC 2025 show floor had a much smaller crowd of VR developers than last year. The Meta booth was crowded with hopeful indie devs aiming to join Oculus Publishing or get some of that $50 million H… [+6357 chars]
36,"{'id': None, 'name': 'Android Central'}",Nicholas Sutrich,This new Meta Quest v74 feature is set to revolutionize immersive experiences,"Meta Quest update v74 brings a ton of new features, but none are more revolutionary than the new camera access API.",https://www.androidcentral.com/gaming/virtual-reality/meta-quest-v74-feature-is-set-to-revolutionize-immersive-experiences,https://cdn.mos.cms.futurecdn.net/439QWMncRCakhzFtvrsuwg-1200-80.jpg,2025-03-20T20:04:51Z,"In his weekly column, Android Central Senior Content Producer Nick Sutrich delves into all things VR, from new hardware to new games, upcoming technologies, and so much more.
The first two-hour sess… [+7148 chars]"
37,"{'id': None, 'name': 'Android Central'}",Nicholas Sutrich,These smart glasses have given me a new reason to record video again,Ray-Ban Meta Smart Glasses have a camera in the best place — your face — making video capture so much more fun than with a phone.,https://www.androidcentral.com/wearables/these-smart-glasses-have-given-me-a-new-reason-to-record-video-again,https://cdn.mos.cms.futurecdn.net/NHAHqfcXCMDC3BUkrWJs96-1200-80.jpg,2025-03-04T20:59:50Z,"In the mid-2000s, GoPro changed the world of amateur action video capture. Since then, millions of videos taken from GoPro cameras — and the myriad of similar wearable cameras it spawned — are litter… [+8027 chars]"
38,"{'id': 'business-insider', 'name': 'Business Insider'}",Shubhangi Goel,Meta apologizes for the sudden influx of graphic content on Instagram reels,"Meta apologized for an ""error"" after Instagram users reported a flood of graphic and disturbing content recommended on their feeds.",https://www.businessinsider.com/meta-apologizes-for-influx-of-graphic-content-on-instagram-reels-2025-2,https://i.insider.com/67c005a0b1834fe311659cfa?width=1200&format=jpeg,2025-02-27T06:26:50Z,"Meta apologized for an influx of graphic content on Instagram Reels on Wednesday.Matthias Balk/picture alliance via Getty Images
<ul><li>Meta apologized for graphic and violent content recommended o… [+2207 chars]"
39,"{'id': 'business-insider', 'name': 'Business Insider'}",Rob Price,Elon Musk hates OpenAI's for-profit transformation plan. He's not the only one.,"Meta, AI entrepreneurs, academics, and other charities and activists are criticizing the startup's plan to shed its ties to its non-profit parent.",https://www.businessinsider.com/openai-elon-musk-sam-altman-for-profit-conversion-2025-2,https://i.insider.com/67acfed3eb4be2fff9a4727a?width=1200&format=jpeg,2025-02-25T10:00:02Z,"OpenAI CEO Sam Altman.JOEL SAGET / AFP
<ul><li>OpenAI, which is owned by a non-profit, wants to adopt a more traditional corporate structure.</li><li>Elon Musk, Meta, charities, academics, and AI en… [+11810 chars]"
40,"{'id': 'business-insider', 'name': 'Business Insider'}",Tess Martinelli,I only had positive performance reviews during 2 years at Meta. I still got laid off as a 'low performer.',"Being labeled a ""low performer"" took this former Meta employee completely by surprise. They'd only had positive reviews prior to being laid off.",https://www.businessinsider.com/former-meta-employee-laid-off-low-performer-2025-2,https://i.insider.com/67bc315dc832c3638fa4fcc4?width=1200&format=jpeg,2025-02-24T11:57:18Z,"A former Meta employee said they felt the company had betrayed them and destroyed their confidence. Artur Widak/NurPhoto via Getty Images
<ul><li>A former Meta employee was hired in 2022 and had pos… [+5369 chars]"
41,"{'id': 'business-insider', 'name': 'Business Insider'}",Katie Notopoulos,Are Meta's protests about a former employee's explosive book causing a Streisand effect — drawing even more attention?,Mark Zuckerberg's Meta doesn't want its former employee Sarah Wynn-Williams publicizing the allegations in her book. That might draw more attention.,https://www.businessinsider.com/meta-book-mark-zuckerberg-defense-drawing-more-attention-2025-3,https://i.insider.com/67d45f08585f1dff88b23256?width=1200&format=jpeg,2025-03-14T20:00:47Z,"Mark Zuckerberg's Meta is fighting allegations in a former employee's tell-all book.Andrej Sokolow/picture alliance via Getty Images
<ul><li>Former Meta employee Sarah Wynn-Williams published a book… [+6384 chars]"
42,"{'id': 'business-insider', 'name': 'Business Insider'}",Sarah Jackson,Snap CEO Evan Spiegel explains his joke job title on LinkedIn,Snap CEO Evan Spiegel's LinkedIn briefly said he was a product VP at Meta. He explained to Bloomberg what was behind the post.,https://www.businessinsider.com/snap-evan-spiegel-linkedin-meta-product-vp-copycat-features-2025-3,https://i.insider.com/67d97df0b8b41a9673faf19d?width=1082&format=jpeg,2025-03-18T17:07:03Z,"Snap CEO Evan Spiegel (L) and Meta CEO Mark Zuckerberg (R).Steve Jennings/Getty Images for TechCrunch and David Ramos/Getty Images
<ul><li>Evan Spiegel is best known as the CEO of Snap.</li><li>Howe… [+2188 chars]"
43,"{'id': 'business-insider', 'name': 'Business Insider'}",Lindsay Dodgson,Playing a game with your boss? Just let them win.,Meta staff supposedly let Mark Zuckerberg win a board game. That's sparked a debate about whether beating your boss could be bad for your career.,https://www.businessinsider.com/bosses-playing-games-workers-winning-losing-jobs-careers-management-workplace-2025-3,https://i.insider.com/67d4136069253ccddf994070?width=1200&format=jpeg,2025-03-22T10:15:09Z,"Beating your boss could either earn you their respect, or their cold shoulder.sankai/Getty Images
<ul><li>A former Facebook executive said employees once let Mark Zuckerberg win when playing a board… [+4226 chars]"
44,"{'id': 'business-insider', 'name': 'Business Insider'}",Jordan Hart,Palmer Luckey said he bet all his cash on Meta in 2021,"Palmer Luckey, Anduril CEO and Oculus founder, invested all his liquid cash in Meta in 2021 despite his 2016 Facebook firing.",https://www.businessinsider.com/palmer-luckey-said-spent-all-cash-on-meta-shares-2025-3,https://i.insider.com/67d9799469253ccddf9989d7?width=1200&format=jpeg,2025-03-18T17:40:16Z,"Anduril CEO Palmer Luckey still invested in Meta after he was ousted.Horacio Villalobos/Getty Images
<ul><li>Palmer Luckey said he invested in Meta after its rebranding despite being fired in 2016.<… [+2329 chars]"
45,"{'id': None, 'name': 'Hipertextual'}",Alberto Martín,Meta AI llega por fin a Europa… con limitaciones,"Pensábamos que, dadas las dificultades de la regulación europea sobre la IA, las grandes inteligencias artificiales como las de Meta o Apple no iban a llegar. Poco a poco están desembarcando en Europa, aunque con ciertas limitaciones. Este es, precisamente, e…",http://hipertextual.com/2025/03/meta-ai-llega-por-fin-a-europa-con-limitaciones,https://imgs.hipertextual.com/wp-content/uploads/2024/05/Meta-AI-Circle.jpg,2025-03-21T09:35:02Z,"Pensábamos que, dadas las dificultades de la regulación europea sobre la IA, las grandes inteligencias artificiales como las de Meta o Apple no iban a llegar. Poco a poco están desembarcando en Europ… [+2029 chars]"
46,"{'id': None, 'name': 'Android Central'}",michael.hicks@futurenet.com (Michael L Hicks),Meta's head of Oculus Publishing used GDC to debunk your 'theories' about VR profitability,Chris Pruett went on stage at GDC 2025 to counter criticisms that Meta has abandoned devs to focus on Horizon and F2P games — and hint at a Quest 4 demographic.,https://www.androidcentral.com/gaming/virtual-reality/gdc-2025-oculus-publishing-head-challenges-meta-criticism-on-quest-store-profitability,https://cdn.mos.cms.futurecdn.net/ruCYWurxHnwPiof8L9xwyb-1200-80.jpg,2025-03-20T17:26:26Z,"Chris Pruett, Meta's Director of Games and head of Oculus Publishing, held a fascinating talk at the Game Developer Conference 2025 that covered everything from developers' frustrated ""theories"" abou… [+8595 chars]"
47,"{'id': None, 'name': 'Android Central'}",patrick.farmer@futurenet.com (Patrick Farmer),"How to get a FREE Meta Quest 3S with this Verizon internet deal — yes, it's real",Sign up for Verizon's 5G Home Plus internet plan and you could get the popular VR headset for free.,https://www.androidcentral.com/phones/verizon-wireless/how-to-get-a-free-meta-quest-3s-with-this-verizon-internet-deal-yes-its-real,https://cdn.mos.cms.futurecdn.net/kPKhP5DweDYSjDRsW2yDBB-1200-80.jpg,2025-03-13T19:01:08Z,"I don't spend a lot of time researching deals on home internet, but throw in a free Meta Quest 3S headset and I'm all ears. For a limited time, you can join Verizon Home Internet on the 5G Home Plus … [+1528 chars]"
48,"{'id': None, 'name': 'Android Central'}",michael.hicks@futurenet.com (Michael L Hicks),"These niche, expensive VR headsets will fill the gap Meta Quest has left behind in 2025","We've seen both leaks and official reveals of upcoming ASUS, Samsung, and Valve headsets that'll shake up the VR industry — and the Quest monopoly.",https://www.androidcentral.com/gaming/virtual-reality/valve-asus-and-samsung-vr-headsets-fill-niche-that-quest-abandoned,https://cdn.mos.cms.futurecdn.net/Y5mQNbBXSoidmfojsLarza-1200-80.jpg,2025-03-01T19:00:00Z,"Earlier this week, a prominent Valve leaker promised we'd finally see Valve's wireless VR successor to the Index, codenamed Deckard, in 2025. With Meta fully targeting the low end with budget hardwar… [+6474 chars]"
49,"{'id': None, 'name': 'Android Central'}",Nicholas Sutrich,Co-op Meta Quest games were my highlight of the March VR Games Showcase,"From dungeon crawlers to squad-based shooters, playing with friends is the best way to VR.",https://www.androidcentral.com/gaming/virtual-reality/march-2025-vr-games-showcase-highlights,https://cdn.mos.cms.futurecdn.net/qsF29kCmyGW7Fme2PRR4H8-1200-80.jpg,2025-03-11T17:47:34Z,"The March 2025 VR Games Showcase revealed 20 new Meta Quest games coming this year, plus two existing Meta Quest games getting ports to other platforms. The show was jam-packed with action, and the b… [+7109 chars]"
50,"{'id': None, 'name': 'Android Central'}",derrek.lee@futurenet.com (Derrek Lee),"TECNO launches the Camon 40 series, unveils new AI smart glasses to take on Meta",TECNO is expanding its product portfolio with AI smart glasses.,https://www.androidcentral.com/phones/tecno-camon-40-series-launch,https://cdn.mos.cms.futurecdn.net/8V78gMvCovtRrzMmci6oCH-1200-80.jpg,2025-03-04T16:00:00Z,"What you need to know
<ul><li>TECNO launches the new Camon 40 series at MWC 2025.</li><li>The Camon 40 Premier 5G is powered by the MediaTek Dimensity 8350 Ultimate for improved AI performance.</li>… [+3536 chars]"
51,"{'id': None, 'name': 'Gizmodo.com'}",AJ Dellinger,Trump’s FCC Head Warns EU Content Rules ‘Incompatible’ With Free Speech,It's the latest warning from the Trump administration that it wants Big Tech left alone.,https://gizmodo.com/trumps-fcc-head-warns-eu-content-rules-incompatible-with-free-speech-2000570843,https://gizmodo.com/app/uploads/2025/03/GettyImages-1192127005.jpg,2025-03-03T19:45:33Z,"The European Union wants social media companies like Facebook, Instagram, and X to do more to crack down on illegal content like hate speech and child sexual abuse material. The Trump administration … [+3448 chars]"
52,"{'id': 'business-insider', 'name': 'Business Insider'}",Katie Notopoulos,Meta just scored a small win in its feud with Apple,Several states just introduced laws that would require Apple and Google to take on the task of age verification. That would be music to Meta's ears.,https://www.businessinsider.com/meta-apple-teen-safety-laws-2025-2,https://i.insider.com/67bdee3ae015c5d98a6ad9ea?width=1200&format=jpeg,2025-02-25T17:47:46Z,"Meta's Mark Zuckerberg and Apple's Tim Cook both would like each other to take responsibility for age verification.Getty Images
<ul><li>Meta has been pushing lawmakers to make Apple and Google's app… [+2901 chars]"
53,"{'id': None, 'name': 'Slashdot.org'}",EditorDavid,Facebook Whistleblower Demands Overturn of Interview Ban - as Her Book Remains a Bestseller,"The latest Facebook whistleblower, a former international lawyer, ""cannot grant any of the nearly 100 interview requests she has received from journalists from print and broadcast news outlets in the United States and the United Kingdom,"" reports the Washingt…",https://news.slashdot.org/story/25/03/23/0413214/facebook-whistleblower-demands-overturn-of-interview-ban---as-her-book-remains-a-bestseller,https://a.fsdn.com/sd/topics/books_64.png,2025-03-23T18:34:00Z,"The latest Facebook whistleblower, a former international lawyer, ""cannot grant any of the nearly 100 interview requests she has received from journalists from print and broadcast news outlets in the… [+3606 chars]"
54,"{'id': 'the-verge', 'name': 'The Verge'}",Tina Nguyen,House GOP subpoenas Big Tech for evidence that Biden made AI woke,"On Friday, Rep. Jim Jordan, the Republican Chairman of the House Judiciary Committee, upped his investigations into Big Tech by sending subpoenas to 16 major tech companies, asking whether the federal government had pressured them into using artificial intell…",https://www.theverge.com/news/629831/subpoena-ai-gop-political-bias,https://platform.theverge.com/wp-content/uploads/sites/2/2025/01/STK481_STK432_CONGRESS_GOVERNMENT_CIVRGINIA_C.jpg?quality=90&strip=all&crop=0%2C10.732984293194%2C100%2C78.534031413613&w=1200,2025-03-14T18:50:13Z,"The free speech investigation goes hunting at Apple, OpenAI, and 14 other companies.
The free speech investigation goes hunting at Apple, OpenAI, and 14 other companies.
On Friday, Rep. Jim Jordan,… [+2236 chars]"
55,"{'id': 'business-insider', 'name': 'Business Insider'}",Shubhangi Goel,Some female Meta employees created a secret 'Facebook Feminist Fight Club' group after feeling unsupported by Sheryl Sandberg,The group was created after female employees were unhappy with Sheryl Sandberg's silence around the Women's March.,https://www.businessinsider.com/meta-employees-created-secret-facebook-feminist-fight-club-group-sanberg-2025-3,https://i.insider.com/67d008deb8b41a9673fa3df9?width=969&format=jpeg,2025-03-11T11:44:55Z,"Female employees at Meta formed a secret group called ""Feminist Fight Club"" after feeling let down by Sheryl Sandberg.Jonathan Leibson/Getty Images
<ul><li>Female employees at Meta formed a secret g… [+3644 chars]"
56,"{'id': None, 'name': 'Hipertextual'}",Gabriel Erard,Meta ya prueba un chip propio para entrenar modelos de IA,"Meta no quiere quedarse atrás en el desarrollo de su propio hardware destinado a las labores de inteligencia artificial, y estaría dando pasos firmes en su estrategia. Según Reuters, los de Mark Zuckerberg ya están probando su primer chip de IA de desarrollo …",http://hipertextual.com/2025/03/meta-ya-prueba-un-chip-propio-para-entrenar-modelos-de-ia,https://imgs.hipertextual.com/wp-content/uploads/2021/10/Facebook-Meta-Zuckerberg.jpg,2025-03-11T17:07:06Z,"Meta no quiere quedarse atrás en el desarrollo de su propio hardware destinado a las labores de inteligencia artificial, y estaría dando pasos firmes en su estrategia. Según Reuters, los de Mark Zuck… [+2872 chars]"
57,"{'id': 'business-insider', 'name': 'Business Insider'}",insider@insider.com (Ellen Thomas),"The AI data center boom will create new jobs. Most won't be at Amazon, Microsoft, Google, or Meta.","Data centers contributed 4.7 million jobs to the US economy between 2017 and 2023, a PwC study found. Most of them aren't direct tech jobs.",https://www.businessinsider.com/data-center-job-boom-in-construction-not-big-tech-2025-3,https://i.insider.com/67cf27cd585f1dff88b1acca?width=1200&format=jpeg,2025-03-11T09:00:02Z,"When President Donald Trump announced Stargate in January, he said the massive AI infrastructure projecta joint venture formed by OpenAI, Oracle, and SoftBankwould create ""over 100,000 American jobs … [+6428 chars]"
58,"{'id': 'business-insider', 'name': 'Business Insider'}",Sarah Jackson,Bluesky CEO appears to troll Mark Zuckerberg with her own Latin T-shirt that says 'a world without Caesars',"Bluesky CEO Jay Graber took a dig at Mark Zuckerberg with her own Latin shirt saying ""A world without Caesars.""",https://www.businessinsider.com/bluesky-ceo-shirt-latin-trolls-mark-zuckerberg-sxsw-2025-3,https://i.insider.com/67d05b47585f1dff88b1c541?width=1200&format=jpeg,2025-03-11T17:03:03Z,"Mark Zuckerberg's shirt from Meta Connect 2024 made a comparison between the Meta CEO and Roman dictator Julius Caesar.Manuel Orbegozo/REUTERS
<ul><li>Mark Zuckerberg isn't the only tech executive s… [+2385 chars]"
59,"{'id': 'business-insider', 'name': 'Business Insider'}",Pranav Dixit,Meta keeps secret 'block' lists of ex-employees — and even help from its C-suite can't get you off them,Former employees and managers and have been left in the dark about what it takes to get off Meta's block list.,https://www.businessinsider.com/meta-secret-block-lists-bar-rehiring-some-former-employees-2025-2,https://i.insider.com/67be0e1de015c5d98a6ae1ab?width=1200&format=jpeg,2025-03-05T16:14:02Z,"Meta CEO Mark ZuckerbergGetty Images; Jenny Chang-Rodriguez/BI
<ul><li>Meta maintains internal blocklists of employees who are ineligible for being rehired.</li><li>BI spoke with several former empl… [+11565 chars]"
60,"{'id': 'wired', 'name': 'Wired'}","Caroline Haskins, Vittoria Elliott",‘Startup Nation’ Groups Say They’re Meeting Trump Officials to Push for Deregulated ‘Freedom Cities’,The architects of projects like Próspera are drafting legislation to create US cities that would be free from federal regulations.,https://www.wired.com/story/startup-nations-donald-trump-legislation/,"https://media.wired.com/photos/67ca06cdcf673e42ea9cb2b0/191:100/w_1280,c_limit/Free-Cities-Deregulation-Business-1945140881.jpg",2025-03-07T19:48:54Z,"There's so much capital and there's so much political will, but yet there's an inability to develop these technologies, says Allen. And the inability comes from lack of space and too many regulations… [+3846 chars]"
61,"{'id': None, 'name': 'MacRumors'}",Tim Hardwick,Threads Update Adds Profile Topics and Follower-Only Replies,"Threads has just introduced several new features aimed at giving users more control over their experience and enhancing content discovery on the social media platform and X rival.





The update includes the ability to add up to ten ""Topics"" to your bio, whi…",https://www.macrumors.com/2025/03/21/threads-update-adds-profile-topics/,https://images.macrumors.com/t/yw_78fO7YoaJL9ojy_Tcg-hvnB8=/1600x/article-new/2023/07/instagram-threads-app.jpg,2025-03-21T11:45:12Z,"Threads has just introduced several new features aimed at giving users more control over their experience and enhancing content discovery on the social media platform and X rival.
The update include… [+1512 chars]"
62,"{'id': 'business-insider', 'name': 'Business Insider'}","Katie Balevic,Katie Notopoulos","Mark Zuckerberg copied Benson Boone's Grammys look, right down to the sparkly blue jumpsuit","Mark Zuckerberg performed at his wife's birthday party clad in a sparkly blue jumpsuit, copying Benson Boone's look from the Grammys.",https://www.businessinsider.com/mark-zuckerberg-blue-jumpsuit-benson-boone-priscilla-chan-party-2025-2,https://i.insider.com/67c20dcbb8b41a9673f95884?width=1200&format=jpeg,2025-02-28T20:43:45Z,"Mark Zuckerberg copied Benson Boone's Grammy performance look when he took the stage at his wife's birthday party.Amy Sussman/Getty Images
<ul><li>Mark Zuckerberg performed in a sparkly blue jumpsui… [+2220 chars]"
63,"{'id': 'wired', 'name': 'Wired'}",Jason Parham,The Anti-DEI Agenda Is Reprogramming America,President Trump’s anti-DEI playbook doesn’t just affect the makeup of America’s workplaces. It also impacts cultural production. Just ask Netflix’s former head of diversity.,https://www.wired.com/story/anti-dei-agenda-reprogramming-america/,"https://media.wired.com/photos/67d21cea90f53a3ff103a42e/191:100/w_1280,c_limit/Netflix-DEI-Lead-Culture-1203605173.jpg",2025-03-17T11:00:00Z,"It would be silly to think, in this time of spectacular fools, that the Donald Trump administration mandate to kill diversity, equity, and inclusion (DEI) programs was simply a workplace issue. Whats… [+2930 chars]"
64,"{'id': 'business-insider', 'name': 'Business Insider'}",Sydney Bradley,Instagram says it's 'doubling down' on DMs. This chart shows just how much.,"Instagram has been beefing up DMs with over 20 updates in the last year, focusing on AI and user interaction. We put them all together in a chart.",https://www.businessinsider.com/instagram-releases-many-new-dm-features-chart-2025-3,https://i.insider.com/67c8bbd5b1834fe311664664?width=1200&format=jpeg,2025-03-05T21:39:56Z,"Adam Mosseri is Instagram's top exec and says the platform is doubling down on DMs.Courtesy of Meta
<ul><li>Instagram has been beefing up DMs with over 20 updates in recent months, with many focused… [+3356 chars]"
65,"{'id': None, 'name': 'Digital Trends'}",Andrew Tarantola,Meta rolls out its AI chatbot to nearly a dozen Middle Eastern nations,Meta announced Monday that it is making its Meta AI chatbot available to millions of users throughout the Middle East and North Africa.,https://www.digitaltrends.com/computing/meta-rolls-out-its-ai-chatbot-to-nearly-dozen-middle-eastern-nations/,https://www.digitaltrends.com/wp-content/uploads/2025/02/1000053291.jpg?resize=1200%2C630&p=1,2025-02-24T18:27:36Z,"Meta
Millions of Facebook, Instagram, WhatsApp, and Messenger users throughout the Middle East now enjoy access to Meta’s self-named AI chatbot platform, the company announced on Monday. The chatbot… [+1850 chars]"
66,"{'id': 'the-verge', 'name': 'The Verge'}",Emma Roth,DuckDuckGo is amping up its AI search tool but will still let you leave it behind,"DuckDuckGo has big plans for embedding AI into its search engine. The privacy-focused company just announced that its AI-generated answers, which appear for certain queries on its search engine, have exited beta and now source information from across the web …",https://www.theverge.com/news/624899/duckduckgo-ai-search-chatbot-plans,https://platform.theverge.com/wp-content/uploads/sites/2/chorus/uploads/chorus_asset/file/23932932/acastro_STK117__02.jpg?quality=90&strip=all&crop=0%2C10.732984293194%2C100%2C78.534031413613&w=1200,2025-03-06T06:17:55Z,"You can still choose how often you see AI-assisted answers, which now incorporate results from the web.
You can still choose how often you see AI-assisted answers, which now incorporate results from… [+3058 chars]"
67,"{'id': 'the-verge', 'name': 'The Verge'}",Sean Hollister,Sesame is the first voice assistant I’ve ever wanted to talk to more than once,"I tell Amazon’s Alexa to shut up on a near daily basis. I have almost zero interest in speaking to Gemini after our first awkward chat. The hitches, misunderstandings, and lag in any given AI “conversation” mean I’m always wasting time speaking when I could b…",https://www.theverge.com/news/621022/sesame-voice-assistant-ai-glasses-oculus-brendan-iribe,https://platform.theverge.com/wp-content/uploads/sites/2/2025/02/8.webp?quality=90&strip=all&crop=0%2C10.732984293194%2C100%2C78.534031413613&w=1200,2025-02-27T20:15:26Z,"Oculus co-founder Brendan Iribes next act: AI glasses that carry a conversation.
Oculus co-founder Brendan Iribes next act: AI glasses that carry a conversation.
I tell Amazons Alexa to shut up on … [+2637 chars]"
68,"{'id': None, 'name': 'Gizmodo.com'}",Cheryl Eddy,"George R.R. Martin Is Really Never, Ever Finishing That Damn Book","The Game of Thrones author did make time for a cameo on Dark Winds, however.",https://gizmodo.com/george-rr-martin-dark-winds-season-3-cameo-2000573883,https://gizmodo.com/app/uploads/2025/03/GeorgeRRMartin_DarkWinds.jpg,2025-03-10T17:00:02Z,"Three seasons into AMC and AMC+ series Dark Winds, the acclaimed noir drama starring Westworld‘s Zahn McClarnon, two of the show’s executive producers decided to drop in for a cameo. Last night’s sea… [+2258 chars]"
