,source,author,title,description,url,urlToImage,publishedAt,content
69,"{'id': None, 'name': 'Xataka.com'}",Javier Marquez,"Meta AI aterriza en España: así es el asistente que quiere marcar un antes y un después en WhatsApp, Facebook e Instagram","Se acabó depender de trucos para poder usar Meta AI en España. El asistente ha comenzado su despliegue oficial en Europa, lo que significa que estará disponible en WhatsApp, Instagram, Facebook y Messenger en algún momento de las próximas semanas.
<!-- BREAK …",https://www.xataka.com/robotica-e-ia/meta-ai-aterriza-espana-asi-asistente-que-quiere-marcar-antes-despues-whatsapp-facebook-e-instagram,https://i.blogs.es/342cad/meta-ai-portada/840_560.jpeg,2025-03-20T06:00:24Z,"Se acabó depender de trucos para poder usar Meta AI en España. El asistente ha comenzado su despliegue oficial en Europa, lo que significa que estará disponible en WhatsApp, Instagram, Facebook y Mes… [+4893 chars]"
70,"{'id': None, 'name': 'Xataka.com'}",Javier Pastor,"El éxito de Meta AI en EEUU ha sido limitado, pero ahora quieren intentarlo en un país adicto a WhatsApp: España","Llega tarde, eso seguro. La pregunta es si logrará lo que no ha logrado en En Estados Unidos. Allí llevan pudiendo usar Meta AI integrado en Facebook, WhatsApp e Instagram desde hace casi un año, pero no parece que dichas opciones hayan logrado convertir a es…",https://www.xataka.com/robotica-e-ia/llegada-meta-ai-a-espana-tiene-reto-enorme-convencernos-no-salir-whatsapp,https://i.blogs.es/6d31c4/meta-ai/840_560.jpeg,2025-03-21T11:30:25Z,"Llega tarde, eso seguro. La pregunta es si logrará lo que no ha logrado en En Estados Unidos. Allí llevan pudiendo usar Meta AI integrado en Facebook, WhatsApp e Instagram desde hace casi un año, per… [+4708 chars]"
71,"{'id': 'fox-news', 'name': 'Fox News'}","Kurt Knutsson, CyberGuy Report",Meta unveils new AR glasses with heart rate monitoring,Meta recently introduced its new augmented reality glasses with sensor technology that opens up new possibilities for research and development in AR applications.,https://www.foxnews.com/tech/meta-unveils-new-ar-glasses-heart-rate-monitoring,https://static.foxnews.com/foxnews.com/content/uploads/2025/03/3-meta-unveils-new-ar-glasses-with-heart-rate-monitoring.jpg,2025-03-20T10:00:08Z,"Get ready for some amazing tech that's about to change the way we see the world, literally. Meta has just unveiled its latest creation, the Aria Gen 2 augmented reality (AR) glasses. 
But don't rush… [+6176 chars]"
72,"{'id': None, 'name': 'Yahoo Entertainment'}",,"Meta has revenue sharing agreements with Llama AI model hosts, filing reveals",,https://consent.yahoo.com/v2/collectConsent?sessionId=1_cc-session_7ffba610-cad4-4f28-8aea-7f2be1a4ce9f,,2025-03-21T20:40:53Z,"If you click 'Accept all', we and our partners, including 239 who are part of the IAB Transparency &amp; Consent Framework, will also store and/or access information on a device (in other words, use … [+702 chars]"
73,"{'id': None, 'name': 'Yahoo Entertainment'}",,"Meta in talks for $200 billion AI data center project, The Information reports",,https://consent.yahoo.com/v2/collectConsent?sessionId=1_cc-session_207f75a3-74f1-4207-bf53-02ef53183472,,2025-02-26T00:56:54Z,"If you click 'Accept all', we and our partners, including 238 who are part of the IAB Transparency &amp; Consent Framework, will also store and/or access information on a device (in other words, use … [+702 chars]"
74,"{'id': None, 'name': 'BBC News'}",,'I'm not tech-savvy - but within hours I could buy an illegal knife on social media',"Posing as an 18-year-old, BBC reporter Ruth Green quickly finds groups selling weapons openly.",https://www.bbc.com/news/articles/cgm18g19013o,https://ichef.bbci.co.uk/news/1024/branded_news/ec92/live/9cdd25e0-f6bf-11ef-9e61-71ee71f26eb1.jpg,2025-03-02T00:42:23Z,"I'm 48, use social media occasionally, and I'm not very tech-savvy. Until recently I'd never used Telegram.
But last year, after meeting the family of Ronan Kanda - the 16-year-old who was killed in… [+6725 chars]"
75,"{'id': 'business-insider', 'name': 'Business Insider'}",Insider Inc.,How brands can elevate everyday moments in 2025,Find out how consumers navigate quality time — and how today's brands can enhance it.,https://www.businessinsider.com/sc/brands-consumer-advertising-quality-time,https://muse.insider.com/image/67b6484ceb4be2fff9a50cdd-1200/amazonads_qualityoverquantity_4x3.png,2025-03-04T17:27:14Z,"How brands can elevate everyday moments in 2025<!-- Meta data --> <!-- Browser favicons --><!-- Google Tag Manager - for BI use GTM-NS64GV - for Insider use GTM-K2K9CK --> (function(w,d,s,l,i){w[l]=w… [+2989 chars]"
76,"{'id': 'business-insider', 'name': 'Business Insider'}",Lloyd Lee,Bluesky says it sold out of shirts that call out CEOs who seek to 'control your experience online',"Bluesky started slinging shirts that said ""a world without Caesars."" The shirt sold out in 30 minutes, the company said.",https://www.businessinsider.com/bluesky-t-shirt-world-without-ceasars-mark-zuckerberg-2025-3,https://i.insider.com/67d37cb669253ccddf993b94?width=1200&format=jpeg,2025-03-14T02:53:42Z,"Bluesky said it began selling the same T-shirt CEO Jay Graber wore at SXSW on Thursday afternoon and sold out within 30 minutes.Samantha Burkardt/SXSW Conference & Festivals via Getty Images
<ul><li… [+1949 chars]"
77,"{'id': None, 'name': 'heise online'}",Daniel AJ Sokolov,"Meta Platforms beginnt Feldtests von ""Community Notes""","Fakten prüfende Profis sind out bei Meta. Die User sollen ""Kontext"" liefern, gratis. Auf das Geschäft soll sich das bitte nicht auswirken.",https://www.heise.de/news/Meta-Platforms-beginnt-Feldtests-von-Community-Notes-10315462.html,https://heise.cloudimg.io/bound/1200x1200/q85.png-lossy-85.webp-lossy-85.foil1/_www-heise-de_/imgs/18/4/8/1/8/6/8/9/shutterstock_1805940052-8bbcdf7a4c30d8dd.jpg,2025-03-13T21:20:00Z,"""Wir erwarten, dass Community Notes weniger voreingenommen sein werden als die unabhängige Faktenprüfung, die sie ersetzen, weil es mehr Leuten mit mehr Gesichtspunkten erlaubt, Kontext beizusteuern.… [+2996 chars]"
78,"{'id': None, 'name': 'Chicory.dev'}",,Chicory: A JVM native WebAssembly runtime,Description will go into a meta tag in <head />,https://chicory.dev/,https://chicory.dev/img/chicory1.png,2025-02-25T11:22:06Z,"Pure Java
Using Chicory you don't need to rely on any system resource. Everything runs in 100% pure Java on top of the standard library."
79,"{'id': None, 'name': 'Digital Trends'}",Willow Roberts,Meta AI is coming to Europe after almost a whole year of negotiations,A limited version of Meta AI will start rolling out in Europe this week after overcoming,https://www.digitaltrends.com/mobile/meta-ai-is-coming-to-europe/,https://www.digitaltrends.com/wp-content/uploads/2025/03/Meta-au-widget-home-screen.jpeg?resize=1200%2C630&p=1,2025-03-20T08:58:35Z,"Meta AI has been around in the United States since 2023 but the company had to delay its launch in the EU due to regulatory concerns. Now, it seems like Zuckerberg’s team has finally come to a (limit… [+1535 chars]"
80,"{'id': None, 'name': 'Slashdot.org'}",BeauHD,Facebook Was 'Hand In Glove' With China,"An anonymous reader quotes a report from the BBC: A former senior Facebook executive has told the BBC how the social media giant worked ""hand in glove"" with the Chinese government on potential ways of allowing Beijing to censor and control content in China. S…",https://tech.slashdot.org/story/25/03/11/0018244/facebook-was-hand-in-glove-with-china,https://a.fsdn.com/sd/topics/facebook_64.png,2025-03-11T13:00:00Z,"Is this a surprise to anyone?
This seems to have been pitched as ""it was secret"", and ""Zuck was building censorship apparatus"". Meta has since said it was public about wanting to operate in China (I… [+562 chars]"
81,"{'id': None, 'name': 'Yahoo Entertainment'}",Seana Smith,Meta to build $200B AI data center. Clayco CEO weighs in.,"According to a report from The Information, Meta Platforms (META) is in talks to build a new $200 billion data center. Possible locations for this massive AI...",https://finance.yahoo.com/video/meta-build-200b-ai-data-161739383.html,https://s.yimg.com/ny/api/res/1.2/2sXVzGjVMlVrXl5q9VrFcg--/YXBwaWQ9aGlnaGxhbmRlcjt3PTEyMDA7aD02NzY-/https://s.yimg.com/os/creatr-uploaded-images/2025-02/3a107b00-f459-11ef-b5c8-f0782623a615,2025-02-26T16:17:39Z,"According to a report from The Information, Meta Platforms (META) is in talks to build a new $200 billion data center. Possible locations for this massive AI facility include Louisiana and Texas. Cla… [+1296 chars]"
82,"{'id': None, 'name': 'The Atlantic'}",Alex Reisner,The Unbelievable Scale of AI’s Pirated-Books Problem,Meta pirated millions of books to train its AI. Search through them here.,https://www.theatlantic.com/technology/archive/2025/03/libgen-meta-openai/682093/,https://cdn.theatlantic.com/thumbor/d4Gfci1_RR9IJb7TtLqFddsqEGA=/0x26:1200x651/1200x625/media/img/mt/2025/03/AI2/original.gif,2025-03-20T11:30:00Z,Editor’s note: This analysis is part of The Atlantic’s investigation into the Library Genesis data set. You can access the search tool directly here. Find The Atlantic’s search tool for movie and tel… [+9784 chars]
83,"{'id': None, 'name': 'Android Central'}",bradypsnyder@gmail.com (Brady Snyder),Project Astra joins Gemini arm as Google gears up for a public launch,"Google is planning to release Project Astra, and it's becoming part of Gemini ahead of that crucial move.",https://www.androidcentral.com/apps-software/project-astra-joins-gemini-arm-as-google-gears-up-for-public-launch,https://cdn.mos.cms.futurecdn.net/tt5thLRTkHf4b6iYE536EJ-1200-80.jpg,2025-03-06T21:03:44Z,"What you need to know
<ul><li>Google is moving the Project Gemini team from the Google DeepMind group to the Gemini app umbrella.</li><li>The Gemini app now has a new VP, as ex-Meta VP Chris Struhar… [+2225 chars]"
84,"{'id': None, 'name': 'Substack.com'}",Gary Marcus,"Meta pirated at least 101 of my books, and others",And they knew perfectly well what they were doing,https://garymarcus.substack.com/p/meta-pirated-at-least-101-of-my-books,"https://substackcdn.com/image/fetch/w_1200,h_600,c_fill,f_jpg,q_auto:good,fl_progressive:steep,g_auto/https%3A%2F%2Fsubstack-post-media.s3.amazonaws.com%2Fpublic%2Fimages%2F08896381-a789-4576-ad88-bb827fba4225_1668x1834.jpeg",2025-03-22T20:18:58Z,"Alex Reisners shocking new article at The Atlantic on Metas unbelievable brazen piracy operations is must reading:
The book is mostly about a database called Libgen, known to contain pirated materia… [+2052 chars]"
85,"{'id': None, 'name': 'Xataka.com'}",Rubén Andrés,"Zuckerberg despidió al 5% de la plantilla de Meta ""por bajo rendimiento"". Sus exempleados aseguran que hay otra razón","Del mismo modo que no es lo mismo dimitir que te despidan (aunque el resultado es que te quedas sin empleo), tampoco es lo mismo que te despidan por un recorte de personal que por ""bajo rendimiento"".
<!-- BREAK 1 -->
Meta, ha despedido al 5% de su plantilla, …",https://www.xataka.com/empresas-y-economia/mark-zuckerberg-despidio-al-5-plantilla-meta-rendimiento-exempleados-aseguran-que-hay-otra-razon,https://i.blogs.es/2e3ba8/mark-zuckerberg-y-sus-exempleados/840_560.jpeg,2025-03-06T15:16:12Z,"Del mismo modo que no es lo mismo dimitir que te despidan (aunque el resultado es que te quedas sin empleo), tampoco es lo mismo que te despidan por un recorte de personal que por ""bajo rendimiento"".… [+5191 chars]"
