headline,link,date_str,parsed_date_iso,sentiment_score
James Murdoch’s Bodhi Tree slashes planned investment in Reliance JV Viacom18,https://www.financialexpress.com/business/industry-james-murdochs-bodhi-tree-slashes-planned-investment-in-reliance-jv-viacom18-3047051/,2023-04-14T15:31:15+05:30,2023-04-14T10:01:15,-0.2023
"Viacom18 closes Rs 15,145-crore deal with Bodhi Tree Systems",https://www.financialexpress.com/business/brandwagon-viacom18-closes-rs-15145-crore-deal-with-bodhi-tree-systems-3046432/,2023-04-14T08:06:12+05:30,2023-04-14T02:36:12,0.0
Bodhi Tree picks up strategic stake in coaching institute ALLEN for $600 million,https://www.financialexpress.com/business/industry-bodhi-tree-picks-up-strategic-stake-in-coaching-institute-allen-for-600-million-2509534/,2022-05-02T02:30:00+05:30,2022-05-01T21:00:00,0.0
"Full rooms, firm rates and a sector in the sun",https://www.financialexpress.com/business/industry-insights/full-rooms-firm-rates-and-a-sector-in-the-sun/3809583/,2025-04-15T10:10:58+05:30,2025-04-15T04:40:58,0.0
Can Lemon Tree catch up with Indian Hotels? A lot depends on this growth bet…,https://www.financialexpress.com/market/stock-insights/can-lemon-tree-catch-up-with-indian-hotels-a-lot-depends-on-this-growth-bet/3754234/,2025-02-20T06:02:00+05:30,2025-02-20T00:32:00,0.4588
"Lemon Tree Hotel signs a new franchise at Shivpuri, Madhya Pradesh",https://www.financialexpress.com/business/industry-lemon-tree-hotel-signs-a-new-franchise-at-shivpuri-madhya-pradesh-3590774/,2024-08-23T16:49:56+05:30,2024-08-23T11:19:56,0.0
