headline,link,date_str,parsed_date_iso,sentiment_score
"SBI’s board clears raising up to Rs 10,000 cr via infra bonds in FY23",https://www.financialexpress.com/market/sbis-board-clears-raising-up-to-rs-10000-cr-via-infra-bonds-in-fy23-2896035/,2022-11-30T02:30:00+05:30,2022-11-29T21:00:00,0.0772
India’s SBI aims to keep net bad loan ratio under 1%,https://www.financialexpress.com/business/banking-finance-indias-sbi-aims-to-keep-net-bad-loan-ratio-under-1-2889137/,2022-11-23T21:47:14+05:30,2022-11-23T16:17:14,-0.5423
SBI plan for senior citizens: Additional income through Reverse Mortgage Loan – key points to know,https://www.financialexpress.com/money/sbi-plan-for-senior-citizens-additional-income-through-reverse-mortgage-loan-key-points-to-know-2869826/,2022-11-21T17:22:37+05:30,2022-11-21T11:52:37,0.0
"Bank Nifty poised to scale new highs, minor correction likely; ICICI Bank, Kotak Bank, SBI among top picks",https://www.financialexpress.com/market/bank-nifty-poised-to-scale-new-highs-minor-correction-likely-icici-bank-kotak-bank-sbi-among-top-picks-2866831/,2022-11-21T14:12:05+05:30,2022-11-21T08:42:05,0.6705
SBI hikes MCLR by 10-15 bps on some tenures,https://www.financialexpress.com/business/banking-finance-sbi-hikes-mclr-by-10-15-bps-on-some-tenures-2816524/,2022-11-16T01:45:00+05:30,2022-11-15T20:15:00,0.0
Getting your pension in SBI? Here’s a guide to Video Life Certificate (Jeevan Pramaan) submission from home,https://www.financialexpress.com/money/sbi-video-life-certificate-jeevan-pramaan-vlc-submission-process-for-pensioners-step-by-step-guide-on-how-to-submit-vlc-2815870/,2022-11-15T13:26:48+05:30,2022-11-15T07:56:48,0.0
SFB deposit growth rate betters credit￼,https://www.financialexpress.com/business/banking-finance-sfb-deposit-growth-rate-betters-credit-2805316/,2022-11-11T07:14:42+05:30,2022-11-11T01:44:42,0.3818
"Current account deficit likely to be lower at 3 pc this fiscal, says SBI report",https://www.financialexpress.com/policy/economy-current-account-deficit-likely-to-be-lower-at-3-pc-this-fiscal-says-sbi-report-2803256/,2022-11-10T17:44:43+05:30,2022-11-10T12:14:43,-0.5994
Leave Travel Concession: Salaried employees can’t avoid TDS if the itinerary includes a foreign trip,https://www.financialexpress.com/money/income-tax-leave-travel-concession-ltc-tds-salaried-employees-foreign-trip-supreme-court-2788160/,2022-11-08T12:51:36+05:30,2022-11-08T07:21:36,-0.34
"Strong Q2 drives SBI, BoB stocks to new highs",https://www.financialexpress.com/market/strong-q2-drives-sbi-bob-stocks-to-new-highs-2786853/,2022-11-08T08:24:37+05:30,2022-11-08T02:54:37,0.5106
State Bank of India Rating: BUY; Q2 results: healthy asset quality,https://www.financialexpress.com/market/state-bank-of-india-rating-buy-q2-results-healthy-asset-quality-2784751/,2022-11-08T04:20:00+05:30,2022-11-07T22:50:00,0.6369
"With Rs 14,752 crore net, SBI beats RIL to become most profitable company in Q2",https://www.financialexpress.com/business/banking-finance-with-rs-14752-crore-net-sbi-beats-ril-to-become-most-profitable-company-in-q2nbspspan-stylefont-weightnormal-iddocs-internal-guid-e0d16deb-7fff-51b2-c5bd-5b9c0f4c5024divspan-stylefont-size-14pt-font-f-2776942/,2022-11-06T18:05:30+05:30,2022-11-06T12:35:30,0.4927
"SBI profit up 74%  at Rs 13,265 crore",https://www.financialexpress.com/business/banking-finance-sbi-profit-up-74nbsp-at-rs-13265-crore-2776481/,2022-11-06T06:41:32+05:30,2022-11-06T01:11:32,0.4404
"Finally, cash loses the king status, first time in 20 years!",https://www.financialexpress.com/money/finally-cash-loses-the-king-status-first-time-in-20-years-2772987/,2022-11-03T12:31:15+05:30,2022-11-03T07:01:15,-0.3802
"SBI Clerk Admit Card 2022 released for Junior Associates prelims exam scheduled on November 25, download at sbi.co.in",https://www.financialexpress.com/jobs-career/sbi-clerk-admit-card-2022-released-for-junior-associates-prelims-exam-scheduled-on-november-25-download-at-sbi-coin-2760295/,2022-10-31T19:07:43+05:30,2022-10-31T13:37:43,0.2023
SBI Cards and Payment Services Rating: buy; Robust growth in retail spends,https://www.financialexpress.com/market/sbi-cards-and-payment-services-rating-buy-robust-growth-in-retail-spends-2759411/,2022-10-31T05:35:00+05:30,2022-10-31T00:05:00,0.6124
SBI Card Q2 profit jumps 52%,https://www.financialexpress.com/business/banking-finance-sbi-card-q2-profit-jumps-52-2753066/,2022-10-28T03:15:00+05:30,2022-10-27T21:45:00,0.4404
"Stocks to buy on Diwali 2022: HCL Technologies, SBI, Shree Cement among top picks, shares may rally over 20%",https://www.financialexpress.com/market/stocks-to-buy-on-diwali-2022-hcl-technologies-sbi-shree-cement-among-top-picks-shares-may-rally-over-20-2720971/,2022-10-19T13:38:39+05:30,2022-10-19T08:08:39,0.4588
SBI home loan AUM crosses Rs 6 trillion,https://www.financialexpress.com/money/sbi-home-loan-aum-crosses-rs-6-trillion-2708637/,2022-10-13T04:00:00+05:30,2022-10-12T22:30:00,0.0
"SBI Festive Bonanza for Home Loan customers: Zero processing fees, up to 0.30% discount on interest and more",https://www.financialexpress.com/money/sbi-festive-bonanza-for-home-loan-customers-zero-processing-fees-up-to-0-30-discount-on-interest-and-more-2708402/,2022-10-12T18:06:43+05:30,2022-10-12T12:36:43,0.7184
SBI lines up NPAs over Rs 746 cr for sale in Oct-Nov,https://www.financialexpress.com/business/banking-finance-sbi-lines-up-npas-over-rs-746-cr-for-sale-in-oct-novnbsp-2704902/,2022-10-09T13:41:23+05:30,2022-10-09T08:11:23,0.0
SBI vs IDBI vs HDFC Bank special fixed deposit schemes: Where senior citizens can get highest interest?,https://www.financialexpress.com/money/sbi-vs-idbi-vs-hdfc-bank-special-fixed-deposit-schemes-where-senior-citizens-can-get-highest-interest-2702308/,2022-10-06T17:17:23+05:30,2022-10-06T11:47:23,0.6908
"Bad news! Home loan EMIs to increase as HDFC, SBI hike interest rates. Other lenders to follow",https://www.financialexpress.com/money/home-loan-emis-increase-hdfc-sbi-hike-interest-rates-details-2698145/,2022-10-02T14:22:41+05:30,2022-10-02T08:52:41,0.2714
SBI Card user? Get up to 22.5% cashback. Check offer details,https://www.financialexpress.com/money/sbi-card-user-get-up-to-22-5-cashback-check-offer-detailsnbsp-2691744/,2022-09-26T19:16:30+05:30,2022-09-26T13:46:30,0.0
"Harsha Engineers, Britannia, Embassy REIT, Coal India, BPCL, State Bank of India stocks in focus",https://www.financialexpress.com/market/stocks-to-watch-harsha-engineers-britannia-embassy-reit-coal-india-bpcl-state-bank-of-india-sbi-stocks-in-focus-2690634/,2022-09-26T07:06:24+05:30,2022-09-26T01:36:24,0.0
"SBI raises Rs 4,000 cr via Tier 2 bonds",https://www.financialexpress.com/market/sbi-raises-rs-4000-cr-via-tier-2-bonds-2683498/,2022-09-22T03:15:00+05:30,2022-09-21T21:45:00,0.0
SBI asks its branches to avoid dollar exposure on Bangladesh,https://www.financialexpress.com/business/banking-finance-sbi-asks-its-branches-to-avoid-dollar-exposure-on-bangladesh-2676924/,2022-09-20T07:16:12+05:30,2022-09-20T01:46:12,-0.296
SBI mobile fund transfer fee rule changed: Now send or request money using *99# SMS service for free,https://www.financialexpress.com/money/sbi-mobile-fund-transfer-sms-charges-removed-details-2672482/,2022-09-18T15:54:16+05:30,2022-09-18T10:24:16,0.5106
SBI hikes BPLR by 70 bps; keeps MCLR unchanged,https://www.financialexpress.com/money/sbi-hikes-bplr-by-70-bps-keeps-mclr-unchanged-2668676/,2022-09-16T02:45:00+05:30,2022-09-15T21:15:00,0.0
"Bank Nifty must hold above 41250 to hit new lifetime high; buy ICICI Bank, SBI stocks on dips to pocket gains",https://www.financialexpress.com/market/cafeinvest-bank-nifty-must-hold-above-41250-to-hit-new-lifetime-high-buy-icici-bank-sbi-stocks-on-dips-to-pocket-gains-2667485/,2022-09-15T09:05:12+05:30,2022-09-15T03:35:12,0.6249
"Rupee trade with Russia to start soon, SBI has shown interest: FIEO",https://www.financialexpress.com/policy/economy-rupee-trade-with-russia-to-start-soon-sbi-has-shown-interest-fieo-2667311/,2022-09-15T03:45:00+05:30,2022-09-14T22:15:00,0.4588
"Premature withdrawal/closure of Fixed Deposit: SBI vs PNB vs Axis vs HDFC Bank rules, penalties",https://www.financialexpress.com/money/premature-withdrawal-closure-of-fixed-deposit-sbi-pnb-axis-hdfc-bank-rules-penalties-2662854/,2022-09-11T16:16:20+05:30,2022-09-11T10:46:20,0.0
"SBI, ICICI, BoB hit 52-week highs",https://www.financialexpress.com/market/sbi-icici-bob-hit-52-week-highs-2661656/,2022-09-10T00:30:00+05:30,2022-09-09T19:00:00,0.0
"Recurring Deposit Calculator: Rs 10,000/month to Rs 7 lakh! SBI vs Post Office RD Compared",https://www.financialexpress.com/money/recurring-deposit-rd-calculator-sbi-vs-post-office-interest-rate-returns-rs-10000-to-rs-7-lakh-2658289/,2022-09-07T14:19:39+05:30,2022-09-07T08:49:39,0.0
SBI Small Cap Fund: Rs 5000/month SIP in this Mutual Fund from 2012 would have given you Rs 29 lakh now!,https://www.financialexpress.com/money/mutual-funds-sbi-small-cap-fund-mutual-fund-calculator-rs-5000-sip-to-rs-29-lakh-2657812/,2022-09-08T17:25:39+05:30,2022-09-08T11:55:39,0.0
"CASHBACK SBI Card launched – Check features, benefits, renewal fee",https://www.financialexpress.com/money/cashback-sbi-card-launched-check-features-benefits-renewal-fee-2651924/,2022-09-01T15:15:52+05:30,2022-09-01T09:45:52,0.4767
SBI customer alert! ‘Your account will be blocked if you don’t update PAN’ – Do this if you get such message,https://www.financialexpress.com/money/latest-sbi-customer-alert-your-account-will-be-blocked-if-you-dont-update-pan-do-this-if-you-get-such-fake-message-2647197/,2022-08-28T16:36:57+05:30,2022-08-28T11:06:57,0.1007
"Nifty may hit 18600 target by Dec-end, charts show support at 16800; Buy Reliance, SBI, HDFC Bank, Airtel",https://www.financialexpress.com/market/nifty-may-hit-18600-target-by-dec-end-charts-show-support-at-16800-buy-reliance-sbi-hdfc-bank-bharti-airtel-2645161/,2022-08-26T15:21:01+05:30,2022-08-26T09:51:01,0.6597
"SBI sells KSK Mahanadi Power loan account to Aditya Birla ARC for Rs 1,622 crore",https://www.financialexpress.com/business/banking-finance-sbi-sells-ksk-mahanadi-power-loan-account-to-aditya-birla-arc-for-rs-1622-crore-2636242/,2022-08-19T15:02:29+05:30,2022-08-19T09:32:29,0.0
"Blackstone completes Rs 4,044-cr Sona stake sale; GIC, SBI MF top buyers",https://www.financialexpress.com/market/blackstone-completes-rs-4044-cr-sona-stake-sale-gic-sbi-mf-top-buyers-2635468/,2022-08-19T02:30:00+05:30,2022-08-18T21:00:00,0.2023
SBI hikes MCLR by this much; PSBs increase FD interest rates ahead of festive season,https://www.financialexpress.com/business/banking-finance-sbi-hikes-mclr-by-this-much-psbs-increase-fd-interest-rates-ahead-of-festive-season-2633243/,2022-08-17T17:21:32+05:30,2022-08-17T11:51:32,0.8074
SBI moves insolvency petition against Bajaj Hindusthan Sugar,https://www.financialexpress.com/business/industry-sbi-moves-insolvency-petition-against-bajaj-hindusthan-sugar-2-2632528/,2022-08-17T01:30:00+05:30,2022-08-16T20:00:00,0.0
SBI moves insolvency petition against Bajaj Hindusthan Sugar,https://www.financialexpress.com/business/industry-sbi-moves-insolvency-petition-against-bajaj-hindusthan-sugar-2632468/,2022-08-17T01:33:30+05:30,2022-08-16T20:03:30,0.0
Large lenders increase rural push in search of fresh business,https://www.financialexpress.com/business/banking-finance-large-lenders-increase-rural-push-in-search-of-fresh-business-2632425/,2022-08-17T00:35:00+05:30,2022-08-16T19:05:00,0.5574
"SBI Caps, Citi Group among six bankers in race to manage HZL stake sale",https://www.financialexpress.com/business/industry-sbi-caps-citi-group-among-six-bankers-in-race-to-manage-hzl-stake-sale-2626600/,2022-08-12T02:30:00+05:30,2022-08-11T21:00:00,0.0
"Bharti Airtel, HDFC, Coal India, Hindalco, SBI, IRCTC, Apollo Hospitals, SAIL, Tech Mahindra stocks in focus",https://www.financialexpress.com/market/stocks-to-watch-bharti-airtel-hdfc-coal-india-hindalco-sbi-irctc-apollo-hospitals-sail-tech-mahindra-stocks-in-focus-2624081/,2022-08-10T08:05:34+05:30,2022-08-10T02:35:34,0.0
Yono to onboard 100 million users by March: SBI Chairman Dinesh Khara,https://www.financialexpress.com/business/banking-finance-yono-to-onboard-100-million-users-by-march-sbi-chairman-dinesh-khara-2622425/,2022-08-09T06:00:00+05:30,2022-08-09T00:30:00,0.0
"State Bank of India rating: Buy | Q1 slips, but prospects are intact",https://www.financialexpress.com/market/state-bank-of-india-rating-buy-q1-slips-but-prospects-are-intact-2622368/,2022-08-09T00:20:00+05:30,2022-08-08T18:50:00,0.6124
"SBI share price drops 2.8% after April-June quarter results disappoint; Should you buy, sell, or hold?",https://www.financialexpress.com/market/sbi-share-price-drops-2-8-after-april-june-quarter-results-disappoint-should-you-buy-sell-or-hold-2621266/,2022-08-08T10:25:11+05:30,2022-08-08T04:55:11,-0.128
"SBI Q1 net profit falls 6.7% on-year against expectation, India’s largest PSU bank nets only Rs 6068 crore",https://www.financialexpress.com/business/banking-finance-sbi-q1-net-profit-falls-6-7-on-year-against-expectation-indias-largest-psu-bank-nets-only-rs-6068-crore-2619732/,2022-08-06T14:15:58+05:30,2022-08-06T08:45:58,0.4404
"ICICI Bank, SBI, TVS Motors, other bank, realty, auto stocks up on RBI’s repo rate hike; buy, sell, hold?",https://www.financialexpress.com/market/icici-bank-sbi-tvs-motors-other-bank-realty-auto-stocks-up-on-rbis-repo-rate-hike-buy-sell-hold-2618544/,2022-08-05T12:10:15+05:30,2022-08-05T06:40:15,0.0
Expect SBI to stay invested in Yes Bank beyond March 2023: Yes Bank MD & CEO Prashant Kumar,https://www.financialexpress.com/business/banking-finance-expect-sbi-to-stay-invested-in-yes-bank-beyond-march-2023-yes-bank-md-ceo-prashant-kumar-2616735/,2022-08-04T05:10:00+05:30,2022-08-03T23:40:00,0.6597
"Nifty may hit 17500 in coming weeks; SBI, Reliance, Tata Motors, Bharat Dynamics among top near-term picks",https://www.financialexpress.com/market/nifty-may-hit-17500-in-coming-weeks-sbi-reliance-tata-motors-bharat-dynamics-among-top-near-term-picks-2613290/,2022-08-01T13:40:08+05:30,2022-08-01T08:10:08,0.6808
SBI Cards net profit jumps 106% in Q1,https://www.financialexpress.com/business/banking-finance-sbi-cards-net-profit-rises-106-in-q1-2609935/,2022-07-29T02:40:00+05:30,2022-07-28T21:10:00,0.4404
"Nifty aims 17500 in coming months, charts show support at 16000; Buy Reliance, SBI, TCS, ITC, HDFC, others",https://www.financialexpress.com/market/nifty-aims-17500-in-coming-months-charts-show-support-at-16000-buy-reliance-sbi-tcs-itc-hdfc-others-2609136/,2022-07-28T11:53:40+05:30,2022-07-28T06:23:40,0.6597
"Nifty 50 needs to hold 16616 for an up move towards 16750-16888; Buy SBI, HAL, others for positive action",https://www.financialexpress.com/market/cafeinvest-nifty-50-needs-to-hold-16616-for-an-up-move-towards-16750-16888-buy-sbi-hal-others-for-positive-action-2608884/,2022-07-28T08:34:48+05:30,2022-07-28T03:04:48,0.743
Digital illiteracy among micro units one of the challenges in credit support: SBI’s Rana Ashutosh Kumar Singh,https://www.financialexpress.com/business/sme-msme-fin-digital-illiteracy-among-micro-units-one-of-the-challenges-in-credit-support-sbis-rana-ashutosh-kumar-singh-2605623/,2022-07-25T18:49:14+05:30,2022-07-25T13:19:14,0.4019
"SBI to raise Rs 11,000 crore in Basel III bonds in FY23, gets board nod",https://www.financialexpress.com/business/banking-finance-sbi-to-raise-rs-11000-crore-in-basel-iii-bonds-in-fy23-gets-board-nod-2600638/,2022-07-20T19:10:32+05:30,2022-07-20T13:40:32,0.0
SBI hikes rate on 1-2 years tenure bulk deposit by 50 bps,https://www.financialexpress.com/business/banking-finance-sbi-hikes-rate-on-1-2-years-tenure-bulk-deposit-by-50-bps-2595709/,2022-07-16T02:30:00+05:30,2022-07-15T21:00:00,0.0
SBI hikes FCNR(B) deposit rates by up to 105 bps,https://www.financialexpress.com/business/banking-finance-sbi-hikes-fcnrb-deposit-rates-by-up-to-105-bps-2590550/,2022-07-12T01:30:00+05:30,2022-07-11T20:00:00,0.0
Incremental credit to MSMEs on an upswing since beginning of pandemic: SBI report,https://www.financialexpress.com/business/sme-msme-fin-incremental-credit-to-msmes-on-an-upswing-since-beginning-of-pandemic-sbi-report-2586023/,2022-07-07T13:07:23+05:30,2022-07-07T07:37:23,0.3818
"Reliance, HDFC Bank, Infosys, SBI, TCS, Coal India, Bharat Forge, NTPC stocks in focus on 4 July",https://www.financialexpress.com/market/stocks-to-watch-reliance-ril-hdfc-bank-infosys-sbi-tcs-coal-india-bharat-forge-ntpc-stocks-in-focus-on-4-july-2581522/,2022-07-04T07:54:41+05:30,2022-07-04T02:24:41,0.0
Retail tech startup Arzooo raises $70 million,https://www.financialexpress.com/business/industry-retail-tech-startup-arzooo-raises-70-million-2576664/,2022-06-30T04:15:00+05:30,2022-06-29T22:45:00,0.0
"Reliance Industries, SBI, ICICI Bank, Ruchi Soya, Route Mobile, Tata Steel stocks in focus on 29 June",https://www.financialexpress.com/market/stocks-to-watch-reliance-industries-ril-sbi-icici-bank-ruchi-soya-route-mobile-tata-steel-stocks-in-focus-today-2576109/,2022-06-29T08:04:03+05:30,2022-06-29T02:34:03,0.0
State Bank of India taking steps to counter impact of HDFC-HDFC Bank merger: SBI chairman Dinesh Khara,https://www.financialexpress.com/business/banking-finance-state-bank-of-india-taking-steps-to-counter-impact-of-hdfc-hdfc-bank-merger-sbi-chairman-dinesh-khara-2569613/,2022-06-23T00:45:00+05:30,2022-06-22T19:15:00,0.0
"Credit growth will drive liquidity normalisation: Dinesh Kumar Khara, chairman, State Bank of India",https://www.financialexpress.com/business/banking-finance-credit-growth-will-drive-liquidity-normalisation-dinesh-kumar-khara-chairman-state-bank-of-india-2561823/,2022-06-16T18:45:44+05:30,2022-06-16T13:15:44,0.6369
SBI hikes deposit rates by up to 20 bps on some tenures,https://www.financialexpress.com/money/sbi-hikes-deposit-rates-by-up-to-20-bps-on-some-tenures-2560701/,2022-06-15T03:15:00+05:30,2022-06-14T21:45:00,0.0
"SBI shares tank 5% so far in 2022, analysts say buy, stock may rally 35%; check target price",https://www.financialexpress.com/market/sbi-shares-tank-5-so-far-in-2022-analysts-say-buy-stock-may-rally-35-check-target-price-2559706/,2022-06-14T10:21:46+05:30,2022-06-14T04:51:46,0.296
"India Inc’s registers record dividend payout in FY22; PSBs, IT companies lead drive",https://www.financialexpress.com/business/industry-india-incs-registers-record-dividend-payout-in-fy22-psbs-it-companies-lead-drive-2558022/,2022-06-13T04:45:00+05:30,2022-06-12T23:15:00,0.0
"Nifty 50 needs to hold 16250-16300 support for upside bounce; Watch SBI, Maruti Suzuki, TCS stocks for action",https://www.financialexpress.com/market/cafeinvest-nifty-50-needs-to-hold-16250-16300-support-for-upside-bounce-watch-sbi-maruti-suzuki-tcs-stocks-for-action-2553654/,2022-06-09T08:58:06+05:30,2022-06-09T03:28:06,0.6597
"Nifty to hit 18400 by Mar’23, ICICI Bank, Bajaj Auto, SBI among top stock picks; check target price, upside",https://www.financialexpress.com/market/stocks-to-buy-nifty-to-hit-18400-by-mar23-icici-bank-bajaj-auto-sbi-among-top-picks-check-target-price-upside-2552827/,2022-06-08T14:34:24+05:30,2022-06-08T09:04:24,0.5423
"Reliance Industries, SBI, HDFC Bank, RITES, PNB, Future Group stocks in focus on 8 June 2022",https://www.financialexpress.com/market/stocks-to-watch-reliance-industries-ril-sbi-hdfc-bank-rites-pnb-future-group-stocks-in-focus-on-8-june-2022-2552199/,2022-06-08T08:01:30+05:30,2022-06-08T02:31:30,0.0
"Power shortage to continue as economic activity increases, but SBI, ICICI Bank, NTPC, other stocks may benefit",https://www.financialexpress.com/market/power-shortage-to-continue-as-economic-activity-increases-but-sbi-icici-bank-ntpc-other-stocks-may-benefit-2551122/,2022-06-07T11:51:13+05:30,2022-06-07T06:21:13,0.5423
"If Nifty holds 16400 post RBI policy decision, it may hit 17200 in June, Bank Nifty positive; buy SBI, TCS",https://www.financialexpress.com/market/cafeinvest-if-nifty-holds-16400-post-rbi-policy-decision-it-may-hit-17200-in-june-bank-nifty-positive-buy-sbi-tcs-2549565/,2022-06-06T08:47:54+05:30,2022-06-06T03:17:54,0.8402
SBI loses market share in debit card spends in FY22,https://www.financialexpress.com/business/banking-finance-sbi-loses-market-share-in-debit-card-spends-in-fy22-2548042/,2022-06-04T00:30:00+05:30,2022-06-03T19:00:00,-0.0258
SBI economists raise GDP growth forecast to 7.5% for FY23,https://www.financialexpress.com/policy/economy-sbi-economists-raise-gdp-growth-forecast-to-7-5-for-fy23-2546986/,2022-06-03T02:15:00+05:30,2022-06-02T20:45:00,0.3818
"Nifty may rise to 18400 by Mar’23, ‘growth at reasonable price’ may outperform; these large-caps may rally 44%",https://www.financialexpress.com/market/nifty-may-rise-to-18400-by-mar23-growth-at-reasonable-price-may-outperform-these-large-caps-may-rally-44-2546167/,2022-06-02T11:35:01+05:30,2022-06-02T06:05:01,0.4019
Former SBI MD Ashwani Bhatia takes charge as Sebi whole-time member,https://www.financialexpress.com/market/former-sbi-md-ashwani-bhatia-takes-charge-as-sebi-whole-time-member-2545660/,2022-06-02T03:30:00+05:30,2022-06-01T22:00:00,0.0
SBI to accelerate digital agenda in FY23: Chairman Dinesh Khara,https://www.financialexpress.com/business/banking-finance-sbi-to-accelerate-digital-agenda-in-fy23-chairman-dinesh-khara-2545676/,2022-06-02T01:55:00+05:30,2022-06-01T20:25:00,0.0
"SBI to focus on digital agenda; partner with fintech firms, NBFCs to drive growth",https://www.financialexpress.com/business/banking-finance-sbi-to-focus-on-digital-agenda-partner-with-fintech-firms-nbfcs-to-drive-growth-2545447/,2022-06-01T20:36:50+05:30,2022-06-01T15:06:50,0.3818
"Employee expenses for listed SMEs, others increased in FY22 from previous year: SBI Report",https://www.financialexpress.com/business/sme-msme-skil-employee-expenses-for-listed-smes-others-increased-in-fy22-from-previous-year-sbi-report-2541448/,2022-05-29T16:36:33+05:30,2022-05-29T11:06:33,0.2732
Public sector banks ready to end private banks’ dominance? Expect valuation re-rating; check stocks to buy,https://www.financialexpress.com/market/public-sector-banks-ready-to-end-private-banks-dominance-expect-valuation-re-rating-check-stocks-to-buy-2537102/,2022-05-25T11:45:30+05:30,2022-05-25T06:15:30,0.5106
SBI to fill up 641 posts – Here’s how you can apply,https://www.financialexpress.com/jobs-career/sbi-to-fill-up-641-posts-heres-how-you-can-apply-2535050/,2022-05-23T18:36:25+05:30,2022-05-23T13:06:25,0.0
State Bank of India rating – Buy: Bank’s placed very well competitively,https://www.financialexpress.com/market/state-bank-of-india-rating-buy-banks-placed-very-well-competitively-2526875/,2022-05-17T03:30:00+05:30,2022-05-16T22:00:00,0.3384
Operating profits of lenders see muted growth in FY22; loan growth momentum likely to be maintained,https://www.financialexpress.com/business/banking-finance-operating-profits-of-lenders-see-muted-growth-in-fy22-loan-growth-momentum-likely-to-be-maintained-2526928/,2022-05-17T01:00:00+05:30,2022-05-16T19:30:00,0.7964
"SBI share price jumps 3% after bank reports Q4 profit growth; brokerages bullish, shares may rally up to 51%",https://www.financialexpress.com/market/sbi-share-price-jumps-3-after-bank-reports-q4-profit-growth-brokerages-bullish-shares-may-rally-up-to-51-2526175/,2022-05-16T12:09:50+05:30,2022-05-16T06:39:50,0.836
Government to soon clear Banks Board Bureau recast,https://www.financialexpress.com/policy/economy-government-to-soon-clear-banks-board-bureau-recast-2525853/,2022-05-16T08:05:55+05:30,2022-05-16T02:35:55,0.3818
Modest earnings and missed estimates: SBI numbers singe BSE Bankex,https://www.financialexpress.com/market/sbi-numbers-singe-bse-bankex-2524177/,2022-05-14T06:15:00+05:30,2022-05-14T00:45:00,-0.296
NARCL to make binding offers for first tranche of accounts in two weeks: SBI MD,https://www.financialexpress.com/business/banking-finance-narcl-to-make-binding-offers-for-first-tranche-of-accounts-in-two-weeks-sbi-md-2524126/,2022-05-14T05:30:00+05:30,2022-05-14T00:00:00,0.0
"SBI’s Q4 profit rises 41% as provisions fall, core income grows",https://www.financialexpress.com/business/banking-finance-sbis-q4-profit-rises-41-as-provisions-fall-core-income-grows-2524023/,2022-05-14T01:15:00+05:30,2022-05-13T19:45:00,0.4404
"SBI reports 40% jump in net profit to Rs 9,113 crore in Q4; shares jump 3%",https://www.financialexpress.com/business/banking-finance-sbi-reports-40-jump-in-net-profit-to-rs-9113-crore-in-q4-npa-falls-2523398/,2022-05-13T14:52:52+05:30,2022-05-13T09:22:52,0.6249
"‘Indo-Russia payments now stabilised, greater due diligence causing delays’",https://www.financialexpress.com/business/banking-finance-indo-russia-payments-now-stabilised-greater-due-diligence-causing-delays-2522978/,2022-05-13T09:37:41+05:30,2022-05-13T04:07:41,0.3612
"Tata Motors, L&T, SBI, Bharti Airtel, RIL, Tech Mahindra, HAL, Future Group stocks in focus",https://www.financialexpress.com/market/stocks-to-watch-tata-motors-lt-sbi-airtel-reliance-ril-tech-mahindra-hal-future-group-stocks-in-focus-today-2522876/,2022-05-13T08:05:18+05:30,2022-05-13T02:35:18,0.0
"India-Russia payments have stabilised, greater due diligence causing delays: Ashwini Kumar Tewari, SBI managing director for international banking, technology and subsidiaries",https://www.financialexpress.com/business/banking-finance-india-russia-payments-have-stabilised-greater-due-diligence-causing-delays-ashwini-kumar-tewari-sbi-managing-director-for-international-banking-technology-and-subsidiaries-2520917/,2022-05-12T01:30:00+05:30,2022-05-11T20:00:00,0.3612
"SBI firms up ESG policy, but won’t deny loans to poor scorers right away",https://www.financialexpress.com/business/banking-finance-sbi-firms-up-esg-policy-but-wont-deny-loans-to-poor-scorers-right-away-2521280/,2022-05-12T00:55:00+05:30,2022-05-11T19:25:00,-0.8047
