headline,link,date_str,parsed_date_iso,sentiment_score
"Vodafone Idea, SBI, Adani Ports, Cipla, Wipro, Punjab National Bank stocks in focus",https://www.financialexpress.com/market/vodafone-idea-sbi-adani-ports-cipla-wipro-punjab-national-bank-stocks-in-focus-2519729/,2022-05-11T08:04:22+05:30,2022-05-11T02:34:22,0.0
SBI board approves $2-billion fundraise via bonds for FY23,https://www.financialexpress.com/market/sbi-board-approves-2-billion-fundraise-via-bonds-for-fy23-2519340/,2022-05-11T07:47:25+05:30,2022-05-11T02:17:25,0.4019
SBI board approves raising up to USD 2 bn via bonds in FY’23,https://www.financialexpress.com/market/sbi-board-approves-raising-up-to-usd-2-bn-via-bonds-in-fy23-2519361/,2022-05-10T18:32:28+05:30,2022-05-10T13:02:28,0.4019
"Nifty’s close below 16800 to be negative for D-St; Buy SBI, ITC, others to pocket gains, charts show strength",https://www.financialexpress.com/market/cafeinvest-niftys-close-below-16800-to-be-negative-for-d-st-buy-sbi-itc-others-to-pocket-gains-charts-show-strength-2512163/,2022-05-04T08:36:13+05:30,2022-05-04T03:06:13,0.2263
"4x jump in bank credit to micro, small enterprises during FY22, SBI report shows",https://www.financialexpress.com/business/sme-msme-fin-4x-jump-in-bank-credit-to-micro-small-enterprises-during-fy22-sbi-report-shows-2510913/,2022-05-02T20:42:10+05:30,2022-05-02T15:12:10,0.3818
LIC rival SBI Life reports muted annual premium growth in Q4; brokerages see over 30% upside to stock,https://www.financialexpress.com/business/industry-lic-rival-sbi-life-reports-muted-growth-in-annual-premium-in-q4-brokerages-see-over-30-upside-to-stock-2507714/,2022-04-29T14:17:32+05:30,2022-04-29T08:47:32,0.3818
"SBI alert! ATM, Credit Card, UPI and Netbanking user? Do this to not lose money",https://www.financialexpress.com/money/sbi-alert-atm-credit-card-upi-and-netbanking-user-do-this-to-not-lose-money-2502593/,2022-04-25T14:01:27+05:30,2022-04-25T08:31:27,0.7469
"SBI, BoB, Axis, Kotak Mahindra Bank customer? Lending Rates hiked. Check impact",https://www.financialexpress.com/money/bank-loan-interest-hike-mclr-rate-sbi-bob-kotak-mahindra-axis-bank-news-2500316/,2022-04-22T12:36:23+05:30,2022-04-22T07:06:23,0.0
"Nifty short-term term trend weak, fresh pullback rally possible above 17050; Buy SBI, Lupin, BPCL stocks",https://www.financialexpress.com/market/cafeinvest-nifty-short-term-term-trend-weak-fresh-pullback-rally-possible-above-17050-buy-sbi-lupin-bpcl-stocks-2497270/,2022-04-20T08:55:49+05:30,2022-04-20T03:25:49,0.2732
"Loans get costlier as banks hike MCLR: SBI raises MCLR by 10 BPs; BoB, Axis follow suit",https://www.financialexpress.com/business/banking-finance-loans-get-costlier-as-banks-hike-mclr-sbi-raises-mclr-by-10-bps-bob-axis-follow-suit-2495700/,2022-04-19T03:10:00+05:30,2022-04-18T21:40:00,0.0
SBI raises USD 500 million through IFSC Gift City branch,https://www.financialexpress.com/market/sbi-raises-usd-500-million-through-ifsc-gift-city-branch-2495043/,2022-04-18T15:10:04+05:30,2022-04-18T09:40:04,0.4404
Economists see repo rate hike in June as inflation prints close to 7%,https://www.financialexpress.com/policy/economy-economists-see-repo-rate-hike-in-june-as-inflation-prints-close-to-7-2491230/,2022-04-14T05:15:00+05:30,2022-04-13T23:45:00,0.0
Franklin Templeton case: SC directs SBI Fund not to disburse remaining Rs 534 crore till further orders,https://www.financialexpress.com/money/mutual-funds-franklin-templeton-case-sc-directs-sbi-fund-not-to-disburse-remaining-rs-534-crore-till-further-orders-2490150/,2022-04-13T09:14:54+05:30,2022-04-13T03:44:54,0.0
"SBI Life to post top-quartile growth in 2022, shares may rally 15%, says IIFL Securities; check target price",https://www.financialexpress.com/market/sbi-life-to-post-top-quartile-growth-in-2022-shares-may-rally-15-says-iifl-securities-check-target-price-2487994/,2022-04-11T15:53:24+05:30,2022-04-11T10:23:24,0.7184
Nifty needs to hold 17777 to surge to 17900-1810; Buy these two stocks for gains,https://www.financialexpress.com/market/cafeinvest-nifty-needs-to-hold-17777-to-surge-to-17900-1810-buy-these-two-stocks-for-gains-2487491/,2022-04-11T08:52:53+05:30,2022-04-11T03:22:53,0.6249
Reliance Capital Committee of Creditors to seek 3 months extension to complete bankruptcy process,https://www.financialexpress.com/business/industry-reliance-capital-committee-of-creditors-to-seek-3-months-extension-to-complete-bankruptcy-process-2483805/,2022-04-07T00:15:00+05:30,2022-04-06T18:45:00,0.0
"NARCL: Procedural delays led to non-transfer of NPAs worth Rs 50,000 crore by March 31",https://www.financialexpress.com/business/banking-finance-narcl-procedural-delays-led-to-non-transfer-of-npas-worth-rs-50000-crore-by-march-31-2483935/,2022-04-06T20:20:54+05:30,2022-04-06T14:50:54,0.2263
"Nifty Dec-end target at 20200; ICICI Bank, SBI, Bharti Airtel among top largecap stocks to buy, may rally 40%",https://www.financialexpress.com/market/nifty-dec-end-target-at-20200-icici-bank-sbi-bharti-airtel-among-top-largecap-stocks-to-buy-may-rally-40-2483348/,2022-04-06T13:05:24+05:30,2022-04-06T07:35:24,0.5423
"Nifty above 17700 would aim for 18000, Bank Nifty may hit 38000 this week; buy SBI, HDFC, SAIL to pocket gains",https://www.financialexpress.com/market/cafeinvest-nifty-above-17700-would-aim-for-18000-bank-nifty-may-hit-38000-this-week-buy-sbi-hdfc-sail-to-pocket-gains-2480622/,2022-04-04T09:23:23+05:30,2022-04-04T03:53:23,0.7783
SBI economists suggest reforms to incentivise regional rural banks,https://www.financialexpress.com/business/banking-finance-sbi-economists-suggest-reforms-to-incentivise-regional-rural-banks-2479073/,2022-04-01T17:42:30+05:30,2022-04-01T12:12:30,0.0
"Nifty support at 17000, VIX needs to slip below 20 to witness cool-off; Buy these 2 shares for gains",https://www.financialexpress.com/market/cafeinvest-nifty-support-at-17000-vix-needs-to-slip-below-20-to-witness-cool-off-buy-these-2-shares-for-gains-2473465/,2022-03-28T08:44:06+05:30,2022-03-28T03:14:06,0.8402
Banking services may be impacted partially due to nationwide strike on March 28-29,https://www.financialexpress.com/business/banking-finance-banking-services-may-be-impacted-partially-due-to-nationwide-strike-on-march-28-29-2473116/,2022-03-27T17:17:06+05:30,2022-03-27T11:47:06,-0.128
"SBI shares rise as bank ties up with 5 HFCs for affordable loans; Brokerages see 40% upside, should you buy?",https://www.financialexpress.com/market/sbi-share-price-rises-as-bank-ties-up-with-5-hfcs-for-affordable-home-loans-brokerages-see-40-upside-should-you-buy-2471588/,2022-03-25T12:37:25+05:30,2022-03-25T07:07:25,0.296
Edelweiss Housing Finance ties up with SBI for co-lending in priority sector home loans,https://www.financialexpress.com/money/edelweiss-housing-finance-ties-up-with-sbi-for-co-lending-in-priority-sector-home-loans-2471540/,2022-03-25T12:04:19+05:30,2022-03-25T06:34:19,0.0
SBI ties-up with 5 housing finance companies to further affordable loans to unserved,https://www.financialexpress.com/business/banking-finance-sbi-ties-up-with-5-housing-finance-companies-to-further-affordable-loans-to-unserved-2471051/,2022-03-24T20:05:36+05:30,2022-03-24T14:35:36,0.0
"We expect NARCL’s offers to come in this week: Swaminathan J, SBI managing director for risk, compliance and stressed assets resolution",https://www.financialexpress.com/business/banking-finance-we-expect-narcls-offers-to-come-in-this-week-swaminathan-j-sbi-managing-director-for-risk-compliance-and-stressed-assets-resolution-2467255/,2022-03-24T20:49:50+05:30,2022-03-24T15:19:50,-0.4215
Banks Board Bureau recommends Alok Choudhary for SBI MD post,https://www.financialexpress.com/business/banking-finance-banks-board-bureau-recommends-alok-choudhary-for-sbi-md-post-2463398/,2022-03-17T05:45:00+05:30,2022-03-17T00:15:00,0.2263
BBB recommends Alok Choudhary for SBI Managing Director post,https://www.financialexpress.com/business/banking-finance-bbb-recommends-alok-choudhary-for-sbi-managing-director-post-2463283/,2022-03-16T20:54:11+05:30,2022-03-16T15:24:11,0.2263
Rupee unlikely to be majorly impacted due to Russia-Ukraine war: SBI research,https://www.financialexpress.com/policy/economy-rupee-unlikely-to-be-majorly-impacted-due-to-russia-ukraine-war-sbi-research-2460871/,2022-03-14T20:35:11+05:30,2022-03-14T15:05:11,-0.5994
"SBI Chairman Dinesh Khara says digitisation, innovative technologies creating unprecedented disruption in banking sector",https://www.financialexpress.com/business/banking-finance-sbi-chairman-dinesh-khara-says-digitisation-innovative-technologies-creating-unprecedented-disruption-in-banking-sector-2458289/,2022-03-11T17:02:24+05:30,2022-03-11T11:32:24,0.3818
SBI to revamp Yono to prepare for an era of digital banks,https://www.financialexpress.com/business/banking-finance-sbi-to-revamp-yono-to-prepare-for-era-of-digital-banks-2457251/,2022-03-11T00:30:00+05:30,2022-03-10T19:00:00,0.0
IBA begins fresh search for bad bank chief with HR firm Aon’s help,https://www.financialexpress.com/business/banking-finance-iba-begins-fresh-search-for-bad-bank-chief-with-hr-firm-aons-help-2454727/,2022-03-09T06:30:00+05:30,2022-03-09T01:00:00,0.128
Nitin Chugh appointed head of SBI digital banking,https://www.financialexpress.com/business/banking-finance-nitin-chugh-appointed-head-of-sbi-digital-banking-2454742/,2022-03-09T02:02:27+05:30,2022-03-08T20:32:27,0.0
"Sensex, Nifty begin March on volatile note; ICICI Bank, SBI, Maruti Suzuki among stocks to buy",https://www.financialexpress.com/market/sensex-nifty-begin-march-on-volatile-note-icici-bank-sbi-maruti-suzuki-among-stocks-to-buy-2449735/,2022-03-03T11:54:09+05:30,2022-03-03T06:24:09,0.4019
"SBI, Mindtree among 8 stocks to buy to beat current market volatility; Nifty crucial support at 16200",https://www.financialexpress.com/market/sbi-mindtree-among-8-stocks-to-buy-to-beat-current-market-volatility-nifty-crucial-support-at-16200-2446769/,2022-02-28T14:34:49+05:30,2022-02-28T09:04:49,0.6597
"52-week highs, 52-week lows: Nykaa, BPCL, SBI Cards, IGL among 166 stocks to hit 52-week low on BSE",https://www.financialexpress.com/market/52-week-highs-52-week-lows-nykaa-bpcl-sbi-cards-igl-among-166-stocks-to-hit-52-week-low-on-bse-2441263/,2022-02-22T12:29:44+05:30,2022-02-22T06:59:44,-0.4404
How the cookie crumbled for ABG Shipyard,https://www.financialexpress.com/business/banking-finance-how-the-cookie-crumbled-for-abg-shipyard-2438425/,2022-02-19T06:30:00+05:30,2022-02-19T01:00:00,0.0
National Asset Reconstruction Company begins search for senior executives,https://www.financialexpress.com/business/narcl-begins-search-for-senior-executives-2438241/,2022-02-19T00:15:00+05:30,2022-02-18T18:45:00,0.3612
Rate hike: SBI hikes retail deposit rates for second time in 2 months,https://www.financialexpress.com/business/banking-finance-rate-hike-sbi-hikes-retail-deposit-rates-for-second-time-in-2-months-2437303/,2022-02-18T04:30:00+05:30,2022-02-17T23:00:00,0.0
India can add $20 billion to GDP if import dependence on China is halved: Report,https://www.financialexpress.com/policy/economy-india-can-add-20-billion-to-gdp-if-import-dependence-on-china-is-halved-report-2435097/,2022-02-15T21:40:33+05:30,2022-02-15T16:10:33,0.0
"Large-cap stock picks: Bharti Airtel, SBI, ICICI Bank among top bets, check target prices",https://www.financialexpress.com/market/large-cap-stock-picks-bharti-airtel-sbi-icici-bank-among-top-bets-check-target-prices-2428239/,2022-02-08T11:15:04+05:30,2022-02-08T05:45:04,0.2023
State Bank of India Rating: ‘Buy’ | Bank managed asset quality well in Q3,https://www.financialexpress.com/market/state-bank-of-india-rating-buy-bank-managed-asset-quality-well-in-q3-2428010/,2022-02-08T04:30:00+05:30,2022-02-07T23:00:00,0.5574
NCLT admits SBI’s insolvency plea against Coastal Energen,https://www.financialexpress.com/business/industry-nclt-admits-sbis-insolvency-plea-against-coastal-energen-2427878/,2022-02-08T00:15:00+05:30,2022-02-07T18:45:00,0.296
Planning Fixed Deposit? SBI Research says interest rate increase possible. Here’s when,https://www.financialexpress.com/money/sbi-research-fixed-deposit-interest-rate-2427545/,2022-02-07T15:10:12+05:30,2022-02-07T09:40:12,0.6486
"52-week highs, 52-week lows: SBI, Bank of Baroda among 226 stocks hit new highs on BSE; 15 shares at new lows",https://www.financialexpress.com/market/52-week-high-52-week-low-stocks-bse-nse-sensex-nifty-stock-markets-7-feb-2022-monday-sbi-bank-of-baroda-hdfc-infosys-icici-bank-2427470/,2022-02-07T13:33:48+05:30,2022-02-07T08:03:48,-0.1027
"SBI share price hits new 52-week high post Q3 results; brokerages say ‘buy’, see nearly 40% rally",https://www.financialexpress.com/market/sbi-share-price-hits-new-52-week-high-post-q3-results-brokerages-say-buy-see-nearly-40-rally-2427359/,2022-02-07T11:46:30+05:30,2022-02-07T06:16:30,0.296
SBI lines up 6 NPA accounts for sale to ARCs to recover dues of Rs 406 cr,https://www.financialexpress.com/business/banking-finance-sbi-lines-up-6-npa-accounts-for-sale-to-arcs-to-recover-dues-of-rs-406-cr-2426841/,2022-02-06T14:39:03+05:30,2022-02-06T09:09:03,0.0
"SBI Q3 profit jumps 62% to Rs 8,432 crore on lower provisions",https://www.financialexpress.com/business/banking-finance-sbi-q3-net-profit-surges-62-to-rs-8432-cr-2426449/,2022-02-05T17:40:41+05:30,2022-02-05T12:10:41,0.1779
"52-week highs, 52-week lows: SBI, Dhampur Sugar among 150 stocks to hit new highs on BSE; 4 shares at new lows",https://www.financialexpress.com/market/52-week-high-52-week-low-stocks-bse-nse-sensex-nifty-stock-markets-4-feb-2022-friday-sbi-dhampur-sugar-reliance-hdfc-tcs-2425696/,2022-02-04T12:51:05+05:30,2022-02-04T07:21:05,-0.1027
Home Loan: Is this an ideal time to opt for a balance transfer?,https://www.financialexpress.com/money/home-loan-is-this-an-ideal-time-to-opt-for-a-balance-transfer-2418813/,2022-01-28T19:23:41+05:30,2022-01-28T13:53:41,0.5267
Tata Group to get loans from SBI-led consortium for Air India,https://www.financialexpress.com/business/industry-tatas-get-loan-commitment-for-air-india-2417334/,2022-01-27T19:48:47+05:30,2022-01-27T14:18:47,0.0
State Bank of India share price up 2% after Tatas get loan commitment for Air India from SBI-led consortium,https://www.financialexpress.com/market/state-bank-of-india-share-price-up-2-after-tatas-get-loan-commitment-for-air-india-from-sbi-led-consortium-2417281/,2022-01-27T15:34:26+05:30,2022-01-27T10:04:26,0.5859
Need of the hour: Social media an absolute must for banks,https://www.financialexpress.com/business/banking-finance-need-of-the-hour-social-media-an-absolute-must-for-banks-2416559/,2022-01-27T00:15:00+05:30,2022-01-26T18:45:00,0.0
"52-week high, 52-week low: Paytm, SBI Cards among shares to hit 52-week lows on BSE, 213 stocks at new highs",https://www.financialexpress.com/market/52-week-high-52-week-low-paytm-sbi-cards-among-shares-to-hit-52-week-lows-on-bse-213-stocks-at-new-highs-2415240/,2022-01-25T12:06:17+05:30,2022-01-25T06:36:17,-0.1779
"Nifty may head to 17850 if it remains below 18000; watch Tata Motors, SBI, others for stock-specific action",https://www.financialexpress.com/market/cafeinvest-nifty-may-head-to-17850-if-it-remains-below-18000-watch-tata-motors-sbi-others-for-stock-specific-action-2411104/,2022-01-20T09:03:05+05:30,2022-01-20T03:33:05,0.4019
"Buy State Bank of India shares for up to 32% rally, brokerages expect robust earnings growth",https://www.financialexpress.com/market/state-bank-of-india-share-price-update-results-preview-nifty-bank-sbi-stock-update-2404592/,2022-01-12T13:13:02+05:30,2022-01-12T07:43:02,0.7351
7 factors to keep in mind to get the best vehicle loan interest rates,https://www.financialexpress.com/money/7-factors-to-keep-in-mind-to-get-the-best-vehicle-loan-interest-rates-2402861/,2022-01-10T17:02:23+05:30,2022-01-10T11:32:23,0.802
"Nifty to hit 18200 in coming weeks, strong buying in Bank Nifty at 36500; Reliance, SBI top money making bets",https://www.financialexpress.com/market/cafeinvest-nifty-to-hit-18200-in-coming-weeks-strong-buying-in-bank-nifty-at-36500-reliance-sbi-top-money-making-bets-2402409/,2022-01-10T09:20:52+05:30,2022-01-10T03:50:52,0.8591
"Bank stocks to buy: ICICI Bank, Axis Bank, HDFC Bank shares may rally up to 23%; check target prices",https://www.financialexpress.com/market/bank-stocks-to-buy-icici-bank-axis-bank-hdfc-bank-shares-may-rally-over-21-check-target-prices-sbi-state-bank-if-india-2400870/,2022-01-07T15:01:09+05:30,2022-01-07T09:31:09,0.296
"Nifty likely to gain 15%, Dec target at 20200: ICICI Bank, SBI, Maruti, Bata, other stocks may rally up to 42%",https://www.financialexpress.com/market/nifty-likely-to-gain-15-dec-target-at-20200-icici-bank-sbi-maruti-bata-other-stocks-may-rally-up-to-42-2398872/,2022-01-05T13:16:51+05:30,2022-01-05T07:46:51,0.7269
SBI invests $20 million in this payments provider ahead of $100-million IPO,https://www.financialexpress.com/market/ipo-news-sbi-invests-20-million-in-this-payments-provider-ahead-of-100-million-ipo-2398717/,2022-01-05T11:53:49+05:30,2022-01-05T06:23:49,0.0
"SBI, CMS Info Systems, IndiGo, RBL Bank, PB Fintech among stocks in focus today",https://www.financialexpress.com/market/sbi-cms-info-systems-indigo-rbl-bank-pb-fintech-among-stocks-in-focus-today/2394897/,2021-12-31T08:03:29+05:30,2021-12-31T02:33:29,0.0
"Reliance Industries, RBL Bank, HP Adhesives, SBI Cards among stocks in focus today",https://www.financialexpress.com/market/reliance-industries-rbl-bank-hp-adhesives-sbi-cards-among-stocks-in-focus-today-2390434/,2021-12-27T08:18:43+05:30,2021-12-27T02:48:43,0.0
"India needs $1 trillion more in loans to become $5-trillion economy, says SBI Chairman Khara",https://www.financialexpress.com/business/banking-finance-india-needs-1-trillion-more-in-loans-to-become-5-trillion-economy-says-sbi-chairman-khara-2388158/,2021-12-23T17:06:40+05:30,2021-12-23T11:36:40,0.0
"SBI, Tech Mahindra, Zee, Gail shares among HDFC Securities top stock picks for 2022",https://www.financialexpress.com/market/sbi-tech-mahindra-zee-gail-shares-among-hdfc-securities-top-stock-picks-for-2022-2388076/,2021-12-23T16:04:04+05:30,2021-12-23T10:34:04,0.6369
Planning to take a car loan in new year? Find out if you should opt for a shorter or longer tenure,https://www.financialexpress.com/money/planning-to-take-a-car-loan-in-new-year-find-out-if-you-should-opt-for-a-shorter-or-longer-tenure-2388037/,2021-12-23T15:55:33+05:30,2021-12-23T10:25:33,0.0
SBI plans to list mutual fund arm in 2022,https://www.financialexpress.com/market/ipo-news-sbi-plans-to-list-mutual-fund-arm-in-2022-2380859/,2021-12-16T00:15:00+05:30,2021-12-15T18:45:00,0.0
State Bank of India looking to offload 6% stake in JV mutual fund arm via IPO route,https://www.financialexpress.com/market/ipo-news-state-bank-of-india-looking-to-offload-6-stake-in-jv-mutual-fund-arm-via-ipo-route-2380523/,2021-12-15T14:17:37+05:30,2021-12-15T08:47:37,0.0
"Sensex, Nifty may give double-digit returns after recent correction; check top stock picks by ICICI Securities",https://www.financialexpress.com/market/nifty-sensex-return-expectations-target-price-stock-market-correction-icici-securities-sbi-hdfc-infosys-tata-motors-top-stock-picks-2377138/,2021-12-06T12:10:39+05:30,2021-12-06T06:40:39,0.6908
"Paytm, Reliance Industries, Vedanta, State Bank of India among stocks in focus today",https://www.financialexpress.com/market/stocks-to-watch-today-paytm-shares-reliance-industries-state-bank-of-india-anil-agarwal-vedanta-punjab-national-bank-maruti-suzuki-2372200/,2021-11-22T08:29:18+05:30,2021-11-22T02:59:18,0.0
"Charts show Nifty to retest 18600 by Dec-end, Bank Nifty to trade in 38200-40000 range; Reliance, SBI top bets",https://www.financialexpress.com/market/cafeinvest-charts-show-nifty-to-retest-18600-by-dec-end-bank-nifty-to-trade-in-38200-40000-range-reliance-sbi-top-bets-2369265/,2021-11-15T09:33:04+05:30,2021-11-15T04:03:04,0.7351
"52-week highs, 52-week lows: L&T, SBI among 191 stock to hit new highs on BSE; 15 shares at new lows",https://www.financialexpress.com/market/52-week-high-52-week-low-stocks-bse-nse-sensex-nifty-stock-markets-3-nov-2021-wednesday-sbi-larsen-toubro-2362586/,2021-11-03T14:37:45+05:30,2021-11-03T09:07:45,-0.1027
"Bharti Airtel, SBI, Eicher Motors, Bank of India, Union Bank, Dabur India, HPCL stocks in focus",https://www.financialexpress.com/market/bharti-airtel-sbi-eicher-motors-bank-of-india-union-bank-dabur-india-hpcl-stocks-in-focus-2362300/,2021-11-03T08:39:16+05:30,2021-11-03T03:09:16,0.0
"NSE volume toppers: Tata Power, Vodafone-Idea among highest traded stocks; Tata Motors value topper",https://www.financialexpress.com/market/nse-volume-toppers-tata-power-vodafone-idea-among-highest-traded-stocks-tata-motors-value-topper-2361851/,2021-11-02T15:03:09+05:30,2021-11-02T09:33:09,0.34
Good news for pensioners! SBI allows Life Certificate (Jeevan Pramaan) submission through video call,https://www.financialexpress.com/money/sbi-video-life-certificate-jeevan-praman-submission-process-vlc-through-video-call-details-2361207/,2021-11-01T17:14:39+05:30,2021-11-01T11:44:39,0.4926
"Samvat 2078: Economic cycle revival, lower interest rate to drive stock market; buy TCS, SBI, HDFC Bank",https://www.financialexpress.com/market/cafeinvest-samvat-2078-economic-cycle-revival-lower-interest-rate-to-drive-stock-market-buy-tcs-sbi-hdfc-bank-2360882/,2021-11-01T10:42:51+05:30,2021-11-01T05:12:51,0.2023
"NSE volume toppers: Vodafone-Idea, PNB among highest traded stocks; IRCTC, Tata Power value toppers",https://www.financialexpress.com/market/nse-volume-toppers-vodafone-idea-pnb-among-highest-traded-stocks-irctc-tata-power-value-toppers-2359248/,2021-10-29T11:54:34+05:30,2021-10-29T06:24:34,0.34
Now Google Pay users can buy SBI Arogya Sanjeevani health insurance plan for self and family on the go,https://www.financialexpress.com/money/insurance-now-google-pay-users-can-buy-sbi-arogya-sanjeevani-health-insurance-plan-for-self-and-family-on-the-go-2358368/,2021-10-28T10:08:50+05:30,2021-10-28T04:38:50,-0.1027
"Nifty needs to hold 18150 for up-move, Bank Nifty support at 40500; watch these stocks for action",https://www.financialexpress.com/market/cafeinvest-nifty-needs-to-hold-18150-for-up-move-bank-nifty-support-at-40500-watch-these-stocks-for-action-2358294/,2021-10-28T08:37:09+05:30,2021-10-28T03:07:09,0.7964
"Kotak Mahindra Bank, SBI, HDFC among 151 stocks to hit 52-week highs on BSE; 21 shares at new 52-week lows",https://www.financialexpress.com/market/52-week-high-52-week-low-stocks-bse-nse-sensex-nifty-stock-markets-27-oct-2021-wednesday-sbi-state-bank-of-india-kotak-mahindra-bank-hdfc-2357724/,2021-10-27T12:30:04+05:30,2021-10-27T07:00:04,0.1027
"SBI, Tata Steel among top 4 technical stocks to buy; Nifty pull-back rally may continue up to 18450",https://www.financialexpress.com/market/cafeinvest-sbi-tata-steel-among-top-4-technical-stocks-to-buy-nifty-pull-back-rally-may-continue-up-to-18450-2357528/,2021-10-27T08:20:55+05:30,2021-10-27T02:50:55,0.5423
"ICICI Bank, SBI, Axis Bank shares hit new-52-week highs on BSE; 42 stocks at 52-week lows",https://www.financialexpress.com/market/52-week-high-52-week-low-stocks-bse-nse-sensex-nifty-stock-markets-25-oct-2021-monday-icici-bank-axis-bank-sbi-2356438/,2021-10-25T14:39:35+05:30,2021-10-25T09:09:35,0.1027
"Banking, housing cycle shares to buy: Jefferies says these stocks may gain from massive 6-way economic upcycle",https://www.financialexpress.com/market/banking-housing-cycle-shares-to-buy-jefferies-says-these-stocks-may-gain-from-massive-6-way-economic-upcycle-2352371/,2021-10-19T15:38:23+05:30,2021-10-19T10:08:23,0.6808
"SBI, Vodafone Idea, Sterlite Power, Coal India, HUL, Nestle, Tata Steel stocks in focus",https://www.financialexpress.com/market/sbi-vodafone-idea-sterlite-power-coal-india-hul-nestle-tata-steel-stocks-in-focus-2352012/,2021-10-19T08:09:28+05:30,2021-10-19T02:39:28,0.0
"HDFC Bank, ITC, SBI, IRCTC among 324 stocks to hit 52-week highs on BSE; 21 shares hit 52-week lows",https://www.financialexpress.com/market/52-week-high-52-week-low-stocks-bse-nse-sensex-nifty-stock-markets-14-oct-2021-thursday-hdfc-bank-itc-sbi-irctc-sun-pharma-2349814/,2021-10-14T14:29:54+05:30,2021-10-14T08:59:54,0.1027
"Titan, Power Grid, SBI among 347 stocks to hit 52-week highs on BSE; 19 shares hit 52-week lows",https://www.financialexpress.com/market/52-week-high-52-week-low-stocks-bse-nse-sensex-nifty-stock-markets-13-oct-2021-wednesday-titan-power-grid-sbi-tata-motors-tata-power-dmart-2349231/,2021-10-13T14:33:23+05:30,2021-10-13T09:03:23,0.1027
"SBI, Titan, Sun Pharma among 286 stocks to hit 52-week highs on BSE even as Sensex, Nifty fall",https://www.financialexpress.com/market/52-week-high-52-week-low-stocks-bse-nse-sensex-nifty-stock-markets-12-oct-2021-tuesday-sbi-titan-sun-pharma-delta-corp-dmart-2348507/,2021-10-12T12:39:07+05:30,2021-10-12T07:09:07,0.4019
"RIL, SBI, Infosys, Bharti Airtel, Nazara Tech, Zee Entertainment, Tata Steel, Titan, textile stocks in focus",https://www.financialexpress.com/market/ril-sbi-infosys-bharti-airtel-nazara-tech-zee-entertainment-tata-steel-titan-textile-stocks-in-focus-2345354/,2021-10-07T08:15:23+05:30,2021-10-07T02:45:23,0.4215
"Bharti Airtel, RIL, Vodafone idea, SBI, ZEEL, Srei Infra Finance, Cadila Healthcare stocks in focus",https://www.financialexpress.com/market/bharti-airtel-ril-vodafone-idea-sbi-zeel-srei-infra-finance-cadila-healthcare-stocks-in-focus-2344637/,2021-10-06T08:48:05+05:30,2021-10-06T03:18:05,0.0
"Nifty needs to hold above 17700 to scale 18000 mark; watch out for NTPC, SBI, DLF, India Oil stocks",https://www.financialexpress.com/market/cafeinvest-nifty-needs-to-hold-above-17700-to-scale-18000-mark-watch-out-for-ntpc-sbi-dlf-india-oil-stocks-2340811/,2021-09-30T08:58:00+05:30,2021-09-30T03:28:00,0.4019
