headline,link,date_str,parsed_date_iso,sentiment_score
"IndusInd Bank Q1FY24 profit surges 30.2% at Rs 2124.50 crore, loan book quality stable",https://www.financialexpress.com/business/industry-indusind-bank-q1fy24-profit-surges-30-2-at-rs-212450-crore-loan-book-quality-stable-3176924/,2023-07-18T19:23:47+05:30,2023-07-18T13:53:47,0.6249
IndusInd promoter to up bank stake to 26%,https://www.financialexpress.com/business/banking-finance-indusind-promoter-to-up-bank-stake-to-26-3154051/,2023-07-04T03:30:00+05:30,2023-07-03T22:00:00,0.0
IndusInd to launch digital bank in Q1: MD Sumant Kathpalia,https://www.financialexpress.com/business/banking-finance-indusind-to-launch-digital-bank-in-q1-md-sumant-kathpalia-3061156/,2023-04-25T08:52:59+05:30,2023-04-25T03:22:59,0.0
IndusInd Bank Q4FY23 net profit jumps 49.9% to Rs 2040.5 crore; dividend bonanza for shareholders,https://www.financialexpress.com/market/indusind-bank-q4fy23-net-profit-jumps-49-9-to-rs-20405-crore-dividend-bonanza-for-shareholders-3060273/,2023-04-24T15:12:04+05:30,2023-04-24T09:42:04,0.4404
IndusInd Bank signs $100-million loan pact with JBIC,https://www.financialexpress.com/business/banking-finance-indusind-bank-signs-100-million-loan-pact-with-jbic-3054520/,2023-04-20T01:00:00+05:30,2023-04-19T19:30:00,0.0
"JICA, Citi to provide USD 125 million to IndusInd Bank for onlending to agri sector",https://www.financialexpress.com/business/banking-finance-jica-citi-to-provide-usd-125-million-to-indusind-bank-for-onlending-to-agri-sector-3042259/,2023-04-11T15:03:53+05:30,2023-04-11T09:33:53,0.0
"Zee Entertainment, IndusInd Bank settle loan default dispute",https://www.financialexpress.com/business/industry-zee-entertainment-indusind-bank-settle-loan-default-dispute-3025818/,2023-03-29T14:48:14+05:30,2023-03-29T09:18:14,0.0258
Analysts shrug off IndusInd Bank MD tenure worries,https://www.financialexpress.com/business/banking-finance-analysts-shrug-off-indusind-bank-md-tenure-worries-3008071/,2023-03-14T02:30:00+05:30,2023-03-13T21:00:00,-0.4215
IndusInd Bank net profit up 69% on lower provisions,https://www.financialexpress.com/business/banking-finance-indusind-bank-net-profit-up-69-on-lower-provisions-2952822/,2023-01-19T01:00:00+05:30,2023-01-18T19:30:00,0.1779
"ITC, ICICI Lombard, Glenmark Pharma, Tata Metaliks, Delta Corp, RVNL, IndusInd Bank stocks in focus",https://www.financialexpress.com/market/stocks-to-watch-itc-icici-lombard-glenmark-pharma-tata-metaliks-delta-corp-rvnl-indusind-bank-stocks-in-focus-2951587/,2023-01-18T08:16:42+05:30,2023-01-18T02:46:42,0.0
"Collect Avios points of British Airways, Qatar Airways with IndusInd Credit Card soon – Details",https://www.financialexpress.com/money/collect-avios-points-british-airways-qatar-airways-with-indusind-credit-card-details-2937431/,2023-01-05T13:03:33+05:30,2023-01-05T07:33:33,0.3818
"Tata Motors, IndusInd Bank partner to offer EV dealer financing",https://www.financialexpress.com/business/express-mobility-tata-motors-indusind-bank-partner-to-offer-ev-dealer-financing-2895319/,2022-11-29T11:04:16+05:30,2022-11-29T05:34:16,0.0
Kinetic Green collaborates with IndusInd Bank for EV financing schemes,https://www.financialexpress.com/business/express-mobility-kinetic-green-collaborates-with-indusind-bank-for-ev-financing-schemes-2753879/,2022-10-28T15:54:58+05:30,2022-10-28T10:24:58,0.0
Private banks’ profitability soars in Q2 on favourable lending rates,https://www.financialexpress.com/business/banking-finance-private-banks-profitability-soars-in-q2-on-favourable-lending-rates-2743187/,2022-10-26T01:35:00+05:30,2022-10-25T20:05:00,0.2732
IndusInd Bank profit soars 60% on lower provisioning,https://www.financialexpress.com/business/banking-finance-indusind-bank-profit-soars-60-on-lower-provisioning-2721662/,2022-10-20T03:00:00+05:30,2022-10-19T21:30:00,0.1779
"Buy ITC, IndusInd Bank, HDFC Life stocks for short-term gains; chart show market short-term trend positive",https://www.financialexpress.com/market/cafeinvest-buy-itc-indusind-bank-hdfc-life-stocks-for-short-term-gains-chart-show-market-short-term-trend-positive-2718924/,2022-10-19T08:25:21+05:30,2022-10-19T02:55:21,0.7184
Sell these two stocks to pocket near-term gains; Nifty resistance placed at 17038-17176,https://www.financialexpress.com/market/cafeinvest-sell-these-two-stocks-to-pocket-near-term-gains-nifty-resistance-placed-at-17038-17176-2695054/,2022-09-29T12:37:33+05:30,2022-09-29T07:07:33,0.6249
"IndusInd Bank share price rallies 27% in a month, outperforms Nifty; analysts bullish, see 39% further jump",https://www.financialexpress.com/market/indusind-bank-share-price-rallies-27-in-a-month-outperforms-nifty-analysts-bullish-see-39-further-jump-2610499/,2022-07-29T12:14:21+05:30,2022-07-29T06:44:21,0.5994
"‘Buy’ on IndusInd with price target of Rs 1,250",https://www.financialexpress.com/market/buy-on-indusind-with-price-target-of-rs-1250-2602283/,2022-07-22T09:19:57+05:30,2022-07-22T03:49:57,0.0
"IndusInd Bank share price jumps 5% after lender’s Q1 net profit jumps 60%; should you buy, hold or sell?",https://www.financialexpress.com/market/indusind-bank-share-price-jumps-5-after-lenders-q1-net-profit-jumps-60-should-you-buy-hold-or-sell-2601156/,2022-07-21T16:03:36+05:30,2022-07-21T10:33:36,0.6249
"IndusInd Bank Q1FY23 profit up 61% on lower provisions, higher income",https://www.financialexpress.com/business/banking-finance-indusind-bank-q1fy23-profit-up-61-on-lower-provisions-higher-income-2600507/,2022-07-21T00:00:00+05:30,2022-07-20T18:30:00,0.1779
"IndusInd Bank net profit jumps 61 pc to Rs 1,631 crore in June quarter",https://www.financialexpress.com/business/industry-indusind-bank-net-profit-jumps-61-pc-to-rs-1631-crore-in-june-quarter-2600461/,2022-07-20T17:11:56+05:30,2022-07-20T11:41:56,0.4404
"IndusInd Bank approves raising Rs 20,000 crore",https://www.financialexpress.com/business/banking-finance-indusind-bank-approves-raising-rs-20000-crore-2598103/,2022-07-19T02:45:00+05:30,2022-07-18T21:15:00,0.4019
IndusInd to take action against staff if found guilty in remittance case; ED files FIR against some employees,https://www.financialexpress.com/business/banking-finance-indusind-to-take-action-against-staff-if-found-guilty-in-remittance-case-ed-files-fir-against-some-employees-2593183/,2022-07-14T01:45:00+05:30,2022-07-13T20:15:00,-0.4215
"Banking, Financial Services, and Insurance sector — Q1FY23 preview: Earnings to be boosted by low base",https://www.financialexpress.com/market/banking-financial-services-and-insurance-sector-q1fy23-preview-earnings-to-be-boosted-by-low-base-2589372/,2022-07-11T02:30:00+05:30,2022-07-10T21:00:00,0.1027
"RBI slaps Rs 1-crore penalty each on KMB, IndusInd",https://www.financialexpress.com/business/banking-finance-rbi-slaps-rs-1-crore-penalty-each-on-kmb-indusind-2582655/,2022-07-05T01:15:00+05:30,2022-07-04T19:45:00,-0.4588
"RBI imposes penalty on Kotak Mahindra Bank, IndusInd Bank",https://www.financialexpress.com/business/banking-finance-rbi-imposes-penalty-on-kotak-mahindra-bank-indusind-bank-2582514/,2022-07-04T18:28:33+05:30,2022-07-04T12:58:33,-0.5267
"IndusInd Bank share price jumps 3% on strong Q1 performance; analysts bullish, see up to 61% further rally",https://www.financialexpress.com/market/indusind-bank-share-price-jumps-3-on-strong-q1-performance-analysts-bullish-see-up-to-61-further-rally-2582160/,2022-07-04T14:57:10+05:30,2022-07-04T09:27:10,0.6705
Piramal Enterprises seeks further extension of June 20 deadline,https://www.financialexpress.com/business/industry-piramal-enterprises-seeks-further-extension-of-june-20-deadline-2553454/,2022-06-09T02:00:00+05:30,2022-06-08T20:30:00,0.0
IndusInd Bank invokes 14.6 million pledged shares of Birla Tyres,https://www.financialexpress.com/business/industry-indusind-bank-invokes-14-6-million-pledged-shares-of-birla-tyres-2528672/,2022-05-18T05:45:00+05:30,2022-05-18T00:15:00,0.296
"CLSA bullish on IndusInd Bank, Wipro, Star Health stocks, says sell Maruti Suzuki; check target prices",https://www.financialexpress.com/market/clsa-bullish-on-indusind-bank-wipro-star-health-stocks-says-sell-maruti-suzuki-check-target-prices-2512635/,2022-05-04T14:50:03+05:30,2022-05-04T09:20:03,0.0
"IndusInd Bank share price soars 4% post robust Q4 results; should you buy, hold or sell? What analysts say",https://www.financialexpress.com/market/indusind-bank-share-price-soars-4-post-robust-q4-results-should-you-buy-hold-or-sell-what-analysts-say-2509986/,2022-05-02T10:24:58+05:30,2022-05-02T04:54:58,0.5574
"IndusInd profit zooms 51% on higher income, lower provisions",https://www.financialexpress.com/business/banking-finance-indusind-profit-zooms-51-on-higher-income-lower-provisions-2508310/,2022-04-30T00:57:56+05:30,2022-04-29T19:27:56,0.1779
IndusInd’s sale of Future loans to Edelweiss ARC falls through,https://www.financialexpress.com/business/banking-finance-indusinds-sale-of-future-loans-to-edelweiss-arc-falls-through-2502081/,2022-04-25T02:20:00+05:30,2022-04-24T20:50:00,0.0
Examine PIL against fit and proper status accorded to IndusInd Bank promoters: HC tells RBI,https://www.financialexpress.com/business/banking-finance-examine-pil-against-fit-and-proper-status-accorded-to-indusind-bank-promoters-hc-tells-rbi-2488336/,2022-04-11T19:27:19+05:30,2022-04-11T13:57:19,0.3612
"Stock pick of the week: IndusInd Bank shares rise 1%; Edelweiss Broking bullish, stock may rally 11%",https://www.financialexpress.com/market/stock-pick-of-the-week-indusind-bank-shares-rise-1-edelweiss-broking-bullish-stock-may-rally-11-2487818/,2022-04-11T12:40:44+05:30,2022-04-11T07:10:44,0.296
"FE Best Banks | On deposits, we’ve done ourselves proud: Sumant Kathpalia, MD and CEO, IndusInd Bank",https://www.financialexpress.com/business/banking-finance-fe-best-banks-on-deposits-weve-done-ourselves-proud-sumant-kathpalia-md-and-ceo-indusind-bank-2482749/,2022-04-06T01:15:00+05:30,2022-04-05T19:45:00,0.8074
"Stocks to buy: Charts flashing ‘Buy’ signal for these 2 shares, ICICI Direct sees 16-18% returns in 3 months",https://www.financialexpress.com/market/nifty-stocks-to-buy-indusind-bank-navin-fluorine-share-upside-potential-seen-2467850/,2022-03-22T14:05:51+05:30,2022-03-22T08:35:51,0.296
IndusInd Bank to probe staff role in ‘tech glitch’ at micro credit arm,https://www.financialexpress.com/business/banking-finance-indusind-bank-to-probe-staff-role-in-tech-glitch-at-micro-credit-arm-2455365/,2022-03-10T00:30:00+05:30,2022-03-09T19:00:00,0.3818
Micro loans sans customer consent due to tech glitch; panel to assess accountability: IndusInd Bank,https://www.financialexpress.com/money/micro-loans-sans-customer-consent-due-to-tech-glitch-panel-to-assess-accountability-indusind-bank-2455026/,2022-03-09T11:40:19+05:30,2022-03-09T06:10:19,0.2263
Dish TV shareholders snub all three AGM resolutions; results declared after SEBI diktat,https://www.financialexpress.com/business/industry-dish-tv-shareholders-snub-all-three-agm-resolutions-results-declared-after-sebi-diktat-2454715/,2022-03-09T03:44:00+05:30,2022-03-08T22:14:00,-0.4215
Zee Entertainment moves NCLT seeking dismissal of IndusInd Bank petition,https://www.financialexpress.com/business/industry-zee-entertainment-moves-nclt-seeking-dismissal-of-indusind-bank-petition-2442045/,2022-02-23T01:36:57+05:30,2022-02-22T20:06:57,0.4215
"Stocks soar ahead of Budget, Sensex spurts 814 points",https://www.financialexpress.com/market/stocks-soar-ahead-of-budget-sensex-spurts-814-points-2421466/,2022-02-01T01:15:00+05:30,2022-01-31T19:45:00,0.0
"IndusInd share price falls 3.5% despite stellar Q3 results; should you buy, hold or sell? What analysts say",https://www.financialexpress.com/market/indusind-share-price-falls-3-5-despite-stellar-q3-results-should-you-buy-hold-or-sell-what-analysts-say-2420964/,2022-01-31T15:52:49+05:30,2022-01-31T10:22:49,0.296
"IndusInd Bank posts 50% rise in Q3 net profit at Rs 1,241 crore",https://www.financialexpress.com/business/banking-finance-indusind-bank-posts-50-rise-in-q3-net-profit-at-rs-1241-crore-2419341/,2022-01-29T15:31:21+05:30,2022-01-29T10:01:21,0.4404
RBI allows LIC to double its holding in IndusInd Bank,https://www.financialexpress.com/business/banking-finance-rbi-allows-lic-to-double-its-holding-in-indusind-bank-2378774/,2021-12-10T11:26:06+05:30,2021-12-10T05:56:06,0.0
"52-week highs, 52-week lows: IndusInd Bank among 147 stock to hit new highs on BSE; 24 shares at new lows",https://www.financialexpress.com/market/52-week-high-52-week-low-stocks-bse-nse-sensex-nifty-stock-markets-28-oct-2021-thursday-indusind-bank-abb-jubilant-united-spirits-2358518/,2021-10-28T13:04:54+05:30,2021-10-28T07:34:54,-0.1027
"Stocks to buy: Nifty eyes 17500; SBI, IndusInd Bank, Motherson Sumi, others show strong uptrend in near-term",https://www.financialexpress.com/market/cafeinvest-stocks-to-buy-nifty-eyes-17500-sbi-indusind-bank-motherson-sumi-others-show-strong-uptrend-in-near-term-2330410/,2021-09-15T08:40:37+05:30,2021-09-15T03:10:37,0.7184
"Promoter pledged shareholding continues to fall; Adani Ports, Sun Pharma promoters trim pledges",https://www.financialexpress.com/market/promoter-pledged-shareholding-continues-to-fall-adani-ports-sun-pharma-promoters-trim-pledges-2309384/,2021-08-12T12:41:22+05:30,2021-08-12T07:11:22,0.0
"Stocks to buy: Nifty may hit 16,050, Bank Nifty 35,700 in near-term; charts show HDFC Life, others may rally",https://www.financialexpress.com/market/cafeinvest-stocks-to-buy-nifty-may-hit-16050-bank-nifty-35700-in-near-term-charts-show-hdfc-life-others-may-rally-2272155/,2021-06-16T08:59:04+05:30,2021-06-16T03:29:04,0.6597
FIIs raise stake in two-thirds of Nifty 50 stocks in Jan-Mar; DIIs sell in 62% firms,https://www.financialexpress.com/market/fiis-raise-stake-in-two-thirds-of-nifty-50-stocks-in-jan-mar-diis-sell-in-62pc-firms-2250633/,2021-05-12T16:42:59+05:30,2021-05-12T11:12:59,0.4019
Private banks’ net advances grow in March quarter,https://www.financialexpress.com/business/banking-finance-private-banks-net-advances-grow-in-march-quarter-2227559/,2021-04-06T01:15:20+05:30,2021-04-05T19:45:20,0.0
"Banks put up Rs 5,140 crore of NPAs for sale in Q4FY21",https://www.financialexpress.com/business/banking-finance-banks-put-up-rs-5140-crore-of-npas-for-sale-in-q4fy21-2214143/,2021-03-17T05:00:06+05:30,2021-03-16T23:30:06,0.0
IDEMIA to design Indusind Bank’s first metal credit card – Check features,https://www.financialexpress.com/money/idemia-to-design-indusind-banks-first-metal-credit-card-check-features-2167094/,2021-01-08T16:22:01+05:30,2021-01-08T10:52:01,0.3818
"Private sector banks report healthy deposit accretions, sluggish advances growth in Q3",https://www.financialexpress.com/business/banking-finance-private-banks-report-healthy-deposit-accretions-sluggish-advances-growth-in-q3-bandhan-bank-indusind-bank-idfc-first-bank-yes-bank-2165819/,2021-01-06T20:29:30+05:30,2021-01-06T14:59:30,0.3818
"Stocks in focus: HDFC Bank, HDFC, IndiGo, Tata Steel, Bajaj Finance, IndusInd Bank",https://www.financialexpress.com/market/hdfc-bank-indigo-tata-steel-bajaj-finance-indusind-bank-stocks-in-focus-nifty-futures-housing-development-finance-corporation-2165201/,2021-01-06T08:43:03+05:30,2021-01-06T03:13:03,0.0
"IndusInd Bank shares jump over 4% on takeover news by Kotak Bank; promoters deny, call baseless",https://www.financialexpress.com/market/indusind-bank-shares-jump-over-4-on-takeover-news-by-kotak-bank-promoters-deny-call-baseless-2113838/,2020-10-26T11:12:38+05:30,2020-10-26T05:42:38,-0.0516
"Stocks in focus: Coal India, IndusInd Bank, Jindal Steel, LIC Housing Finance, DHFL, Ashok Leyland",https://www.financialexpress.com/market/coal-india-dhfl-ashok-leyland-jindal-steel-and-power-lic-housing-finance-page-industries-jubilant-industries-stocks-in-focus/2073403/,2020-09-03T09:04:11+05:30,2020-09-03T03:34:11,0.0
"Nifty fails to hold 10,200, Sensex erases morning gains; check what kept investors on edge today",https://www.financialexpress.com/market/nifty-fails-to-hold-10200-sensex-erases-morning-gains-check-what-kept-investors-on-edge-today/1984910/,2020-06-08T16:20:18+05:30,2020-06-08T10:50:18,0.3182
"Stocks in focus: RIL, IndusInd Bank, Titan, IOCL, L&T, among others to remain in news",https://www.financialexpress.com/market/ril-indusind-bank-titan-iocl-pvr-inox-leisure-hpcl-bpcl-reliance-industries-stocks-in-focus-vedanta-titan-company-sgx-nifty-q4-earnings-1984425/,2020-06-08T09:13:58+05:30,2020-06-08T03:43:58,0.0
