headline,link,date_str,parsed_date_iso,sentiment_score
"Dabur gets High Court notice over its Schezwan Chutney, Tata alleges firm misleading customers",https://www.financialexpress.com/business/industry-dabur-vs-tata-in-court-over-chutney-name-3714637/,2025-01-14T14:52:10+05:30,2025-01-14T09:22:10,-0.4019
Tata Consumer plans to double vending machines this fiscal,https://www.financialexpress.com/business/industry-tata-consumer-plans-to-double-vending-machines-this-fiscal-3682292/,2024-12-03T01:30:00+05:30,2024-12-02T20:00:00,0.0
"Rural demand recovering, but urban under stress",https://www.financialexpress.com/business/industry-rural-demand-recovering-but-urban-under-stress-3646098/,2024-10-21T23:07:28+05:30,2024-10-21T17:37:28,-0.6059
This Tata stock plummets 10% on weak Q2 numbers! Find out what’s worrying shareholders?,https://www.financialexpress.com/market/this-tata-stock-plummets-10-on-weak-q2-numbers-find-out-whats-worrying-shareholdersnbsp-3645625/,2024-10-21T14:26:31+05:30,2024-10-21T08:56:31,-0.68
Tata Consumer Q2 net up 8 per cent; beats estimates,https://www.financialexpress.com/business/industry-tata-consumer-q2-net-up-8-per-cent-beats-estimates-3643936/,2024-10-19T03:00:00+05:30,2024-10-18T21:30:00,0.0
Tata Consumer Products completes merger of three wholly-owned subsidiaries,https://www.financialexpress.com/business/industry/tata-consumer-products-completes-merger-of-three-wholly-owned-subsidiaries/3598324/,2024-09-01T20:51:53+05:30,2024-09-01T15:21:53,0.0
Tata Consumer Products share price falls over 3% after board approves rights issue priced at 35% discount,https://www.financialexpress.com/market/tata-consumer-products-falls-over-3-after-board-approves-rights-issue-priced-at-35-discount-3563724/,2024-07-24T14:40:10+05:30,2024-07-24T09:10:10,0.5994
"Tata Consumer bets on D2C, nutrition in FY25",https://www.financialexpress.com/business/industry-tata-consumer-bets-on-d2c-nutrition-in-fy25-3503565/,2024-05-28T02:30:00+05:30,2024-05-27T21:00:00,0.0
"Tata Consumer enters vending biz, hits 1,000-machine mark",https://www.financialexpress.com/business/industry-tata-consumer-enters-vending-biz-hits-1000-machine-mark-3469808/,2024-04-27T02:30:00+05:30,2024-04-26T21:00:00,0.0
Tata Consumer eyes mid-single digit growth in tea,https://www.financialexpress.com/business/industry-tata-consumer-eyes-mid-single-digit-growth-in-tea-3467650/,2024-04-25T05:30:00+05:30,2024-04-25T00:00:00,0.3818
Tata Consumer Products slides 6%; Find out what’s driving the losses,https://www.financialexpress.com/market/tata-consumer-products-slides-6-find-out-whats-driving-the-losses-3466731/,2024-04-24T11:58:20+05:30,2024-04-24T06:28:20,-0.4019
"Tata Consumer Products Q4 Results: Profit down 22.5% at Rs 267.71 crore, revenue up 8.5% on-year",https://www.financialexpress.com/business/industry-tata-consumer-products-q4-results-profit-down-22-5-at-rs-26771-crore-revenue-up-85-on-year-3466124/,2024-04-23T16:44:09+05:30,2024-04-23T11:14:09,0.4404
Tata Consumer profit falls 20% to Rs 279 crore,https://www.financialexpress.com/business/industry-tata-consumer-posts-higher-q3-profit-on-festive-season-demand-3387186/,2024-02-07T20:52:58+05:30,2024-02-07T15:22:58,0.4404
Tata Consumer Products approves fundraising of upto Rs 6500 cr; to use infusion to fund Capital Foods & Organic India acquisitions,https://www.financialexpress.com/business/industry-tata-consumer-products-approves-fundraising-of-upto-rs-6500-cr-to-use-infusion-to-fund-capital-foods-organic-india-acquisitions-3369057/,2024-01-19T11:33:53+05:30,2024-01-19T06:03:53,0.4019
"In Rs 5,100-crore deal, Tatas acquire Capital Foods; Buys Organic India for Rs 1,900 crore",https://www.financialexpress.com/business/industry-in-rs-5100-crore-deal-tatas-acquire-capital-foods-buys-organic-india-for-rs-1900-crore-3363462/,2024-01-13T06:00:00+05:30,2024-01-13T00:30:00,0.0
"Tata Consumer, Tata Coffee merger effective January 1",https://www.financialexpress.com/business/industry-tata-consumer-tata-coffee-merger-effective-january-1-3350123/,2023-12-29T01:00:00+05:30,2023-12-28T19:30:00,0.4767
"Tata Consumer eyes Rs 1,000 cr topline from NourishCo",https://www.financialexpress.com/business/industry-tata-consumer-eyes-rs-1000-cr-topline-from-nourishco-3294341/,2023-11-02T05:25:00+05:30,2023-11-01T23:55:00,0.0
Tata Group denies reports of negotiation with Haldiram’s for buying 51% stake,https://www.financialexpress.com/business/industry-tata-group-denies-reports-of-negotiation-with-haldirams-for-buying-51-stake-3235214/,2023-09-06T17:41:35+05:30,2023-09-06T12:11:35,-0.4215
"Tata Consumer Products Q1 profit up 22% at Rs 337.71 crore, posts strong growth in India branded biz",https://www.financialexpress.com/business/industry-tata-consumer-products-q1-profit-up-22-at-rs-337-71-crore-posts-strong-growth-in-india-branded-biz-3188297/,2023-07-26T18:04:43+05:30,2023-07-26T12:34:43,0.8316
Global environment challenging but company remains steadfast : TCPL Chairman N Chandrasekaran,https://www.financialexpress.com/business/industry-global-environment-challenging-but-company-remains-steadfast-tcpl-chairman-n-chandrasekaran-3115490/,2023-06-06T14:19:56+05:30,2023-06-06T08:49:56,0.4215
"Sharekhan list of stocks to buy: Bajaj Finance, Maruti Suzuki, Tata Consumer; check target prices, key risks",https://www.financialexpress.com/market/sharekhan-list-of-stocks-to-buy-bajaj-finance-maruti-suzuki-tata-consumer-check-target-prices-key-risks-3070368/,2023-05-02T07:33:01+05:30,2023-05-02T02:03:01,-0.2732
"India high on coffee: Starbucks sales jump to Rs 1087 crore in India, 71 new outlets opened in FY23",https://www.financialexpress.com/market/india-high-on-coffee-starbucks-sales-jump-to-rs-1087-crore-in-india-71-new-outlets-opened-in-fy23-3063272/,2023-04-26T12:02:20+05:30,2023-04-26T06:32:20,0.0
"Tata Consumer Q4 results: Net profit rises 23% y-o-y to Rs 269 crore, revenue up 14%",https://www.financialexpress.com/business/industry-tata-consumer-q4-results-net-profit-rises-23-y-o-y-to-rs-269-crore-revenue-up-14-3062518/,2023-04-26T01:30:00+05:30,2023-04-25T20:00:00,0.4404
Tata looks to brew more premium coffee brands,https://www.financialexpress.com/business/industry-tata-looks-to-brew-more-premium-coffee-brands-2994423/,2023-02-28T00:30:00+05:30,2023-02-27T19:00:00,0.0
Tata Soulfull banks on millets to stand out in breakfast cereal segment,https://www.financialexpress.com/business/industry-tata-soulfull-banks-on-millets-to-stand-out-in-breakfast-cereal-segment-2897099/,2022-12-02T03:05:00+05:30,2022-12-01T21:35:00,0.0
Tata Consumer Products Rating: add; A good fit in Tata Consumer portfolio,https://www.financialexpress.com/market/tata-consumer-products-rating-add-a-good-fit-in-tata-consumer-portfolio-2894927/,2022-11-29T00:45:00+05:30,2022-11-28T19:15:00,0.6597
"Tata Consumer Products’ share price jumps 3% on Bisleri acquisition reports, analysts bullish on stock",https://www.financialexpress.com/market/tata-consumer-products-share-price-jumps-3-on-bisleri-acquisition-reports-analysts-bullish-on-stock-2889904/,2022-11-24T14:24:17+05:30,2022-11-24T08:54:17,0.296
Tata Consumer Products to launch products under NourishCo; new fruit-based drinks in pipeline,https://www.financialexpress.com/business/industry-tata-consumer-products-to-launch-products-under-nourishco-new-fruit-based-drinks-in-pipeline-2774117/,2022-11-04T12:16:51+05:30,2022-11-04T06:46:51,0.0
TCPL margins may remain under pressure,https://www.financialexpress.com/business/industry-tcpl-margins-may-remain-under-pressure-2728643/,2022-10-22T07:22:16+05:30,2022-10-22T01:52:16,-0.296
Tata Consumer posts 36% net profit rise in Q2,https://www.financialexpress.com/business/industry-tata-consumer-posts-36-net-profit-rise-in-q2-2722891/,2022-10-21T02:30:00+05:30,2022-10-20T21:00:00,0.4404
"Tata Consumer appoints David Atkinson to head its UK, Ireland business",https://www.financialexpress.com/business/industry-tata-consumer-appoints-david-atkinson-to-head-its-uk-ireland-business-2667819/,2022-09-15T12:36:46+05:30,2022-09-15T07:06:46,0.0
Tata Consumer enters nutraceutical segment,https://www.financialexpress.com/business/healthcare-tata-consumer-enters-nutraceutical-segment-2664376/,2023-01-10T14:31:22+05:30,2023-01-10T09:01:22,0.0
"After building scale in F&B, Tata Consumer plans to foray into wider FMCG arena: CEO",https://www.financialexpress.com/business/industry-after-building-scale-in-fb-tata-consumer-plans-to-foray-into-wider-fmcg-arena-ceo-2647317/,2022-08-29T06:00:00+05:30,2022-08-29T00:30:00,0.0
Tata Consumer to see some short-term costs due to restructuring: CEO,https://www.financialexpress.com/business/industry-tata-consumer-to-see-some-short-term-costs-due-to-restructuring-ceo-2627966/,2022-08-13T03:15:00+05:30,2022-08-12T21:45:00,0.0
Tata Consumers Q1 net profit at Rs 277 cr on improved sales and margins,https://www.financialexpress.com/business/industry-tata-consumers-q1-net-profit-at-rs-277-cr-on-improved-sales-and-margins-2625358/,2022-08-11T02:45:00+05:30,2022-08-10T21:15:00,0.7184
"Stocks to buy: 2 Tata Group stocks may rally 19% in 2-3 months, charts and fundamentals hint at up move",https://www.financialexpress.com/market/stocks-to-buy-2-tata-group-stocks-may-rally-19-in-2-3-months-charts-and-fundamentals-hint-at-up-move-2605008/,2022-07-25T11:36:27+05:30,2022-07-25T06:06:27,0.0
Tata Consumer Products enters honey and preserves segment through Himalayan brand,https://www.financialexpress.com/business/industry-tata-consumer-products-enters-honey-and-preserves-segment-through-himalayan-brand-2594100/,2022-07-14T16:01:15+05:30,2022-07-14T10:31:15,0.0
"Tata Consumer looking at both organic, inorganic growth opportunities: Chairman",https://www.financialexpress.com/business/industry-tata-consumer-looking-at-both-organic-inorganic-growth-opportunities-chairman-2574705/,2022-06-28T03:00:00+05:30,2022-06-27T21:30:00,0.6369
Buy these two stocks for gains; Traders advised to hold Nifty longs with 16000 stop-loss,https://www.financialexpress.com/market/cafeinvest-buy-these-two-stocks-for-gains-traders-advised-to-hold-nifty-longs-with-16000-stop-loss-2530306/,2022-05-19T08:07:30+05:30,2022-05-19T02:37:30,0.6249
Tata Consumer Products Q4 profit rises to Rs 239 crore,https://www.financialexpress.com/business/industry-tata-consumer-products-q4-profit-rises-to-rs-239-crore-2513151/,2022-05-04T20:24:49+05:30,2022-05-04T14:54:49,0.4404
Tata Consumer Products rating – Buy: Restructuring is likely to unlock value,https://www.financialexpress.com/market/tata-consumer-products-rating-buy-restructuring-is-likely-to-unlock-value-2480426/,2022-04-04T06:30:00+05:30,2022-04-04T01:00:00,0.34
"Apple’s India focus: Foxconn begins production of Apple AirPods in Hyderabad for exports, iPhone production to follow soon",https://www.financialexpress.com/business/industry-apples-india-focus-foxconn-begins-production-of-apple-airpods-in-hyderabad-for-exports-iphone-production-to-follow-soon-3827472/,2025-04-30T13:03:57+05:30,2025-04-30T07:33:57,0.0
3 stocks at 52-week lows gaining buying interest. Everything you need to know,https://www.financialexpress.com/market/stock-insights/3-stocks-at-52-week-lows-gaining-buying-interest-everything-you-need-to-know/3825583/,2025-04-29T05:32:00+05:30,2025-04-29T00:02:00,0.6124
Dividend alert: These 4 stocks announced Dividend this week- Check record date and 4 crucial factors,https://www.financialexpress.com/market/dividend-alert-these-4-stocks-announced-dividend-this-week-check-record-date-and-4-crucial-factors-3813702/,2025-04-18T11:50:28+05:30,2025-04-18T06:20:28,0.296
"Dividend alert: This Tata group stock is set to announce dividend, Q4 results on April 17",https://www.financialexpress.com/market/dividend-alert-this-tata-group-stock-is-set-to-announce-dividend-q4-results-on-april-17-3809280/,2025-04-14T15:15:05+05:30,2025-04-14T09:45:05,0.296
"Infosys, Wipro to ICICI Bank, HDFC Bank, 7 big Q4 results to watch this week",https://www.financialexpress.com/business/industry/infosys-wipro-to-icici-bank-hdfc-bank-7-big-q4-results-to-watch-this-week/3809103/,2025-04-14T11:46:03+05:30,2025-04-14T06:16:03,0.0
"Tata Motors bets on EVs, diesel as future growth drivers",https://www.financialexpress.com/auto/car-news/tata-motors-bets-on-evs-diesel-as-future-growth-drivers/3576712/,2024-08-07T21:36:45+05:30,2024-08-07T16:06:45,0.3818
Tata Passenger Electric Mobility and Tata Power Renewable Energy join to drive zero-emissions mobility,https://www.financialexpress.com/business/express-mobility-tata-passenger-electric-mobility-and-tata-power-renewable-energy-join-to-drive-zero-emissions-mobility-3575145/,2024-08-06T14:43:15+05:30,2024-08-06T09:13:15,0.5106
Tata Motors hoping for market stability to launch Altroz EV,https://www.financialexpress.com/auto/car-news/tata-motors-plans-another-affordable-ev/3854180/,2025-05-23T13:59:10+05:30,2025-05-23T08:29:10,0.4215
I-bankers say Tata Sons confident of deregistering as NBFC-UL,https://www.financialexpress.com/business/industry-i-bankers-say-tata-sons-confident-of-deregistering-as-nbfc-ul-3854027/,2025-05-22T20:50:57+05:30,2025-05-22T15:20:57,0.4939
Naveen Tahilyani steps down as Tata Digital CEO,https://www.financialexpress.com/business/industry-naveen-tahilyani-steps-down-as-tata-digital-ceo-3854084/,2025-05-22T20:21:18+05:30,2025-05-22T14:51:18,0.0
The Ashok monetisation to kick off soon,https://www.financialexpress.com/business/industry-the-ashok-monetisation-to-kick-off-soon-3852841/,2025-05-21T23:10:32+05:30,2025-05-21T17:40:32,0.0
"‘Lock in higher yields through money market funds,’ says Murthy Nagarajan",https://www.financialexpress.com/money/mutual-funds-lock-in-higher-yields-through-money-market-funds-says-murthy-nagarajan-3847760/,2025-05-19T12:10:15+05:30,2025-05-19T06:40:15,0.0
Most valued brands: Only 4 Indian companies in top 100; TCS value increases to $57.3 billion,https://www.financialexpress.com/business/industry-most-valued-brands-only-4-indian-companies-in-top-100-tcs-value-increases-tonbsp57-3nbspbillion-3845740/,2025-05-15T13:50:50+05:30,2025-05-15T08:20:50,0.7501
Nuvama recommends ‘Reduce’ on Tata Power despite jump in profit: 3 reasons why,https://www.financialexpress.com/market/nuvama-recommends-reduce-on-tata-power-despite-jump-in-profit-3-reasons-why-3845366/,2025-05-15T09:13:45+05:30,2025-05-15T03:43:45,-0.1295
"Tata Power Q4 profit jumps 16.5% to Rs 1,043 crore",https://www.financialexpress.com/business/industry-tata-power-q4-profit-jumps-16-5-to-rs-1043-crore-3845138/,2025-05-14T22:43:10+05:30,2025-05-14T17:13:10,0.4404
Tata Motors slides 2% after brokerages cut price target: 3 big concerns at this hour,https://www.financialexpress.com/market/tata-motors-price-target-cut-further-after-q4-results-3-big-concerns-at-this-hour-3843917/,2025-05-14T09:51:50+05:30,2025-05-14T04:21:50,-0.2732
Titan’s shares rise 5% in a falling market; 2 reasons fuelling the rally,https://www.financialexpress.com/market/titans-shares-rise-5-in-a-falling-market-2-reasons-fuelling-the-rally-3838276/,2025-05-09T10:31:08+05:30,2025-05-09T05:01:08,0.1531
Titan Q4 Results: 13 percent rise in profit,https://www.financialexpress.com/business/industry-titan-q4-results-13-percent-rise-in-profit-3837697/,2025-05-08T19:56:37+05:30,2025-05-08T14:26:37,0.4404
iPhone to be cheaper if production shifted to India: JPMorgan,https://www.financialexpress.com/life/technology-iphone-to-be-cheaper-if-production-shifted-to-india-jpmorgan-3829639/,2025-05-02T08:27:06+05:30,2025-05-02T02:57:06,0.0
Not all Tatas live in mansions — THIS one chose a low-profile life in a Colaba 2BHK,https://www.financialexpress.com/trending/not-all-tatas-live-in-mansions-this-one-chose-a-low-profile-life-in-a-colaba-2bhk/3829457/,2025-05-01T22:08:22+05:30,2025-05-01T16:38:22,0.0
Tata Motors down 36% in 1 year: All eyes on Rs 500 crore fund raising plan,https://www.financialexpress.com/market/tata-motors-down-36-in-1-year-all-eyes-on-rs-500-crore-fund-raising-plan-3827846/,2025-04-30T16:27:10+05:30,2025-04-30T10:57:10,0.0
Trent shares plunge 4% as net profit nosedives 55% in Q4,https://www.financialexpress.com/market/trent-shares-plunge-4-as-net-profit-nosedives-55-in-q4-3827256/,2025-04-30T10:49:18+05:30,2025-04-30T05:19:18,0.6249
Can this Tata stock rise after 35% slump in 1 year: Details of potential rebound trigger,https://www.financialexpress.com/market/can-tata-technologies-stock-rise-after-35-slump-in-1-year-details-of-potential-rebound-trigger-3825171/,2025-04-28T14:28:09+05:30,2025-04-28T08:58:09,0.0
Indian Hotels a buy Now? 3 reasons why Motilal Oswal sees 24% upside,https://www.financialexpress.com/market/indian-hotels-a-buy-now-3-reasons-why-motilal-oswal-sees-24-upside-3810135/,2025-04-15T13:32:28+05:30,2025-04-15T08:02:28,0.0
This Tata Group stock is down 20% in 1 year. Can pact with NTPC be a game changer,https://www.financialexpress.com/market/tata-power-stock-is-down-20-in-1-year-can-pact-with-ntpc-be-a-game-changer-3809847/,2025-04-15T08:56:26+05:30,2025-04-15T03:26:26,0.0
"Full rooms, firm rates and a sector in the sun",https://www.financialexpress.com/business/industry-insights/full-rooms-firm-rates-and-a-sector-in-the-sun/3809583/,2025-04-15T10:10:58+05:30,2025-04-15T04:40:58,0.0
This Tata Group stock is down 32% YTD but 3 brokerages have a Buy call. Here’s why,https://www.financialexpress.com/market/this-tata-group-stock-is-down-32-ytd-but-3-brokerages-have-a-buy-call-heres-why-3809466/,2025-04-15T05:30:00+05:30,2025-04-15T00:00:00,0.0
From China+1 to Brazil+India? The smartphone supply chain shuffle could be coming…,https://www.financialexpress.com/business/industry-insights/from-china1-to-brazilindia-the-smartphone-supply-chain-shuffle-could-be-coming/3808713/,2025-04-14T05:45:00+05:30,2025-04-14T00:15:00,0.0
TCS outlook strong despite Q4 miss,https://www.financialexpress.com/business/industry-tcs-outlook-strong-despite-q4-miss-3807107/,2025-04-11T22:18:37+05:30,2025-04-11T16:48:37,0.5781
Titan jumps 4%: Surge in gold demand powers rally,https://www.financialexpress.com/market/titan-jumps-4-surge-in-gold-demand-powers-rally-3802855/,2025-04-08T12:24:16+05:30,2025-04-08T06:54:16,-0.128
Trent share slumps over 19%. Here’s why,https://www.financialexpress.com/market/trent-share-slumps-over-19-heres-why-3801801/,2025-04-07T14:19:02+05:30,2025-04-07T08:49:02,0.296
Tata Motors’ shares plunge 13% as JLR halts sales to American market for a month,https://www.financialexpress.com/market/tata-motors-shares-plunge-13-as-jlr-halts-sales-to-american-market-for-a-month-3801661/,2025-04-07T12:41:39+05:30,2025-04-07T07:11:39,0.296
Tata Capital’s $2 Billion IPO takes step forward with confidential pre-filing,https://www.financialexpress.com/market/ipo-news-tata-capitals-2-billion-ipo-takes-step-forward-with-confidential-pre-filing-3800259/,2025-04-05T21:52:46+05:30,2025-04-05T16:22:46,0.0
Why is the market falling today? 4 reasons…,https://www.financialexpress.com/market/why-is-the-market-falling-today-4-reasons-are-3798485/,2025-04-04T15:10:39+05:30,2025-04-04T09:40:39,-0.1531
Trent shares surge 13% in 30 days: 3 reasons why Goldman Sachs sees it as long-term Buy,https://www.financialexpress.com/market/trent-shares-surge-13-in-30-days-3-reasons-why-goldman-sachs-sees-it-as-long-term-buy-3796290/,2025-04-02T12:29:24+05:30,2025-04-02T06:59:24,0.296
"Upcoming Q4 earnings and dividend: From TCS, Infosys to HDFC Bank, UltraTech watch out for these 10 companies",https://www.financialexpress.com/business/industry/upcoming-q4-earnings-and-dividend-from-tcs-infosys-to-hdfc-bank-ultratech-watch-out-for-these-10-companies/3794357/,2025-04-01T05:45:00+05:30,2025-04-01T00:15:00,0.0
Tata AutoComp Systems acquired 80% stake in Artifex Interior Systems,https://www.financialexpress.com/business/industry/tata-autocomp-systems-acquired-80-stake-in-artifex-interior-systems/3793690/,2025-03-30T22:54:18+05:30,2025-03-30T17:24:18,0.0
Trent is Macquarie’s showstopper pick: 4 reasons for Outperform rating,https://www.financialexpress.com/market/trent-is-macquaries-showstopper-pick-4-reasons-for-outperform-rating-3791058/,2025-03-28T12:00:07+05:30,2025-03-28T06:30:07,0.0
Tata Autocomp to acquire IAC Sweden,https://www.financialexpress.com/business/industry-tata-autocomp-to-acquire-iac-sweden-3787204/,2025-03-24T21:49:58+05:30,2025-03-24T16:19:58,0.0
"‘Looking to become a billion-dollar company in 3-5 years’, says Amit Sharma",https://www.financialexpress.com/business/industry-looking-to-become-a-billion-dollar-company-in-3-5-years-says-amit-sharma-3782104/,2025-03-19T19:30:56+05:30,2025-03-19T14:00:56,0.0
Metal stocks in focus: Top 4 stocks up as much as 10% in 2025,https://www.financialexpress.com/market/metal-stocks-in-focus-top-4-stocks-up-as-much-as-10-in-2025-3776825/,2025-03-14T09:00:00+05:30,2025-03-14T03:30:00,0.2023
Tata Motors surges 2%: 3 reasons fuelling the rally are…,https://www.financialexpress.com/market/tata-motors-surges-2-3-reasons-fuelling-the-rally-are-3775292/,2025-03-12T11:48:54+05:30,2025-03-12T06:18:54,0.0
"TCS to buy 100% in commercial realty firm for Rs 2,250 crore",https://www.financialexpress.com/business/industry-tcs-to-buy-100-in-commercial-realty-firm-for-rs-2250-crore-3774825/,2025-03-11T22:12:50+05:30,2025-03-11T16:42:50,0.0
"Tata Power arm, Andhra govt tie up for 7,000 MW projects",https://www.financialexpress.com/business/industry-tata-power-arm-andhra-govt-tie-up-for-7000-mw-projects-3771111/,2025-03-07T23:30:46+05:30,2025-03-07T18:00:46,0.0
Airtel eyes market leadership with Tata Play merger,https://www.financialexpress.com/life/technology-airtel-eyes-market-leadership-with-tata-play-merger-3769769/,2025-03-06T20:55:19+05:30,2025-03-06T15:25:19,0.34
A dry-spell for TCS employees? FY26 salary hike among lowest in 4 years – Here is the expected increment,https://www.financialexpress.com/business/industry-a-dry-spell-for-tcs-employees-fy26-salary-hike-among-lowest-in-4-years-here-is-the-expected-increment-3763102/,2025-02-28T11:53:44+05:30,2025-02-28T06:23:44,-0.3818
The entire game in retail is to constantly evolve & change: Trent MD,https://www.financialexpress.com/business/industry-the-entire-game-in-retail-is-to-constantly-evolve-change-trent-md-3762591/,2025-03-04T17:59:24+05:30,2025-03-04T12:29:24,0.0
‘Green manufacturing is our top priority’,https://www.financialexpress.com/business/industry-green-manufacturing-is-our-top-priority-3762556/,2025-02-28T01:30:00+05:30,2025-02-27T20:00:00,0.2023
Four reasons brokerages believe M&M can beat Tesla in India,https://www.financialexpress.com/market/four-reasons-brokerages-believe-mampm-can-beat-tesla-in-india-3761383/,2025-02-26T20:11:48+05:30,2025-02-26T14:41:48,0.0
‘Advantage Assam’: PM Modi says India to make big leap in semiconductors as Tata Group announces facility in Morigaon,https://www.financialexpress.com/business/industry-advantage-assam-summit-pm-modi-says-india-to-make-big-leap-in-semiconductors-as-tata-group-announces-facility-in-assam-3759926/,2025-02-25T13:57:55+05:30,2025-02-25T08:27:55,0.0
Tata Investment share price soars over 10%. Here’s why…,https://www.financialexpress.com/market/ipo-news-tata-investment-share-price-soars-over-10-heres-why-3759773/,2025-02-25T12:08:30+05:30,2025-02-25T06:38:30,0.296
Big IPO alert- Tata Capital plans IPO: Everything that you need to know about this issue,https://www.financialexpress.com/market/ipo-news-big-ipo-alert-tata-capital-plans-ipo-everything-that-you-need-to-know-about-this-issue-3759633/,2025-02-25T10:29:11+05:30,2025-02-25T04:59:11,0.296
Metal stocks see smart recovery. SAIL up 6% from intra-day lows,https://www.financialexpress.com/market/metal-stocks-see-smart-recovery-sail-up-6-from-intra-day-lows-3747160/,2025-02-12T15:50:55+05:30,2025-02-12T10:20:55,0.2263
Trent posts lower-than-expected profit,https://www.financialexpress.com/business/industry-trent-posts-lower-than-expected-profit-3740311/,2025-02-07T05:15:00+05:30,2025-02-06T23:45:00,0.4404
Tata Electronics acquires 60% in Pegatron Tech,https://www.financialexpress.com/business/industry-tata-electronics-acquires-60-in-pegatron-tech-3725351/,2025-01-25T05:30:00+05:30,2025-01-25T00:00:00,0.0
"Tata Group becomes India’s most-valuable brand, surpassing $30-bn milestone",https://www.financialexpress.com/business/brandwagon-tata-group-is-indias-most-valuable-brand-surpassing-30-bn-milestone-3721367/,2025-01-21T13:30:00+05:30,2025-01-21T08:00:00,0.0
"Interarch Building Products secures orders worth Rs 221 crore in semiconductor and lithium-ion battery sector, from Tata Projects",https://www.financialexpress.com/business/industry-interarch-building-products-secures-orders-worth-rs-221-crore-in-semiconductor-and-lithium-ion-battery-sector-from-tata-projects-3713113/,2025-01-12T16:21:28+05:30,2025-01-12T10:51:28,0.4939
Tata Electronics gets CCI nod to acquire majority stake in Pegatron India,https://www.financialexpress.com/business/industry-tata-electronics-gets-cci-nod-to-acquire-majority-stake-in-pegatron-india-3709762/,2025-01-07T22:02:54+05:30,2025-01-07T16:32:54,0.0
10-year G-Sec yields may ease to 6.60 per cent by March: Tata AMC,https://www.financialexpress.com/market/10-year-g-sec-yields-may-ease-to-6-60-per-cent-by-march-tata-amc-3703740/,2024-12-31T04:00:00+05:30,2024-12-30T22:30:00,0.3612
Tata Group chairman sees a golden age for manufacturing in India,https://www.financialexpress.com/business/industry-tata-group-chairman-sees-a-golden-age-for-manufacturing-in-india-3700931/,2024-12-27T06:00:00+05:30,2024-12-27T00:30:00,0.0
Tata Capital listing hopes drive group company shares,https://www.financialexpress.com/market/tata-capital-listing-hopes-drive-group-company-shares-3699435/,2024-12-24T21:50:23+05:30,2024-12-24T16:20:23,0.6124
