headline,link,date_str,parsed_date_iso,sentiment_score
Tata Housing to invest USD 36 million to develop 2 residential projects in Maldives,https://www.financialexpress.com/business/industry-tata-housing-to-invest-usd-36-mn-to-develop-2-residential-projects-in-maldives-2442246/,2022-02-23T10:53:18+05:30,2022-02-23T05:23:18,0.0
Tata Investment declares Rs 27 dividend in FY25: Check record date and other crucial details,https://www.financialexpress.com/market/tata-investment-declares-rs-27-dividend-in-fy25-check-record-date-and-other-crucial-details-3817968/,2025-04-22T14:12:24+05:30,2025-04-22T08:42:24,0.0
"From Coal India, NTPC, HUL to Mazagon Dock – Here are 8 stocks to watch",https://www.financialexpress.com/market/stocks-to-watch-coal-india-ntpc-hul-tata-investment-prestige-estate-projects-anant-raj-tata-power-mazagon-dock-shipbuilders-3817491/,2025-04-22T06:59:29+05:30,2025-04-22T01:29:29,0.0
A hot issue: Lack of private risk capital for thermal ventures,https://www.financialexpress.com/opinion/a-hot-issue-lack-of-private-risk-capital-for-thermal-ventures/3786146/,2025-03-24T05:14:23+05:30,2025-03-23T23:44:23,-0.5267
Tata Harrier EV fully unveiled: Everything you must know before launch,https://www.financialexpress.com/auto/car-news/tata-harrier-ev-fully-unveiled-everything-you-must-know-before-launch/3856096/,2025-05-24T16:31:02+05:30,2025-05-24T11:01:02,0.0
2025 Tata Altroz variants and features explained — Which suits you the best?,https://www.financialexpress.com/auto/car-news/2025-tata-altroz-variants-and-features-explained/3855015/,2025-05-23T15:21:57+05:30,2025-05-23T09:51:57,0.6369
2025 Tata Altroz facelift vs Maruti Baleno: Which premium hatchback should you buy?,https://www.financialexpress.com/auto/car-news/2025-tata-altroz-facelift-vs-maruti-baleno-comparison-price-features-safety-engine-specs/3854650/,2025-05-23T11:33:55+05:30,2025-05-23T06:03:55,0.0
2025 Tata Altroz Facelift: 5 class-leading features you need to know,https://www.financialexpress.com/auto/car-news/2025-tata-altroz-facelift-5-class-leading-features-you-need-to-know/3853940/,2025-05-22T18:00:50+05:30,2025-05-22T12:30:50,0.0
This is why 2025 Tata Altroz Facelift Is India’s safest hatchback,https://www.financialexpress.com/auto/car-news/this-is-why-2025-tata-altroz-facelift-is-indias-safest-hatchback/3853806/,2025-05-22T16:41:24+05:30,2025-05-22T11:11:24,0.4019
2025 Tata Altroz Facelift launched at Rs 6.89 lakh,https://www.financialexpress.com/auto/car-news/2025-tata-altroz-facelift-launched-at-rs-6-89-lakh/3853496/,2025-05-22T13:00:35+05:30,2025-05-22T07:30:35,0.128
2025 Tata Altroz Facelift: Top 3 premium features to keep in mind,https://www.financialexpress.com/auto/car-news/2025-tata-altroz-facelift-top-3-premium-features-to-keep-in-mind/3853342/,2025-05-22T11:03:16+05:30,2025-05-22T05:33:16,0.2023
2025 Tata Altroz Facelift India Launch Highlights: 2025 Tata Altroz facelift launch price at Rs 6.89 lakh,https://www.financialexpress.com/auto/car-news/2025-tata-altroz-launch-live-updates-features-specs-price/3853145/,2025-05-22T19:26:49+05:30,2025-05-22T13:56:49,0.0
JLR lines up Range Rover Electric’s global launch later this year,https://www.financialexpress.com/auto/car-news/jlr-lines-up-range-rover-electrics-global-launch-later-this-year/3852894/,2025-05-22T05:21:55+05:30,2025-05-21T23:51:55,0.0
2025 Tata Altroz vs Hyundai i20: Features Comparison,https://www.financialexpress.com/auto/car-news/2025-tata-altroz-vs-hyundai-i20-features-comparison/3852620/,2025-05-21T18:40:04+05:30,2025-05-21T13:10:04,0.0
Looking beyond AMT? Top 5 automatic cars under Rs 10 lakh,https://www.financialexpress.com/auto/car-news/top-5-automatic-cars-under-rs-10-lakh/3852583/,2025-05-21T17:59:51+05:30,2025-05-21T12:29:51,0.2023
Tata Harrier EV launch date out: 5 must-know features,https://www.financialexpress.com/auto/electric-vehicles/tata-harrier-ev-launch-3rd-june-2025-features-range-price-all-you-need-to-know/3852247/,2025-05-21T14:24:16+05:30,2025-05-21T08:54:16,0.0
2025 Tata Altroz launch tomorrow: 5 things you need to know,https://www.financialexpress.com/auto/car-news/2025-tata-altroz-launch-tomorrow-5-things-you-need-to-know/3852034/,2025-05-21T11:33:05+05:30,2025-05-21T06:03:05,0.0
2025 Tata Altroz CNG interiors leaked: See what’s new?,https://www.financialexpress.com/auto/car-news/2025-tata-altroz-cng-interiors-leaked-see-whats-new/3850685/,2025-05-22T10:33:13+05:30,2025-05-22T05:03:13,-0.3182
"Tata Altroz facelift features: Old vs New — inbuilt navigation, wireless phone charging",https://www.financialexpress.com/auto/car-news/tata-altroz-facelift-features-old-vs-new-inbuilt-navigation-wireless-phone-charging/3849840/,2025-05-19T12:11:17+05:30,2025-05-19T06:41:17,0.0
Tata Harrier EV launch on June 3: What to expect?,https://www.financialexpress.com/auto/car-news/tata-harrier-ev-launch-on-june-3-what-to-expect/3849693/,2025-05-19T10:15:24+05:30,2025-05-19T04:45:24,0.0
15 Tata Curvv EVs delivered to Govt of Nepal,https://www.financialexpress.com/auto/car-news/15-tata-curvv-evs-delivered-to-govt-of-nepal/3848135/,2025-05-17T13:39:51+05:30,2025-05-17T08:09:51,0.0
Tata Motors installs 10 MegaCharger stations in key highways,https://www.financialexpress.com/auto/car-news/tata-motors-installs-10-megacharger-stations-in-key-highways/3847172/,2025-05-16T14:31:59+05:30,2025-05-16T09:01:59,0.0
"Bharat Dynamics, Tata Motors among top 5 most searched stocks on Google Trends",https://www.financialexpress.com/market/bharat-dynamics-tata-motors-among-top-5-most-searched-stocks-on-google-trends-3847120/,2025-05-16T14:06:31+05:30,2025-05-16T08:36:31,0.4404
"Tata Motors, Vertelo team up for EV commercial vehicles leasing",https://www.financialexpress.com/auto/commercial-vehicles/tata-motors-vertelo-team-up-for-ev-commercial-vehicles-leasing/3846719/,2025-05-16T08:32:30+05:30,2025-05-16T03:02:30,0.0
"Tata Altroz new vs old: Features, Design, Safety",https://www.financialexpress.com/auto/car-news/tata-altroz-new-vs-old-features-design-safety/3844131/,2025-05-14T10:57:49+05:30,2025-05-14T05:27:49,0.4215
"Tata Motors dividend alert: Check record date, payout schedule and 4 key details",https://www.financialexpress.com/market/tata-motors-dividend-alert-check-record-date-payout-schedule-and-4-key-details-3844096/,2025-05-14T10:42:45+05:30,2025-05-14T05:12:45,0.296
Tata EVs now available for sale in Government e Marketplace,https://www.financialexpress.com/auto/car-news/tata-evs-now-available-for-sale-in-government-e-marketplace/3843983/,2025-05-14T09:44:26+05:30,2025-05-14T04:14:26,0.0
"Stocks to watch today: From Bharti Airtel, Tata Motors to HAL – Here’s a list of 7 stocks in focus today",https://www.financialexpress.com/market/stocks-to-watch-today-from-bharti-airtel-tata-motors-to-hal-heres-a-list-of-7-stocks-in-focus-today-3843806/,2025-05-14T06:35:27+05:30,2025-05-14T01:05:27,0.0
"Tata Motors posts Rs 8,556-crore profit, beats estimates",https://www.financialexpress.com/business/industry/tata-motors-posts-rs-8556-crore-profit-beats-estimatesnbsp/3843632/,2025-05-13T21:11:27+05:30,2025-05-13T15:41:27,0.4404
"Tata Motors’ FY25 revenue up 1.3% at Rs 4,39,695 crore — PVs, CVs, JLR sales down",https://www.financialexpress.com/auto/car-news/tata-motors-fy25-revenue-up-1-3-at-rs-439695-crore-pvs-cvs-jlr-sales-down/3843469/,2025-05-13T18:43:21+05:30,2025-05-13T13:13:21,0.0
2025 Tata Altroz base variant: Packed with features or bare minimum?,https://www.financialexpress.com/auto/car-news/2025-tata-altroz-base-variant-packed-with-features-or-bare-minimum/3843237/,2025-05-13T16:13:02+05:30,2025-05-13T10:43:02,0.0
Drive Green: Electric SUVs under Rs 20 Lakh,https://www.financialexpress.com/auto/electric-vehicles/drive-green-electric-suvs-under-rs-20-lakh/3842784/,2025-05-13T11:58:57+05:30,2025-05-13T06:28:57,0.0
Maruti offers six airbags as standard in entry-level models,https://www.financialexpress.com/auto/car-news/maruti-offers-six-airbags-as-standard-in-entry-level-models/3842119/,2025-05-13T06:01:51+05:30,2025-05-13T00:31:51,0.0
2025 Tata Altroz facelift breaks cover ahead of launch,https://www.financialexpress.com/auto/car-news/2025-tata-altroz-facelift-breaks-cover-ahead-of-launch/3841814/,2025-05-12T17:56:45+05:30,2025-05-12T12:26:45,0.0
"Market Watchlist: Nifty rebound to 24,260 likely; auto poised for gains, banks brace for weakness",https://www.financialexpress.com/market/stock-insights-market-watchlist-nifty-rebound-to-24260-likely-auto-poised-for-gains-banks-brace-for-weakness-3840742/,2025-05-12T05:30:00+05:30,2025-05-12T00:00:00,0.5106
2025 Tata Altroz caught testing: Launch in May 22,https://www.financialexpress.com/auto/car-news/2025-tata-altroz-caught-testing-launch-in-may-22/3840580/,2025-05-11T17:12:26+05:30,2025-05-11T11:42:26,0.0
Tata Harrier spotted testing — Is it petrol?,https://www.financialexpress.com/auto/car-news/tata-harrier-spotted-testing-is-it-petrol/3840314/,2025-05-11T10:11:34+05:30,2025-05-11T04:41:34,0.0
2025 Tata Altroz vs current model: 5 updates to expect,https://www.financialexpress.com/auto/car-news/2025-tata-altroz-vs-current-model-5-updates-to-expect/3839870/,2025-05-10T19:14:19+05:30,2025-05-10T13:44:19,0.0
India-UK FTA won’t change luxury car industry much: Mercedes India MD,https://www.financialexpress.com/auto/car-news/india-uk-fta-wont-change-luxury-car-industry-much-mercedes-india-md/3838979/,2025-05-09T20:35:20+05:30,2025-05-09T15:05:20,0.0
Tata Motors inaugurates new scrapping facility in Kolkata,https://www.financialexpress.com/auto/news/tata-motors-inaugurates-new-scrapping-facility-new-kolkata/3838228/,2025-05-09T09:45:33+05:30,2025-05-09T04:15:33,0.0
Tata Motors Demerger: 5 things to know about the big split,https://www.financialexpress.com/market/tata-motors-demerger-5-things-to-know-about-the-big-split-3837339/,2025-05-08T15:18:32+05:30,2025-05-08T09:48:32,0.0
2025 Tata Altroz interior — What are the key changes?,https://www.financialexpress.com/auto/car-news/2025-tata-altroz-interior-what-are-the-key-changes/3836898/,2025-05-08T10:23:33+05:30,2025-05-08T04:53:33,0.0
"Nifty, Sensex end flat and Defence stocks rally as India launches Operation Sindoor; Tata Motors top Index gainer",https://www.financialexpress.com/market/nifty-sensex-end-flat-and-defence-stocks-rally-as-india-launches-operation-sindoor-tata-motors-top-index-gainer-3836017/,2025-05-07T15:46:34+05:30,2025-05-07T10:16:34,0.5994
"99.9995% say Yes: Tata Motors up 4% as demerger gets the green light, India-UK FTA lift JLR hopes",https://www.financialexpress.com/market/99-9995-say-yes-tata-motors-up-4-as-demerger-gets-the-green-light-india-uk-fta-lift-jlr-hopes-3835621/,2025-05-07T11:05:04+05:30,2025-05-07T05:35:04,0.6705
2025 Tata Altroz facelift — What engine options will be on offer?,https://www.financialexpress.com/auto/car-news/2025-tata-altroz-facelift-what-engine-options-will-be-on-offer/3835481/,2025-05-22T10:39:54+05:30,2025-05-22T05:09:54,0.0
Tata Motors at day’s low ahead of shareholders meeting on demerger: Key details to watch out for,https://www.financialexpress.com/market/tata-motors-at-days-low-ahead-of-shareholders-meeting-on-demerger-key-details-to-watch-out-for-3834519/,2025-05-06T14:39:04+05:30,2025-05-06T09:09:04,-0.2732
"M&M profit grows 22% to Rs 2,437 crore; revenue at Rs 31,353 crore",https://www.financialexpress.com/business/industry-mm-profit-grows-22-to-rs-2437-crore-revenue-at-rs-31353-crore-3833589/,2025-05-05T20:17:14+05:30,2025-05-05T14:47:14,0.4404
Tata Altroz facelift interiors tease: What’s new?,https://www.financialexpress.com/auto/car-news/tata-altroz-facelift-interiors-tease-whats-new/3832956/,2025-05-05T10:48:51+05:30,2025-05-05T05:18:51,-0.3182
Upcoming Tata Altroz facelift vs competition — Spec check,https://www.financialexpress.com/auto/car-news/upcoming-tata-altroz-facelift-vs-competition-spec-check/3832639/,2025-05-05T09:00:00+05:30,2025-05-05T03:30:00,0.0
"2025 Tata Altroz teaser: Design, Features, Launch date all revealed",https://www.financialexpress.com/auto/bike-news/2025-tata-altroz-teaser-design-features-launch-date-all-revealed/3831172/,2025-05-03T12:15:41+05:30,2025-05-03T06:45:41,-0.25
"Stocks to watch: From Tata Motors, Infosys to JSW Energy – Here are 10 stocks in focus today",https://www.financialexpress.com/market/stocks-to-watch-from-tata-motors-infosys-to-jsw-energy-here-are-10-stocks-in-focus-today-3829608/,2025-05-02T06:21:36+05:30,2025-05-02T00:51:36,0.2732
April 2025 auto sales battle: Royal Enfield sees flat domestic sales,https://www.financialexpress.com/auto/car-news/april-2025-auto-sales-battle-hyundai-mahindra-see-positive-growth-tata-sales-decline/3829215/,2025-05-01T18:06:42+05:30,2025-05-01T12:36:42,-0.3818
"May 2025 car launches: From EVs and hot hatch, you can’t ignore",https://www.financialexpress.com/auto/car-news/may-2025-car-launches-from-evs-and-hot-hatch-you-cant-ignore/3829128/,2025-05-01T16:32:35+05:30,2025-05-01T11:02:35,-0.3612
2025 Tata Altroz facelift launch on May 22: What to expect?,https://www.financialexpress.com/auto/car-news/2025-tata-altroz-facelift-launch-on-may-21-what-to-expect/3825375/,2025-04-28T17:07:43+05:30,2025-04-28T11:37:43,0.0
Tata Altroz CNG facelift spotted testing: What we know so far,https://www.financialexpress.com/auto/car-news/tata-altroz-cng-facelift-spotted-testing-what-we-know-so-far/3820166/,2025-04-24T10:42:50+05:30,2025-04-24T05:12:50,0.0
Bharat NCAP: Tata Nexon EV gets top safety marks,https://www.financialexpress.com/auto/electric-vehicles/bharat-ncap-tata-nexon-ev-gets-top-safety-marks/3819777/,2025-04-23T22:12:16+05:30,2025-04-23T16:42:16,0.5574
"As BluSmart runs out of charge, Tata Motors & Citroën get a shock",https://www.financialexpress.com/auto/electric-vehicles/as-blusmart-runs-out-of-charge-tata-motors-citron-get-a-shock/3817448/,2025-04-22T08:13:52+05:30,2025-04-22T02:43:52,-0.3818
Kia Syros vs Tata Nexon crash test battle: Which SUV keeps you safer?,https://www.financialexpress.com/auto/car-news/kia-syros-vs-tata-nexon-crash-test-battle-which-suv-keeps-you-safer/3811718/,2025-04-16T18:29:28+05:30,2025-04-16T12:59:28,-0.7717
Top 5 Safest Budget Friendly Cars under 10 Lakh,https://www.financialexpress.com/auto/car-news/top-5-safest-budget-friendly-cars-under-10-lakh/3809397/,2025-04-14T16:57:15+05:30,2025-04-14T11:27:15,0.7717
Tata Curvv EV Dark Edition launched at Rs 22.24 lakh: Here’s what’s new,https://www.financialexpress.com/auto/car-news/tata-curvv-ev-dark-edition-launched-at-rs-22-24-lakh-heres-whats-new/3809363/,2025-04-14T16:09:05+05:30,2025-04-14T10:39:05,0.128
Tata Curvv Dark Edition launched: Here’s what’s changed,https://www.financialexpress.com/auto/car-news/tata-curvv-dark-edition-teased-ahead-of-launch-what-to-expect/3807577/,2025-04-12T12:37:20+05:30,2025-04-12T07:07:20,0.128
Hyundai Exter CNG vs Tata Punch CNG: Who is the real budget king?,https://www.financialexpress.com/auto/car-news/hyundai-exter-cng-vs-tata-punch-cng-who-is-the-real-budget-king/3804971/,2025-04-10T09:29:44+05:30,2025-04-10T03:59:44,0.0
Tata Motors hit by slump in fleet orders,https://www.financialexpress.com/auto/car-news/tata-motors-hit-by-slump-in-fleet-orders/3803549/,2025-04-08T22:57:17+05:30,2025-04-08T17:27:17,0.0
"From 3rd to 2nd: Tata Motors outpaces Hyundai, Mahindra in March",https://www.financialexpress.com/auto/car-news/from-3rd-to-2nd-tata-motors-outpaces-hyundai-mahindra-in-march/3802935/,2025-04-08T13:05:30+05:30,2025-04-08T07:35:30,0.0
Maruti Grand Vitara rival: Tata Curvv to join CNG club,https://www.financialexpress.com/auto/car-news/maruti-grand-vitara-rival-tata-curvv-to-join-cng-club/3801620/,2025-04-07T12:25:55+05:30,2025-04-07T06:55:55,0.6369
Tata Motors Demerger: 6 key updates you need to know about the big auto split,https://www.financialexpress.com/market/tata-motors-demerger-6-key-updates-you-need-to-know-about-the-big-auto-split-3801085/,2025-04-07T06:30:00+05:30,2025-04-07T01:00:00,0.0
From Tata Motors to Jubilant FoodWorks – Here are 9 stocks to watch,https://www.financialexpress.com/market/stocks-to-watch-tata-motors-iifl-finance-delhivery-indian-bank-indusind-bank-tata-steel-yes-bank-aavas-financiers-jubilant-foodworks-3801225/,2025-04-07T06:23:38+05:30,2025-04-07T00:53:38,0.6124
"Upcoming car, SUV launches to look out for in April",https://www.financialexpress.com/auto/car-news/upcoming-car-suv-launches-to-look-out-for-in-april/3800594/,2025-04-06T12:43:06+05:30,2025-04-06T07:13:06,0.0
"Tata Sierra EV dashboard, centre console design patented, new details revealed",https://www.financialexpress.com/auto/car-news/tata-sierra-ev-dashboard-centre-console-design-patented-new-details-revealed/3798697/,2025-04-04T13:31:10+05:30,2025-04-04T08:01:10,0.0
MG and Tata Motors get ready for top spot EV race in FY26,https://www.financialexpress.com/auto/electric-vehicles/mg-and-tata-motors-get-ready-for-top-spot-ev-race-in-fy26/3796762/,2025-04-02T20:27:53+05:30,2025-04-02T14:57:53,0.5106
Auto sales up 4% in March; 2% in FY25,https://www.financialexpress.com/auto/news/auto-sales-up-4-in-march-2-in-fy25/3795978/,2025-04-02T05:30:40+05:30,2025-04-02T00:00:40,0.0
2 Automobile stocks trading at Low P/E after market correction – Add to Watchlist?,https://www.financialexpress.com/market/stock-insights-2-automobile-stocks-trading-at-low-pe-after-market-correction-add-to-watchlist-3794782/,2025-04-01T06:00:00+05:30,2025-04-01T00:30:00,-0.2732
Auto parts maker to face Trump’s 25% tariff heat,https://www.financialexpress.com/auto/news/auto-parts-maker-to-face-trumps-25-tariff-heat/3793044/,2025-03-30T06:02:15+05:30,2025-03-30T00:32:15,0.0
"Kia India needs to invest Rs 1,400 crore in FY26 to retain PLI incentives",https://www.financialexpress.com/auto/car-news/kia-india-needs-to-invest-rs-1400-crore-in-fy26-to-retain-pli-incentives/3793038/,2025-03-30T05:46:07+05:30,2025-03-30T00:16:07,-0.4404
"Trump Tariff impact: Nomura lists 3 key concerns for Tata Motors, Bharat Forge",https://www.financialexpress.com/market/trump-tariff-impact-nomura-lists-3-key-concerns-for-tata-motors-bharat-forge-3791355/,2025-03-28T14:37:53+05:30,2025-03-28T09:07:53,0.0
"Trump tariff: CLSA lists impact on Tata Motors, Bharat Forge and 2 more",https://www.financialexpress.com/market/trump-tariff-clsa-lists-impact-on-tata-motors-bharat-forge-and-2-more-3790369/,2025-03-27T14:13:40+05:30,2025-03-27T08:43:40,0.0
Trump tariff impact: Tata Motors plummets 5%; Auto Index down 1%,https://www.financialexpress.com/market/trump-auto-tariff-impact-tata-motors-plummets-6-auto-index-down-over-1-3789974/,2025-03-27T15:41:32+05:30,2025-03-27T10:11:32,0.0
"Tata Altroz facelifted spotted, gets new design language",https://www.financialexpress.com/auto/car-news/tata-altroz-facelifted-spotted-gets-new-design-language/3789176/,2025-03-26T14:32:05+05:30,2025-03-26T09:02:05,0.0
5 Cheapest auto stocks in India,https://www.financialexpress.com/market/stock-insights/5-cheapest-auto-stocks-in-india/3786169/,2025-03-24T06:02:00+05:30,2025-03-24T00:32:00,0.0
"Tata Motors, Kia India announce price hikes amid rising costs",https://www.financialexpress.com/auto/car-news/tata-motors-kia-india-announce-price-hikes-amid-rising-costs/3781047/,2025-03-18T20:43:05+05:30,2025-03-18T15:13:05,-0.6369
Tata Motors patents EV Avinya’s steering wheel,https://www.financialexpress.com/auto/car-news/tata-motors-patents-ev-avinyas-steering-wheel/3780618/,2025-03-18T13:41:02+05:30,2025-03-18T08:11:02,0.0
Tata Motors shares jump 2%. What’s driving the rally…,https://www.financialexpress.com/market/tata-motors-shares-jump-2-whats-driving-the-rally-3780431/,2025-03-18T11:20:59+05:30,2025-03-18T05:50:59,0.296
"Tata Motors, Motherson to be hit by Trump tariff, says Moody’s",https://www.financialexpress.com/business/industry/tata-motors-motherson-to-be-hit-by-trump-tariff-says-moodys/3779929/,2025-03-17T20:23:58+05:30,2025-03-17T14:53:58,0.0
"PV and CV prices surge: Maruti Suzuki, Tata Motors announce fresh hikes",https://www.financialexpress.com/auto/car-news/pv-and-cv-prices-surge-maruti-suzuki-tata-motors-announce-fresh-hikes/3779845/,2025-03-17T18:18:48+05:30,2025-03-17T12:48:48,0.3182
Tata Harrier EV updated design patented ahead of launch,https://www.financialexpress.com/auto/car-news/tata-harrier-ev-updated-design-patented-ahead-of-launch/3779202/,2025-03-17T11:17:48+05:30,2025-03-17T05:47:48,0.0
"Tata Sierra spotted testing again, new details emerge",https://www.financialexpress.com/auto/car-news/tata-sierra-spotted-testing-again-new-details-emerge/3777415/,2025-03-14T09:53:33+05:30,2025-03-14T04:23:33,0.0
2025 Tata Tiago NRG launched at Rs 7.20 lakh: Here’s what’s new,https://www.financialexpress.com/auto/car-news/2025-tata-tiago-nrg-launched-at-rs-7-20-lakh-heres-whats-new/3776799/,2025-03-13T15:56:01+05:30,2025-03-13T10:26:01,0.128
"Markets end lower ahead of Holi: Nifty below 22,400, Sensex slips 200 points",https://www.financialexpress.com/market/markets-end-lower-ahead-of-holi-nifty-below-22400-sensex-slips-200-points-shriram-finance-hero-motocorp-major-losers-3776797/,2025-03-13T15:49:03+05:30,2025-03-13T10:19:03,0.128
Jaguar Land Rover scraps EV production in India: What went wrong?,https://www.financialexpress.com/auto/car-news/jaguar-land-rover-scraps-ev-production-in-india-what-went-wrong/3776626/,2025-03-13T13:13:30+05:30,2025-03-13T07:43:30,-0.4767
New Tata Harrier EV teaser drops: Top features revealed,https://www.financialexpress.com/auto/car-news/new-tata-harrier-ev-teaser-drops-top-features-revealed/3776584/,2025-03-13T12:41:59+05:30,2025-03-13T07:11:59,-0.0516
5 Value Stocks Poised for Strong Performance Through 2030,https://www.financialexpress.com/market/stock-insights/5-value-stocks-poised-for-strong-performance-through-2030/3775581/,2025-03-13T06:00:00+05:30,2025-03-13T00:30:00,0.7717
Three auto stocks potentially at bargain buying point,https://www.financialexpress.com/market/stock-insights/three-auto-stocks-potentially-at-bargain-buying-point/3775940/,2025-03-13T06:00:00+05:30,2025-03-13T00:30:00,0.2023
Tata Sierra patent reveals final production spec details,https://www.financialexpress.com/auto/car-news/tata-sierra-patent-reveals-final-production-spec-details/3773522/,2025-03-10T19:00:09+05:30,2025-03-10T13:30:09,0.0
Zero tariff demand: Auto stocks in focus ahead of Tesla’s India entry,https://www.financialexpress.com/market/zero-tariff-demand-auto-stocks-in-focus-ahead-of-teslas-india-entry-3769095/,2025-03-06T10:55:09+05:30,2025-03-06T05:25:09,-0.128
Tata Harrier EV caught testing for the first time,https://www.financialexpress.com/auto/electric-vehicles/tata-harrier-ev-caught-testing-for-the-first-time/3763491/,2025-02-28T16:08:04+05:30,2025-02-28T10:38:04,0.0
"Mahindra Scorpio N Carbon vs Tata Safari Stealth – Price, Performance, Features",https://www.financialexpress.com/auto/car-news/mahindra-scorpio-n-carbon-vs-tata-safari-stealth-price-performance-features/3762093/,2025-02-27T13:57:12+05:30,2025-02-27T08:27:12,-0.0772
Tata Safari Stealth Edition launched — Limited to 2700 units,https://www.financialexpress.com/auto/car-news/tata-safari-stealth-edition-launched-limited-to-2700-units/3756536/,2025-02-21T18:06:05+05:30,2025-02-21T12:36:05,-0.1779
Tata Harrier Stealth Edition launched at Rs 25.09 lakh,https://www.financialexpress.com/auto/car-news/tata-harrier-stealth-edition-launched-at-rs-25-09-lakh/3756502/,2025-02-21T16:27:36+05:30,2025-02-21T10:57:36,0.0516
5 reasons why CLSA upgraded Tata Motors to ‘high conviction Outperform’,https://www.financialexpress.com/market/5-reasons-why-clsa-upgraded-tata-motors-to-high-conviction-outperform-3756031/,2025-02-21T09:50:13+05:30,2025-02-21T04:20:13,0.0
Tata Motors offers unbeatable EV deals amid Tesla collab talks,https://www.financialexpress.com/auto/electric-vehicles/tata-motors-offers-unbeatable-ev-deals-amid-tesla-collab-talks/3755367/,2025-02-20T15:08:56+05:30,2025-02-20T09:38:56,0.0
Tata Sierra spotted testing for first time,https://www.financialexpress.com/auto/car-news/tata-sierra-spotted-testing-for-first-time/3755019/,2025-02-20T11:30:20+05:30,2025-02-20T06:00:20,0.0
Tata Motors shares in focus on buzz of partnership with Tesla,https://www.financialexpress.com/market/tata-motors-shares-in-focus-on-buzz-of-partnership-with-tesla-3754839/,2025-02-20T08:33:57+05:30,2025-02-20T03:03:57,0.296
Tata Nexon EV 40 kWh LR variants discontinued,https://www.financialexpress.com/auto/car-news/tata-nexon-ev-40-kwh-lr-variants-discontinued/3754393/,2025-02-19T18:49:27+05:30,2025-02-19T13:19:27,0.0
"Tata Curvv, Curvv EV attract discounts up to Rs 50k : Here’s why",https://www.financialexpress.com/auto/car-news/tata-curvv-curvv-ev-attract-discounts-up-to-rs-50k-heres-why/3751576/,2025-02-17T11:06:02+05:30,2025-02-17T05:36:02,0.3612
Tata Curvv shows its strength pulls — 48 tonne Boeing 737,https://www.financialexpress.com/auto/car-news/tata-curvv-shows-its-strength-pulls-48-tonne-boeing-737/3749360/,2025-02-14T15:44:15+05:30,2025-02-14T10:14:15,0.4939
"No more range anxiety: Tata.ev to install 400,000 charging points in India",https://www.financialexpress.com/auto/electric-vehicles/no-more-range-anxiety-tata-ev-to-install-400000-charging-points-in-india/3748376/,2025-02-13T16:07:12+05:30,2025-02-13T10:37:12,-0.4902
"Tata Safari Stealth Edition launched: Price, Specs, Features",https://www.financialexpress.com/auto/car-news/tata-safari-stealth-edition-launched-price-specs-features/3748242/,2025-02-13T14:25:29+05:30,2025-02-13T08:55:29,0.0516
"Tata Harrier Stealth Edition launched: Price, Features, Specs",https://www.financialexpress.com/auto/car-news/tata-harrier-stealth-edition-launched-price-features-specs/3748116/,2025-02-13T12:31:04+05:30,2025-02-13T07:01:04,0.0516
