headline,link,date_str,parsed_date_iso,sentiment_score
"Tata Power signs MoU to install 5,000 EV chargers in Maharashtra",https://www.financialexpress.com/auto/electric-vehicles/tata-power-signs-mou-to-install-5000-ev-chargers-in-maharashtra/2508017/,2022-04-29T16:52:45+05:30,2022-04-29T11:22:45,0.0
How electric vehicle push is reshaping energy and auto sector on Dalal Street,https://www.financialexpress.com/market/cafeinvest-how-electric-vehicle-push-is-reshaping-energy-and-auto-sector-on-dalal-street-2504026/,2022-04-26T15:30:38+05:30,2022-04-26T10:00:38,0.2732
"Tata Power takes Adani to Supreme Court over Rs 7,000-crore transmission contract",https://www.financialexpress.com/business/industry-tata-power-takes-adani-to-supreme-court-over-rs-7000-crore-transmission-contract-2500900/,2022-04-23T01:00:00+05:30,2022-04-22T19:30:00,0.5574
"Stocks to buy: Charts favour Tata Power, Ramco Cements shares for as much as 37% upside in 3-6 months",https://www.financialexpress.com/market/stocks-to-buy-charts-favour-tata-power-ramco-cements-shares-for-as-much-as-37-upside-in-3-6-months-2497826/,2022-04-20T14:47:41+05:30,2022-04-20T09:17:41,0.6249
Tata Power rating – Buy: Stake sale to fast-track growth of RE business,https://www.financialexpress.com/market/tata-power-rating-buy-stake-sale-to-fast-track-growth-of-re-business-2495616/,2022-04-19T04:15:00+05:30,2022-04-18T22:45:00,0.3818
"Tata Power arm raises Rs 4,000 crore from Blackrock, Mubadala; Renewable platform to be one of the largest",https://www.financialexpress.com/business/industry-tata-power-arm-raises-rs-4000-crore-from-blackrock-mubadala-renewable-platform-to-be-one-of-the-largest-2492372/,2022-04-15T05:00:00+05:30,2022-04-14T23:30:00,0.0
Changing dynamics: Another power crisis may be looming and it could be much graver,https://www.financialexpress.com/policy/economy-changing-dynamics-another-power-crisis-may-be-looming-and-it-could-be-much-graver-2480403/,2022-04-04T04:40:00+05:30,2022-04-03T23:10:00,-0.6808
"Tata Power, Adani set to pass on high fuel cost to Mumbai consumers",https://www.financialexpress.com/business/industry-tata-power-adani-set-to-pass-on-high-fuel-cost-to-mumbai-consumers-2476895/,2022-03-31T05:40:00+05:30,2022-03-31T00:10:00,0.0
Tata Power signs MoU with Enviro to deploy 59 EV charging points in Gurugram,https://www.financialexpress.com/business/express-mobility-tata-power-signs-mou-with-enviro-to-deploy-59-ev-charging-points-in-gurugram-2457785/,2022-03-11T10:21:01+05:30,2022-03-11T04:51:01,0.0
Tata Power’s Indonesian mining permit renewed for 10 years,https://www.financialexpress.com/business/industry-tata-powers-indonesian-mining-permit-renewed-for-10-years-2455742/,2022-03-10T00:15:00+05:30,2022-03-09T18:45:00,0.0
Two new corridors to help Mumbai source cheaper power,https://www.financialexpress.com/policy/economy-two-new-corridors-to-help-mumbai-source-cheaper-power-2450652/,2022-03-04T08:58:26+05:30,2022-03-04T03:28:26,0.4019
Living with an electric car…,https://www.financialexpress.com/auto/electric-vehicles/living-with-an-electric-car/3808676/,2025-04-13T23:04:07+05:30,2025-04-13T17:34:07,0.0
Top 5 best-selling SUVs in August 2024,https://www.financialexpress.com/auto/car-news/top-5-best-selling-suvs-in-august-2024/3606466/,2024-09-10T08:48:56+05:30,2024-09-10T03:18:56,0.2023
Top 5 SUVs in July: Hyundai Creta dethrones Tata Punch,https://www.financialexpress.com/auto/car-news/top-5-suvs-in-july-hyundai-creta-dethrones-tata-punch/3576084/,2024-08-07T12:49:41+05:30,2024-08-07T07:19:41,0.2023
"Tata Nexon, Punch become the highest-selling SUVs in FY24: Here’s why?",https://www.financialexpress.com/auto/car-news/tata-nexon-punch-become-the-highest-selling-suvs-in-fy24-heres-why/3537749/,2024-06-28T12:55:13+05:30,2024-06-28T07:25:13,0.0
Tata Punch EV secures 5-star rating in BNCAP crash test,https://www.financialexpress.com/auto/electric-vehicles/tata-punch-ev-secures-5-star-rating-in-bncap-crash-test/3523810/,2024-08-06T23:34:00+05:30,2024-08-06T18:04:00,-0.1027
Must for India to build its own AI: Tata Sons chief Outlines key layers & pillars to achieve it,https://www.financialexpress.com/life/technology/must-for-india-to-build-its-own-ai-tata-sons-chief-outlines-key-layers-amp-pillars-to-achieve-it/3763784/,2025-03-01T02:30:00+05:30,2025-02-28T21:00:00,0.0
Tata Sons may explore IPO option amidst rising pressure from Shapoorji Pallonji Group,https://www.financialexpress.com/market/ipo-news-tata-sons-may-explore-ipo-option-amidst-rising-pressure-from-shapoorji-pallonji-group-3723682/,2025-01-23T12:49:18+05:30,2025-01-23T07:19:18,-0.296
Tata Sons listing hangs in balance,https://www.financialexpress.com/business/banking-finance-tata-sons-listing-hangs-in-balance-3717483/,2025-01-17T06:00:00+05:30,2025-01-17T00:30:00,0.0
"Air India set to transform into world-class airline, says Tata Sons chairman N Chandrasekaran",https://www.financialexpress.com/business/airlines-aviation-air-india-set-to-transform-into-world-class-airline-says-tata-sons-chairman-n-chandrasekaran-3707502/,2025-01-05T09:13:27+05:30,2025-01-05T03:43:27,0.0
Air India-Vistara merger: Will your Club Vistara CV points remain valid after closing of deal? Here’s all you need to know,https://www.financialexpress.com/money/air-india-vistara-merger-will-your-club-vistara-cv-points-remain-valid-after-closing-of-deal-heres-all-you-need-to-know-3491811/,2024-05-17T16:44:58+05:30,2024-05-17T11:14:58,0.0
"Meet Firoz and Zahan Mistry, youngest billionaire brothers with a combined net worth exceeding Rs 9 lakh crore; Know how they are linked with Cyrus Mistry",https://www.financialexpress.com/life/lifestyle-meet-firoz-and-zahan-mistry-youngest-billionaire-brothers-with-a-combined-net-worth-exceeding-rs-9-lakh-crore-know-how-they-are-linked-with-cyrus-mistry-3452639/,2024-04-10T16:58:31+05:30,2024-04-10T11:28:31,0.2263
Tata Sons to sell 2.34 crore shares in TCS through block deals: Report,https://www.financialexpress.com/business/industry-tata-sons-to-sell-2-34-crore-shares-in-tcs-through-block-deals-report-3429096/,2024-03-18T17:11:42+05:30,2024-03-18T11:41:42,-0.1779
Markets jittery over some Tata stocks,https://www.financialexpress.com/market/markets-jittery-over-some-tata-stocks-3420564/,2024-03-11T06:30:00+05:30,2024-03-11T01:00:00,0.0
"Don’t skirt IPO, Tata Sons",https://www.financialexpress.com/opinion/dont-skirt-ipo-tata-sons/3420561/,2024-03-11T03:30:00+05:30,2024-03-10T22:00:00,0.0
"Six NBFCs must list in the next year, say experts",https://www.financialexpress.com/market/six-nbfcs-must-list-in-the-next-year-say-experts-3420538/,2024-03-11T00:15:00+05:30,2024-03-10T18:45:00,0.0
Airbus and Tata Group join forces for helicopter manufacturing hub in India,https://www.financialexpress.com/business/defence-airbus-and-tata-group-join-forces-for-helicopter-manufacturing-hub-in-india-3376058/,2024-01-26T17:34:08+05:30,2024-01-26T12:04:08,0.296
Tata unit Agratas in India is in talks for green loan of up to $500 million,https://www.financialexpress.com/business/industry-tata-unit-agratas-in-india-is-in-talks-for-green-loan-of-up-to-500-million-3367705/,2024-01-18T10:25:37+05:30,2024-01-18T04:55:37,0.0
"Tata Sons chairman warns of more disruption, volatility in new year",https://www.financialexpress.com/business/industry-tata-sons-chairman-warns-of-more-disruption-volatility-in-new-year-3350181/,2023-12-29T02:10:00+05:30,2023-12-28T20:40:00,-0.4927
From Ambani to Adani: Here’s a list of 7 ultra-rich business families of India and their net worth,https://www.financialexpress.com/life/lifestyle-from-ambani-to-adani-heres-a-list-of-7-ultra-rich-business-families-of-india-and-their-net-worth-3209289/,2023-09-22T09:50:24+05:30,2023-09-22T04:20:24,0.2263
"Meet Shapoor Mistry: The elder brother of Cyrus Mistry, who is taking forward the 155-year-old Shapoorji Pallonji Group; know about his life and net worth",https://www.financialexpress.com/life/lifestyle-meet-shapoor-mistry-the-business-scion-and-elder-brother-of-cyrus-mistry-who-is-taking-forward-the-155-year-old-shapoorji-pallonji-group-recovering-from-two-massive-losses-know-about-his-life-and-net-3236269/,2023-09-12T10:21:00+05:30,2023-09-12T04:51:00,0.2263
"Tata Sons shareholders okay dividend payment, directors appointment",https://www.financialexpress.com/business/industry/tata-sons-shareholders-okay-dividend-payment-directors-appointment/3226834/,2023-08-30T05:25:00+05:30,2023-08-29T23:55:00,0.2263
"Meet Xerxes Desai, the man behind Titan and Tanishq: He worked closely with JRD Tata and Ex-PM Rajiv Gandhi; His ad jingle is still used in Alia Bhatt’s new campaign",https://www.financialexpress.com/life/lifestyle-meet-xerxes-desai-the-man-behind-titan-and-tanishq-he-worked-closely-with-jrd-tata-and-ex-pm-rajiv-gandhi-his-ad-jingle-is-still-used-in-the-alia-bhatts-new-campaign-3212106/,2023-08-19T10:39:43+05:30,2023-08-19T05:09:43,0.0
Former TCS CEO Rajesh Gopinathan’s pay jumped 13.17 pc to Rs 29.16 crore in FY23,https://www.financialexpress.com/business/industry-former-tcs-ceo-rajesh-gopinathans-pay-jumped-13-17-pc-to-rs-2916-crore-in-fy23-3116971/,2023-06-07T15:31:03+05:30,2023-06-07T10:01:03,-0.1027
SP Group to raise funds by pledging Tata Sons’ shares,https://www.financialexpress.com/business/industry-sp-group-to-raise-funds-by-pledging-tata-sons-shares-3037173/,2023-04-07T02:00:00+05:30,2023-04-06T20:30:00,0.296
Rajesh Gopinathan to stay at TCS beyond September? Chairman Chandra discusses advisory role for outgoing CEO,https://www.financialexpress.com/business/industry-rajesh-gopinathan-to-stay-at-tcs-beyond-september-chairman-chandra-discusses-advisory-role-for-outgoing-ceo-3017203/,2023-03-21T12:02:00+05:30,2023-03-21T06:32:00,0.296
"What is Tata Son’s CFO Saurabh Agrawal’s monthly salary? Know about his life, family & education",https://www.financialexpress.com/life/lifestyle-what-is-tata-sons-cfo-saurabh-agrawals-monthly-salary-know-about-his-life-family-education-3016516/,2023-03-21T01:30:04+05:30,2023-03-20T20:00:04,0.0
Air India confident on funding for world’s biggest aircraft deal; CEO flaunts Tata name,https://www.financialexpress.com/business/industry-air-india-confident-on-funding-for-worlds-biggest-aircraft-deal-ceo-flaunts-tata-name-3016509/,2023-03-20T17:44:56+05:30,2023-03-20T12:14:56,0.4939
Tata Sons’ sustainability chief Sharma to be its Trusts’ CEO,https://www.financialexpress.com/business/industry-tata-sons-sustainability-chief-sharma-to-be-its-trusts-ceo-2959142/,2023-01-24T21:15:44+05:30,2023-01-24T15:45:44,0.0
"Tata veteran RK Krishnakumar dies at 84; ‘will sorely miss him,’ says Tata Sons Chairman N Chandrasekaran",https://www.financialexpress.com/business/industry-tata-veteran-rk-krishnakumar-dies-at-84-will-sorely-miss-him-says-tata-sons-chairman-n-chandrasekaran-2933494/,2023-01-01T23:30:06+05:30,2023-01-01T18:00:06,-0.1531
Tata Communications arm to acquire US-based video production company for Rs 486 cr,https://www.financialexpress.com/business/industry-tata-communications-arm-to-acquire-us-based-video-production-company-for-rs-486-cr-2923636/,2022-12-23T00:30:00+05:30,2022-12-22T19:00:00,0.0
Reform will propel fundamentals of India’s performance in coming decades: Tata Sons Chairman N Chandrasekaran,https://www.financialexpress.com/business/industry-reform-will-propel-fundamentals-of-indias-performance-in-coming-decades-says-tata-sons-chairman-n-chandrasekaran-2915652/,2022-12-16T13:06:14+05:30,2022-12-16T07:36:14,0.0
SIA’s financial outlay for Vistara-Air India merger ‘minimal’ considering 25.1 pc stake buy in AI: Filing,https://www.financialexpress.com/business/industry-sias-financial-outlay-for-vistara-air-india-merger-minimal-considering-25-1-pc-stake-buy-in-ai-filing-2896643/,2022-11-30T14:01:47+05:30,2022-11-30T08:31:47,0.0
Why Bisleri is a good fit for the Tatas,https://www.financialexpress.com/business/industry-why-bisleri-is-a-good-fit-for-the-tatas-2890618/,2022-11-25T05:30:00+05:30,2022-11-25T00:00:00,0.6597
"Focus on steady cash flows, don’t chase valuations: Tata Sons Chairman tells entrepreneurs",https://www.financialexpress.com/business/industry-focus-on-steady-cash-flows-dont-chase-valuations-tata-sons-chairman-tells-entrepreneurs-2890623/,2022-11-24T21:52:28+05:30,2022-11-24T16:22:28,0.0
"Deal to create India’s second largest airline: SIA, Tatas talk AI-Vistara merger",https://www.financialexpress.com/business/industry-deal-to-create-indias-second-largest-airline-sia-tatas-talk-ai-vistara-merger-2709704/,2022-10-14T06:30:00+05:30,2022-10-14T01:00:00,0.2732
Tata Capital vs Siva Industries: SC extends tenure of tribunal till March 31,https://www.financialexpress.com/business/industry-tata-capital-vs-siva-industries-sc-extends-tenure-of-tribunal-till-march-31-2698493/,2022-10-03T05:45:00+05:30,2022-10-03T00:15:00,0.128
"Tatas evaluating options to consolidate AirAsia India, Vistara under Air India: Sources",https://www.financialexpress.com/business/industry-tatas-evaluating-options-to-consolidate-airasia-india-vistara-under-air-india-sources-2681387/,2022-09-21T18:24:50+05:30,2022-09-21T12:54:50,0.0
Tata Administrative Service: Here’s the book review on six-decade old journey of leadership programme,https://www.financialexpress.com/life/lifestyle-tata-administrative-service-heres-the-book-review-on-six-decade-old-journey-of-leadership-programme-2671831/,2022-09-18T00:55:00+05:30,2022-09-17T19:25:00,0.0
"Cyrus Mistry cremated in Mumbai; business leaders, politicians pay last respects",https://www.financialexpress.com/india-news/cyrus-mistry-cremated-in-mumbai-business-leaders-politicians-pay-last-respects/2656894/,2022-09-06T13:23:02+05:30,2022-09-06T07:53:02,0.2263
"Cyrus Mistry car crash: Injured woman to undergo surgery, her husband admitted to ICU",https://www.financialexpress.com/india-news/cyrus-mistry-car-accident-injured-woman-to-undergo-surgery-her-husband-admitted-to-icu/2655606/,2022-09-05T12:39:31+05:30,2022-09-05T07:09:31,-0.6124
India Inc mourns Cyrus Mistry’s untimely demise,https://www.financialexpress.com/business/express-mobility-india-inc-mourns-cyrus-mistrys-untimely-demise-2655157/,2022-09-04T22:29:17+05:30,2022-09-04T16:59:17,-0.5267
All resolutions passed at Tata AGM; AoA modified,https://www.financialexpress.com/business/industry-all-resolutions-passed-at-tata-agm-aoa-modified-2649996/,2022-08-31T05:45:00+05:30,2022-08-31T00:15:00,0.0
Trent back in black with Rs 115-cr profit,https://www.financialexpress.com/business/industry-trent-back-in-black-with-rs-115-cr-profit-2626679/,2022-08-12T03:45:00+05:30,2022-08-11T22:15:00,0.4404
"Tata Sons FY22 net rises 164% to Rs 17,171 crore",https://www.financialexpress.com/business/industry-tata-sons-fy22-net-rises-164-to-rs-17171-crore-2625475/,2022-08-11T05:40:00+05:30,2022-08-11T00:10:00,0.0
"India at 75: Family businesses that reform, rethink and reinvent, rule",https://www.financialexpress.com/business/industry-india-at-75-family-businesses-that-reform-rethink-and-reinvent-rule-2625086/,2022-08-10T19:04:00+05:30,2022-08-10T13:34:00,0.0
"Six months under Tata Group, Air India stabilising",https://www.financialexpress.com/business/industry-six-months-under-tata-group-air-india-stabilising-2612633/,2022-08-01T02:10:00+05:30,2022-07-31T20:40:00,0.0
Scale of tech adoption shows it has become a behavioural change: Tata Sons chairman N Chandrasekaran,https://www.financialexpress.com/business/industry-scale-of-tech-adoption-shows-it-has-become-a-behavioural-change-tata-sons-chairman-n-chandrasekaran-2593068/,2022-07-14T00:15:00+05:30,2022-07-13T18:45:00,0.0
Tatas pick Amadeus’ passenger reservation system for Air India,https://www.financialexpress.com/business/industry-tatas-pick-amadeus-passenger-reservation-system-for-air-india-2582857/,2022-07-05T05:45:00+05:30,2022-07-05T00:15:00,0.0
Tata Steel to ramp up NINL operation to 1.1 MTPA within a year: N Chandrasekaran,https://www.financialexpress.com/business/industry-tata-steel-to-ramp-up-ninl-operation-to-1-1-mtpa-within-a-year-n-chandrasekaran-2575749/,2022-06-28T18:45:02+05:30,2022-06-28T13:15:02,0.0
"Tata, Adani among 5 to exit Reliance Capital’s resolution; Piramal Enterprises among bidders left in race",https://www.financialexpress.com/business/industry-tata-adani-among-5-to-exit-reliance-capitals-resolution-piramal-enterprises-among-bidders-left-in-race-2573458/,2022-06-27T04:30:00+05:30,2022-06-26T23:00:00,0.0
Air India offers to re-hire pilots post retirement for 5 years,https://www.financialexpress.com/business/industry-air-india-offers-to-re-hire-pilots-post-retirement-for-5-years-2570873/,2022-06-23T19:32:56+05:30,2022-06-23T14:02:56,0.0
Digital India Act necessary as IT Act is over two decades old: Tata Sons Chairman N Chandrasekaran,https://www.financialexpress.com/business/industry-digital-india-act-necessary-as-it-act-is-over-two-decades-old-tata-sons-chairman-n-chandrasekaran-2554820/,2022-06-09T21:19:51+05:30,2022-06-09T15:49:51,0.0
Tatas’ Air India buy hits Singapore antitrust wall; conglomerate owns two of three key airlines,https://www.financialexpress.com/business/industry-tatas-air-india-buy-hits-singapore-antitrust-wall-conglomerate-owns-two-of-three-key-airlines-2548132/,2022-06-04T01:45:00+05:30,2022-06-03T20:15:00,0.0
Campbell Wilson to pilot Tata Sons-owned Air India,https://www.financialexpress.com/business/industry-campbell-wilson-to-pilot-tata-sons-owned-air-india-2521529/,2022-05-13T04:30:00+05:30,2022-05-12T23:00:00,0.0
"Tata Sons chief N Chandrasekaran to add ‘sustainability’, ‘speed’ as themes during his second term at the conglomerate",https://www.financialexpress.com/business/industry-synergy-simplification-key-themes-tata-sons-chief-n-chandrasekaran-2521081/,2022-05-12T07:39:29+05:30,2022-05-12T02:09:29,0.0
Tata Consumer Q4 profit rises three-fold to Rs 239 crore,https://www.financialexpress.com/business/industry-tata-consumer-q4-profit-rises-three-fold-to-rs-239-crore-2513218/,2022-05-05T03:00:00+05:30,2022-05-04T21:30:00,0.4404
Tata Sons shareholders approve Chandrasekaran’s reappointment as chairman; Shapoorji Pallonji family abstains from vote,https://www.financialexpress.com/business/industry-tata-sons-shareholders-approve-chandrasekarans-reappointment-as-chairman-shapoorji-pallonji-family-abstains-from-vote-2504324/,2022-04-26T18:38:55+05:30,2022-04-26T13:08:55,0.0
Mistry family abstains from voting for Tata Sons chairman,https://www.financialexpress.com/business/industry-mistry-family-abstains-from-voting-for-tata-sons-chairman-2503230/,2022-04-26T00:39:58+05:30,2022-04-25T19:09:58,0.0
The rise of super apps: Tata Neu is making news in the super app space,https://www.financialexpress.com/life/technology-the-rise-of-super-apps-tata-neu-is-making-news-in-the-super-app-space-2493520/,2022-04-17T03:30:00+05:30,2022-04-16T22:00:00,0.8316
Tata Digital launches super app Tata Neu,https://www.financialexpress.com/business/industry-tata-digital-launches-super-app-2485124/,2022-04-08T03:45:00+05:30,2022-04-07T22:15:00,0.5994
"Tata Communications, Trent among 7 midcap stocks to buy, charts show stocks may resume uptrend now",https://www.financialexpress.com/market/tata-communications-trent-among-7-midcap-stocks-to-buy-charts-show-stocks-may-resume-uptrend-now-2482172/,2022-04-05T12:54:08+05:30,2022-04-05T07:24:08,0.0
"Noel Naval Tata, Vice Chairman, Tata Steel: Stepping into the limelight, slowly",https://www.financialexpress.com/business/industry-noel-naval-tata-vice-chairman-tata-steel-stepping-into-the-limelight-slowly-2476942/,2022-03-31T02:50:00+05:30,2022-03-30T21:20:00,0.0
Tata Group firm Nelco partners Omnispace for satellite services,https://www.financialexpress.com/business/industry-tata-group-firm-nelco-partners-omnispace-for-satellite-services-2469946/,2022-03-24T04:50:00+05:30,2022-03-23T23:20:00,0.0
China Eastern crash: What steps has DGCA taken to ensure safety of Boeing 737 fleet in India?,https://www.financialexpress.com/business/airlines-aviation-china-eastern-crash-what-steps-has-dgca-taken-to-ensure-safety-of-boeing-737-fleet-in-india-2469172/,2022-03-23T16:13:03+05:30,2022-03-23T10:43:03,0.4019
Tata Sons appoints N Chandrasekaran as chairman of Air India,https://www.financialexpress.com/business/industry-tata-sons-appoints-n-chandrasekaran-as-chairman-of-air-india-2460956/,2022-03-15T02:15:00+05:30,2022-03-14T20:45:00,0.0
Tata Sons Chairman N Chandrasekaran appointed Air India Chairman,https://www.financialexpress.com/business/industry-tata-sons-chairman-n-chandrasekaran-appointed-air-india-chairman-2460590/,2022-03-14T18:26:41+05:30,2022-03-14T12:56:41,0.0
Intolerance for expat CEOs is bad advertisement for India,https://www.financialexpress.com/opinion/intolerance-for-expat-ceos-is-bad-advertisement-for-india/2454530/,2022-03-09T05:15:00+05:30,2022-03-08T23:45:00,-0.5423
"TCS’ Rs 18,000-crore share buyback to open on March 9",https://www.financialexpress.com/market/tcs-rs-18000-crore-share-buyback-to-open-on-march-9-2453265/,2022-03-07T18:31:32+05:30,2022-03-07T13:01:32,0.296
Tata Sons steps up effort to find new boss for Air India,https://www.financialexpress.com/business/industry-tatas-steps-up-effort-to-find-new-boss-for-air-india-2450279/,2022-03-04T11:47:17+05:30,2022-03-04T06:17:17,0.0
Tata Steel will double India capacity to 40 million tonne: Chandrasekaran,https://www.financialexpress.com/business/industry-tata-steel-will-double-india-capacity-to-40-million-tonne-chandrasekaran-2450274/,2022-03-04T00:24:58+05:30,2022-03-03T18:54:58,0.0
"We plan to play on the front foot in FY23 to keep the momentum going: Ashok Sonthalia, chief financial officer, Titan",https://www.financialexpress.com/business/industry-we-plan-to-play-on-the-front-foot-in-fy23-to-keep-the-momentum-going-ashok-sonthalia-chief-financial-officer-titan-2449414/,2022-03-03T05:30:00+05:30,2022-03-03T00:00:00,0.34
Ilker Ayci turns down Tata group’s offer to be Air India CEO with ‘heavy heart’,https://www.financialexpress.com/business/industry-ilker-ayci-turns-down-tata-groups-offer-to-be-air-india-ceo-with-heavy-heart-2448202/,2022-03-02T01:45:00+05:30,2022-03-01T20:15:00,0.0
"Ilker Ayci declines to be CEO & MD of Air India, accuses sections of Indian media of undesirable narrative",https://www.financialexpress.com/business/industry-turkeys-ilker-ayci-declines-air-india-ceo-md-offer-after-opposition-to-appointment-in-india-2447629/,2022-03-01T15:30:20+05:30,2022-03-01T10:00:20,-0.6486
Tata Sons case: Cyrus Mistry moves Supreme Court to expunge adverse remarks in March 2021 verdict,https://www.financialexpress.com/business/industry-tata-sons-case-cyrus-mistry-moves-supreme-court-to-expunge-adverse-remarks-in-march-2021-verdict-2447290/,2022-03-01T01:45:00+05:30,2022-02-28T20:15:00,0.4019
MHA to ‘scrupulously’ carry out background check of newly appointed Air India CEO,https://www.financialexpress.com/business/industry-mha-to-scrupulously-carry-out-background-check-of-newly-appointed-air-india-ceo-2439451/,2022-02-20T17:38:11+05:30,2022-02-20T12:08:11,0.0
Tata Group brands touch all online shoppers; Tata Digital will stitch all assets: Mukesh Bansal,https://www.financialexpress.com/business/industry-tata-group-brands-touch-all-online-shoppers-tata-digital-will-stitch-all-assets-mukesh-bansal-2435891/,2022-02-16T17:18:28+05:30,2022-02-16T11:48:28,0.1779
Tatas name Ilker Ayci as Air India CEO & MD,https://www.financialexpress.com/business/industry-tatas-name-ilker-ayci-as-air-india-ceo-md-2433956/,2022-02-15T03:45:00+05:30,2022-02-14T22:15:00,0.0
Tata Sons appoints former Turkish Airlines chairman Ilker Ayci CEO & MD of Air India,https://www.financialexpress.com/business/industry-tata-sons-appoints-former-turkish-airlines-chairman-ilker-ayci-ceo-md-of-air-india-2433635/,2022-02-14T17:23:23+05:30,2022-02-14T11:53:23,0.0
Tata Sons reappoints N Chandrasekaran as Chairman for 5 more years; board unanimously approves,https://www.financialexpress.com/business/industry-tata-sons-reappoints-n-chandrasekaran-as-chairman-for-5-more-years-board-unanimously-approves-2431328/,2022-02-11T15:53:13+05:30,2022-02-11T10:23:13,0.4019
Tata Power consolidated Q3 operating profit drops 6.62% year- on-year on higher cost of power purchased,https://www.financialexpress.com/business/industry-tata-power-consolidated-q3-operating-profit-drops-6-62-year-on-year-on-higher-cost-of-power-purchased-2429717/,2022-02-10T03:00:00+05:30,2022-02-09T21:30:00,0.4404
Tata Power net up 74% at Rs 552 crore in December quarter,https://www.financialexpress.com/business/industry-tata-power-net-up-74-at-rs-552-crore-in-december-quarter-2429622/,2022-02-09T18:19:06+05:30,2022-02-09T12:49:06,0.0
Tata Steel not under any compulsion to divest European assets: CEO & MD TV Narendran,https://www.financialexpress.com/business/industry-tata-steel-not-under-any-compulsion-to-divest-european-assets-ceo-md-tv-narendran-2428961/,2022-02-09T06:30:00+05:30,2022-02-09T01:00:00,0.1779
"Heavy Metal: Tatas win Neelachal unit for Rs 12,100 crore",https://www.financialexpress.com/business/industry-tatas-win-neelachal-unit-for-rs-12100-crore-2421681/,2022-02-01T03:30:00+05:30,2022-01-31T22:00:00,0.5859
Back Home: Air India handed over to Tatas after 69 years,https://www.financialexpress.com/business/industry-air-india-handed-over-to-tatas-after-69-years-2417778/,2022-01-28T05:30:00+05:30,2022-01-28T00:00:00,0.0
Nation’s eyes on us: Tata Sons chairman Chandrasekaran to Air India employees after takeover,https://www.financialexpress.com/business/industry-nations-eyes-on-us-tata-sons-chairman-chandrasekaran-to-air-india-employees-after-takeover-2417005/,2022-01-27T18:32:38+05:30,2022-01-27T13:02:38,0.0
